B1: Nottinghamshire Badminton Association
B3: Premier Mens | J3: Mens Div 1
B4: League Table | J4: League Table
B5: S T A N D I N G S | C5: p | D5: w | E5: l | F5: rf | G5: ra | H5: pts | J5: S T A N D I N G S | K5: p | L5: w | M5: l | N5: rf | O5: ra | P5: pts
B6: =INDIRECT.EXT("'..\mens\[mens_prem.xls]table calculations'!"&ADDRESS(MOD(ROW($A6)-6,12)+13,64+MOD(COLUMN(B$1)-2,8),4)) -> Bingham 1st | C6: =INDIRECT.EXT("'..\mens\[mens_prem.xls]table calculations'!"&ADDRESS(MOD(ROW($A6)-6,12)+13,64+MOD(COLUMN(C$1)-2,8),4)) -> 5 | D6: =INDIRECT.EXT("'..\mens\[mens_prem.xls]table calculations'!"&ADDRESS(MOD(ROW($A6)-6,12)+13,64+MOD(COLUMN(D$1)-2,8),4)) -> 5 | E6: =INDIRECT.EXT("'..\mens\[mens_prem.xls]table calculations'!"&ADDRESS(MOD(ROW($A6)-6,12)+13,64+MOD(COLUMN(E$1)-2,8),4)) -> 0 | F6: =INDIRECT.EXT("'..\mens\[mens_prem.xls]table calculations'!"&ADDRESS(MOD(ROW($A6)-6,12)+13,64+MOD(COLUMN(F$1)-2,8),4)) -> 39 | G6: =INDIRECT.EXT("'..\mens\[mens_prem.xls]table calculations'!"&ADDRESS(MOD(ROW($A6)-6,12)+13,64+MOD(COLUMN(G$1)-2,8),4)) -> 6 | H6: =INDIRECT.EXT("'..\mens\[mens_prem.xls]table calculations'!"&ADDRESS(MOD(ROW($A6)-6,12)+13,64+MOD(COLUMN(H$1)-2,8)+2,4)) -> 10 | J6: =INDIRECT.EXT("'..\mens\[mens_div1.xls]table calculations'!"&ADDRESS(MOD(ROW($A6)-6,12)+13,64+MOD(COLUMN(J$1)-2,8),4)) -> University 1st | K6: =INDIRECT.EXT("'..\mens\[mens_div1.xls]table calculations'!"&ADDRESS(MOD(ROW($A6)-6,12)+13,64+MOD(COLUMN(K$1)-2,8),4)) -> 4 | L6: =INDIRECT.EXT("'..\mens\[mens_div1.xls]table calculations'!"&ADDRESS(MOD(ROW($A6)-6,12)+13,64+MOD(COLUMN(L$1)-2,8),4)) -> 4 | M6: =INDIRECT.EXT("'..\mens\[mens_div1.xls]table calculations'!"&ADDRESS(MOD(ROW($A6)-6,12)+13,64+MOD(COLUMN(M$1)-2,8),4)) -> 0 | N6: =INDIRECT.EXT("'..\mens\[mens_div1.xls]table calculations'!"&ADDRESS(MOD(ROW($A6)-6,12)+13,64+MOD(COLUMN(N$1)-2,8),4)) -> 29 | O6: =INDIRECT.EXT("'..\mens\[mens_div1.xls]table calculations'!"&ADDRESS(MOD(ROW($A6)-6,12)+13,64+MOD(COLUMN(O$1)-2,8),4)) -> 7 | P6: =INDIRECT.EXT("'..\mens\[mens_div1.xls]table calculations'!"&ADDRESS(MOD(ROW($A6)-6,12)+13,64+MOD(COLUMN(P$1)-2,8)+2,4)) -> 8
B7: =INDIRECT.EXT("'..\mens\[mens_prem.xls]table calculations'!"&ADDRESS(MOD(ROW($A7)-6,12)+13,64+MOD(COLUMN(B$1)-2,8),4)) -> West Bridgford & LE 2nd | C7: =INDIRECT.EXT("'..\mens\[mens_prem.xls]table calculations'!"&ADDRESS(MOD(ROW($A7)-6,12)+13,64+MOD(COLUMN(C$1)-2,8),4)) -> 7 | D7: =INDIRECT.EXT("'..\mens\[mens_prem.xls]table calculations'!"&ADDRESS(MOD(ROW($A7)-6,12)+13,64+MOD(COLUMN(D$1)-2,8),4)) -> 4 | E7: =INDIRECT.EXT("'..\mens\[mens_prem.xls]table calculations'!"&ADDRESS(MOD(ROW($A7)-6,12)+13,64+MOD(COLUMN(E$1)-2,8),4)) -> 3 | F7: =INDIRECT.EXT("'..\mens\[mens_prem.xls]table calculations'!"&ADDRESS(MOD(ROW($A7)-6,12)+13,64+MOD(COLUMN(F$1)-2,8),4)) -> 35 | G7: =INDIRECT.EXT("'..\mens\[mens_prem.xls]table calculations'!"&ADDRESS(MOD(ROW($A7)-6,12)+13,64+MOD(COLUMN(G$1)-2,8),4)) -> 28 | H7: =INDIRECT.EXT("'..\mens\[mens_prem.xls]table calculations'!"&ADDRESS(MOD(ROW($A7)-6,12)+13,64+MOD(COLUMN(H$1)-2,8)+2,4)) -> 8 | J7: =INDIRECT.EXT("'..\mens\[mens_div1.xls]table calculations'!"&ADDRESS(MOD(ROW($A7)-6,12)+13,64+MOD(COLUMN(J$1)-2,8),4)) -> Mapperley Park 1st | K7: =INDIRECT.EXT("'..\mens\[mens_div1.xls]table calculations'!"&ADDRESS(MOD(ROW($A7)-6,12)+13,64+MOD(COLUMN(K$1)-2,8),4)) -> 5 | L7: =INDIRECT.EXT("'..\mens\[mens_div1.xls]table calculations'!"&ADDRESS(MOD(ROW($A7)-6,12)+13,64+MOD(COLUMN(L$1)-2,8),4)) -> 4 | M7: =INDIRECT.EXT("'..\mens\[mens_div1.xls]table calculations'!"&ADDRESS(MOD(ROW($A7)-6,12)+13,64+MOD(COLUMN(M$1)-2,8),4)) -> 1 | N7: =INDIRECT.EXT("'..\mens\[mens_div1.xls]table calculations'!"&ADDRESS(MOD(ROW($A7)-6,12)+13,64+MOD(COLUMN(N$1)-2,8),4)) -> 35 | O7: =INDIRECT.EXT("'..\mens\[mens_div1.xls]table calculations'!"&ADDRESS(MOD(ROW($A7)-6,12)+13,64+MOD(COLUMN(O$1)-2,8),4)) -> 10 | P7: =INDIRECT.EXT("'..\mens\[mens_div1.xls]table calculations'!"&ADDRESS(MOD(ROW($A7)-6,12)+13,64+MOD(COLUMN(P$1)-2,8)+2,4)) -> 8
B8: =INDIRECT.EXT("'..\mens\[mens_prem.xls]table calculations'!"&ADDRESS(MOD(ROW($A8)-6,12)+13,64+MOD(COLUMN(B$1)-2,8),4)) -> Byron 1st | C8: =INDIRECT.EXT("'..\mens\[mens_prem.xls]table calculations'!"&ADDRESS(MOD(ROW($A8)-6,12)+13,64+MOD(COLUMN(C$1)-2,8),4)) -> 4 | D8: =INDIRECT.EXT("'..\mens\[mens_prem.xls]table calculations'!"&ADDRESS(MOD(ROW($A8)-6,12)+13,64+MOD(COLUMN(D$1)-2,8),4)) -> 3 | E8: =INDIRECT.EXT("'..\mens\[mens_prem.xls]table calculations'!"&ADDRESS(MOD(ROW($A8)-6,12)+13,64+MOD(COLUMN(E$1)-2,8),4)) -> 1 | F8: =INDIRECT.EXT("'..\mens\[mens_prem.xls]table calculations'!"&ADDRESS(MOD(ROW($A8)-6,12)+13,64+MOD(COLUMN(F$1)-2,8),4)) -> 24 | G8: =INDIRECT.EXT("'..\mens\[mens_prem.xls]table calculations'!"&ADDRESS(MOD(ROW($A8)-6,12)+13,64+MOD(COLUMN(G$1)-2,8),4)) -> 12 | H8: =INDIRECT.EXT("'..\mens\[mens_prem.xls]table calculations'!"&ADDRESS(MOD(ROW($A8)-6,12)+13,64+MOD(COLUMN(H$1)-2,8)+2,4)) -> 6 | J8: =INDIRECT.EXT("'..\mens\[mens_div1.xls]table calculations'!"&ADDRESS(MOD(ROW($A8)-6,12)+13,64+MOD(COLUMN(J$1)-2,8),4)) -> Bingham 3rd | K8: =INDIRECT.EXT("'..\mens\[mens_div1.xls]table calculations'!"&ADDRESS(MOD(ROW($A8)-6,12)+13,64+MOD(COLUMN(K$1)-2,8),4)) -> 4 | L8: =INDIRECT.EXT("'..\mens\[mens_div1.xls]table calculations'!"&ADDRESS(MOD(ROW($A8)-6,12)+13,64+MOD(COLUMN(L$1)-2,8),4)) -> 3 | M8: =INDIRECT.EXT("'..\mens\[mens_div1.xls]table calculations'!"&ADDRESS(MOD(ROW($A8)-6,12)+13,64+MOD(COLUMN(M$1)-2,8),4)) -> 1 | N8: =INDIRECT.EXT("'..\mens\[mens_div1.xls]table calculations'!"&ADDRESS(MOD(ROW($A8)-6,12)+13,64+MOD(COLUMN(N$1)-2,8),4)) -> 25 | O8: =INDIRECT.EXT("'..\mens\[mens_div1.xls]table calculations'!"&ADDRESS(MOD(ROW($A8)-6,12)+13,64+MOD(COLUMN(O$1)-2,8),4)) -> 11 | P8: =INDIRECT.EXT("'..\mens\[mens_div1.xls]table calculations'!"&ADDRESS(MOD(ROW($A8)-6,12)+13,64+MOD(COLUMN(P$1)-2,8)+2,4)) -> 6
B9: =INDIRECT.EXT("'..\mens\[mens_prem.xls]table calculations'!"&ADDRESS(MOD(ROW($A9)-6,12)+13,64+MOD(COLUMN(B$1)-2,8),4)) -> West Bridgford & LE 1st | C9: =INDIRECT.EXT("'..\mens\[mens_prem.xls]table calculations'!"&ADDRESS(MOD(ROW($A9)-6,12)+13,64+MOD(COLUMN(C$1)-2,8),4)) -> 2 | D9: =INDIRECT.EXT("'..\mens\[mens_prem.xls]table calculations'!"&ADDRESS(MOD(ROW($A9)-6,12)+13,64+MOD(COLUMN(D$1)-2,8),4)) -> 2 | E9: =INDIRECT.EXT("'..\mens\[mens_prem.xls]table calculations'!"&ADDRESS(MOD(ROW($A9)-6,12)+13,64+MOD(COLUMN(E$1)-2,8),4)) -> 0 | F9: =INDIRECT.EXT("'..\mens\[mens_prem.xls]table calculations'!"&ADDRESS(MOD(ROW($A9)-6,12)+13,64+MOD(COLUMN(F$1)-2,8),4)) -> 17 | G9: =INDIRECT.EXT("'..\mens\[mens_prem.xls]table calculations'!"&ADDRESS(MOD(ROW($A9)-6,12)+13,64+MOD(COLUMN(G$1)-2,8),4)) -> 1 | H9: =INDIRECT.EXT("'..\mens\[mens_prem.xls]table calculations'!"&ADDRESS(MOD(ROW($A9)-6,12)+13,64+MOD(COLUMN(H$1)-2,8)+2,4)) -> 4 | J9: =INDIRECT.EXT("'..\mens\[mens_div1.xls]table calculations'!"&ADDRESS(MOD(ROW($A9)-6,12)+13,64+MOD(COLUMN(J$1)-2,8),4)) -> University 2nd | K9: =INDIRECT.EXT("'..\mens\[mens_div1.xls]table calculations'!"&ADDRESS(MOD(ROW($A9)-6,12)+13,64+MOD(COLUMN(K$1)-2,8),4)) -> 5 | L9: =INDIRECT.EXT("'..\mens\[mens_div1.xls]table calculations'!"&ADDRESS(MOD(ROW($A9)-6,12)+13,64+MOD(COLUMN(L$1)-2,8),4)) -> 3 | M9: =INDIRECT.EXT("'..\mens\[mens_div1.xls]table calculations'!"&ADDRESS(MOD(ROW($A9)-6,12)+13,64+MOD(COLUMN(M$1)-2,8),4)) -> 2 | N9: =INDIRECT.EXT("'..\mens\[mens_div1.xls]table calculations'!"&ADDRESS(MOD(ROW($A9)-6,12)+13,64+MOD(COLUMN(N$1)-2,8),4)) -> 23 | O9: =INDIRECT.EXT("'..\mens\[mens_div1.xls]table calculations'!"&ADDRESS(MOD(ROW($A9)-6,12)+13,64+MOD(COLUMN(O$1)-2,8),4)) -> 22 | P9: =INDIRECT.EXT("'..\mens\[mens_div1.xls]table calculations'!"&ADDRESS(MOD(ROW($A9)-6,12)+13,64+MOD(COLUMN(P$1)-2,8)+2,4)) -> 6
B10: =INDIRECT.EXT("'..\mens\[mens_prem.xls]table calculations'!"&ADDRESS(MOD(ROW($A10)-6,12)+13,64+MOD(COLUMN(B$1)-2,8),4)) -> Rolls Royce 1st | C10: =INDIRECT.EXT("'..\mens\[mens_prem.xls]table calculations'!"&ADDRESS(MOD(ROW($A10)-6,12)+13,64+MOD(COLUMN(C$1)-2,8),4)) -> 4 | D10: =INDIRECT.EXT("'..\mens\[mens_prem.xls]table calculations'!"&ADDRESS(MOD(ROW($A10)-6,12)+13,64+MOD(COLUMN(D$1)-2,8),4)) -> 2 | E10: =INDIRECT.EXT("'..\mens\[mens_prem.xls]table calculations'!"&ADDRESS(MOD(ROW($A10)-6,12)+13,64+MOD(COLUMN(E$1)-2,8),4)) -> 2 | F10: =INDIRECT.EXT("'..\mens\[mens_prem.xls]table calculations'!"&ADDRESS(MOD(ROW($A10)-6,12)+13,64+MOD(COLUMN(F$1)-2,8),4)) -> 19 | G10: =INDIRECT.EXT("'..\mens\[mens_prem.xls]table calculations'!"&ADDRESS(MOD(ROW($A10)-6,12)+13,64+MOD(COLUMN(G$1)-2,8),4)) -> 17 | H10: =INDIRECT.EXT("'..\mens\[mens_prem.xls]table calculations'!"&ADDRESS(MOD(ROW($A10)-6,12)+13,64+MOD(COLUMN(H$1)-2,8)+2,4)) -> 4 | J10: =INDIRECT.EXT("'..\mens\[mens_div1.xls]table calculations'!"&ADDRESS(MOD(ROW($A10)-6,12)+13,64+MOD(COLUMN(J$1)-2,8),4)) -> Byron 2nd | K10: =INDIRECT.EXT("'..\mens\[mens_div1.xls]table calculations'!"&ADDRESS(MOD(ROW($A10)-6,12)+13,64+MOD(COLUMN(K$1)-2,8),4)) -> 3 | L10: =INDIRECT.EXT("'..\mens\[mens_div1.xls]table calculations'!"&ADDRESS(MOD(ROW($A10)-6,12)+13,64+MOD(COLUMN(L$1)-2,8),4)) -> 2 | M10: =INDIRECT.EXT("'..\mens\[mens_div1.xls]table calculations'!"&ADDRESS(MOD(ROW($A10)-6,12)+13,64+MOD(COLUMN(M$1)-2,8),4)) -> 1 | N10: =INDIRECT.EXT("'..\mens\[mens_div1.xls]table calculations'!"&ADDRESS(MOD(ROW($A10)-6,12)+13,64+MOD(COLUMN(N$1)-2,8),4)) -> 20 | O10: =INDIRECT.EXT("'..\mens\[mens_div1.xls]table calculations'!"&ADDRESS(MOD(ROW($A10)-6,12)+13,64+MOD(COLUMN(O$1)-2,8),4)) -> 7 | P10: =INDIRECT.EXT("'..\mens\[mens_div1.xls]table calculations'!"&ADDRESS(MOD(ROW($A10)-6,12)+13,64+MOD(COLUMN(P$1)-2,8)+2,4)) -> 4
B11: =INDIRECT.EXT("'..\mens\[mens_prem.xls]table calculations'!"&ADDRESS(MOD(ROW($A11)-6,12)+13,64+MOD(COLUMN(B$1)-2,8),4)) -> Bingham 2nd | C11: =INDIRECT.EXT("'..\mens\[mens_prem.xls]table calculations'!"&ADDRESS(MOD(ROW($A11)-6,12)+13,64+MOD(COLUMN(C$1)-2,8),4)) -> 5 | D11: =INDIRECT.EXT("'..\mens\[mens_prem.xls]table calculations'!"&ADDRESS(MOD(ROW($A11)-6,12)+13,64+MOD(COLUMN(D$1)-2,8),4)) -> 1 | E11: =INDIRECT.EXT("'..\mens\[mens_prem.xls]table calculations'!"&ADDRESS(MOD(ROW($A11)-6,12)+13,64+MOD(COLUMN(E$1)-2,8),4)) -> 4 | F11: =INDIRECT.EXT("'..\mens\[mens_prem.xls]table calculations'!"&ADDRESS(MOD(ROW($A11)-6,12)+13,64+MOD(COLUMN(F$1)-2,8),4)) -> 13 | G11: =INDIRECT.EXT("'..\mens\[mens_prem.xls]table calculations'!"&ADDRESS(MOD(ROW($A11)-6,12)+13,64+MOD(COLUMN(G$1)-2,8),4)) -> 32 | H11: =INDIRECT.EXT("'..\mens\[mens_prem.xls]table calculations'!"&ADDRESS(MOD(ROW($A11)-6,12)+13,64+MOD(COLUMN(H$1)-2,8)+2,4)) -> 2 | J11: =INDIRECT.EXT("'..\mens\[mens_div1.xls]table calculations'!"&ADDRESS(MOD(ROW($A11)-6,12)+13,64+MOD(COLUMN(J$1)-2,8),4)) -> Mapperley Park 2nd | K11: =INDIRECT.EXT("'..\mens\[mens_div1.xls]table calculations'!"&ADDRESS(MOD(ROW($A11)-6,12)+13,64+MOD(COLUMN(K$1)-2,8),4)) -> 7 | L11: =INDIRECT.EXT("'..\mens\[mens_div1.xls]table calculations'!"&ADDRESS(MOD(ROW($A11)-6,12)+13,64+MOD(COLUMN(L$1)-2,8),4)) -> 2 | M11: =INDIRECT.EXT("'..\mens\[mens_div1.xls]table calculations'!"&ADDRESS(MOD(ROW($A11)-6,12)+13,64+MOD(COLUMN(M$1)-2,8),4)) -> 5 | N11: =INDIRECT.EXT("'..\mens\[mens_div1.xls]table calculations'!"&ADDRESS(MOD(ROW($A11)-6,12)+13,64+MOD(COLUMN(N$1)-2,8),4)) -> 21 | O11: =INDIRECT.EXT("'..\mens\[mens_div1.xls]table calculations'!"&ADDRESS(MOD(ROW($A11)-6,12)+13,64+MOD(COLUMN(O$1)-2,8),4)) -> 42 | P11: =INDIRECT.EXT("'..\mens\[mens_div1.xls]table calculations'!"&ADDRESS(MOD(ROW($A11)-6,12)+13,64+MOD(COLUMN(P$1)-2,8)+2,4)) -> 4
B12: =INDIRECT.EXT("'..\mens\[mens_prem.xls]table calculations'!"&ADDRESS(MOD(ROW($A12)-6,12)+13,64+MOD(COLUMN(B$1)-2,8),4)) -> Rolls Royce 2nd | C12: =INDIRECT.EXT("'..\mens\[mens_prem.xls]table calculations'!"&ADDRESS(MOD(ROW($A12)-6,12)+13,64+MOD(COLUMN(C$1)-2,8),4)) -> 3 | D12: =INDIRECT.EXT("'..\mens\[mens_prem.xls]table calculations'!"&ADDRESS(MOD(ROW($A12)-6,12)+13,64+MOD(COLUMN(D$1)-2,8),4)) -> 0 | E12: =INDIRECT.EXT("'..\mens\[mens_prem.xls]table calculations'!"&ADDRESS(MOD(ROW($A12)-6,12)+13,64+MOD(COLUMN(E$1)-2,8),4)) -> 3 | F12: =INDIRECT.EXT("'..\mens\[mens_prem.xls]table calculations'!"&ADDRESS(MOD(ROW($A12)-6,12)+13,64+MOD(COLUMN(F$1)-2,8),4)) -> 3 | G12: =INDIRECT.EXT("'..\mens\[mens_prem.xls]table calculations'!"&ADDRESS(MOD(ROW($A12)-6,12)+13,64+MOD(COLUMN(G$1)-2,8),4)) -> 24 | H12: =INDIRECT.EXT("'..\mens\[mens_prem.xls]table calculations'!"&ADDRESS(MOD(ROW($A12)-6,12)+13,64+MOD(COLUMN(H$1)-2,8)+2,4)) -> 0 | J12: =INDIRECT.EXT("'..\mens\[mens_div1.xls]table calculations'!"&ADDRESS(MOD(ROW($A12)-6,12)+13,64+MOD(COLUMN(J$1)-2,8),4)) -> Forest 2nd | K12: =INDIRECT.EXT("'..\mens\[mens_div1.xls]table calculations'!"&ADDRESS(MOD(ROW($A12)-6,12)+13,64+MOD(COLUMN(K$1)-2,8),4)) -> 5 | L12: =INDIRECT.EXT("'..\mens\[mens_div1.xls]table calculations'!"&ADDRESS(MOD(ROW($A12)-6,12)+13,64+MOD(COLUMN(L$1)-2,8),4)) -> 1 | M12: =INDIRECT.EXT("'..\mens\[mens_div1.xls]table calculations'!"&ADDRESS(MOD(ROW($A12)-6,12)+13,64+MOD(COLUMN(M$1)-2,8),4)) -> 4 | N12: =INDIRECT.EXT("'..\mens\[mens_div1.xls]table calculations'!"&ADDRESS(MOD(ROW($A12)-6,12)+13,64+MOD(COLUMN(N$1)-2,8),4)) -> 8 | O12: =INDIRECT.EXT("'..\mens\[mens_div1.xls]table calculations'!"&ADDRESS(MOD(ROW($A12)-6,12)+13,64+MOD(COLUMN(O$1)-2,8),4)) -> 37 | P12: =INDIRECT.EXT("'..\mens\[mens_div1.xls]table calculations'!"&ADDRESS(MOD(ROW($A12)-6,12)+13,64+MOD(COLUMN(P$1)-2,8)+2,4)) -> 2
B13: =INDIRECT.EXT("'..\mens\[mens_prem.xls]table calculations'!"&ADDRESS(MOD(ROW($A13)-6,12)+13,64+MOD(COLUMN(B$1)-2,8),4)) -> Forest 1st | C13: =INDIRECT.EXT("'..\mens\[mens_prem.xls]table calculations'!"&ADDRESS(MOD(ROW($A13)-6,12)+13,64+MOD(COLUMN(C$1)-2,8),4)) -> 4 | D13: =INDIRECT.EXT("'..\mens\[mens_prem.xls]table calculations'!"&ADDRESS(MOD(ROW($A13)-6,12)+13,64+MOD(COLUMN(D$1)-2,8),4)) -> 0 | E13: =INDIRECT.EXT("'..\mens\[mens_prem.xls]table calculations'!"&ADDRESS(MOD(ROW($A13)-6,12)+13,64+MOD(COLUMN(E$1)-2,8),4)) -> 4 | F13: =INDIRECT.EXT("'..\mens\[mens_prem.xls]table calculations'!"&ADDRESS(MOD(ROW($A13)-6,12)+13,64+MOD(COLUMN(F$1)-2,8),4)) -> 3 | G13: =INDIRECT.EXT("'..\mens\[mens_prem.xls]table calculations'!"&ADDRESS(MOD(ROW($A13)-6,12)+13,64+MOD(COLUMN(G$1)-2,8),4)) -> 33 | H13: =INDIRECT.EXT("'..\mens\[mens_prem.xls]table calculations'!"&ADDRESS(MOD(ROW($A13)-6,12)+13,64+MOD(COLUMN(H$1)-2,8)+2,4)) -> 0 | J13: =INDIRECT.EXT("'..\mens\[mens_div1.xls]table calculations'!"&ADDRESS(MOD(ROW($A13)-6,12)+13,64+MOD(COLUMN(J$1)-2,8),4)) -> East Leake 1st | K13: =INDIRECT.EXT("'..\mens\[mens_div1.xls]table calculations'!"&ADDRESS(MOD(ROW($A13)-6,12)+13,64+MOD(COLUMN(K$1)-2,8),4)) -> 5 | L13: =INDIRECT.EXT("'..\mens\[mens_div1.xls]table calculations'!"&ADDRESS(MOD(ROW($A13)-6,12)+13,64+MOD(COLUMN(L$1)-2,8),4)) -> 0 | M13: =INDIRECT.EXT("'..\mens\[mens_div1.xls]table calculations'!"&ADDRESS(MOD(ROW($A13)-6,12)+13,64+MOD(COLUMN(M$1)-2,8),4)) -> 5 | N13: =INDIRECT.EXT("'..\mens\[mens_div1.xls]table calculations'!"&ADDRESS(MOD(ROW($A13)-6,12)+13,64+MOD(COLUMN(N$1)-2,8),4)) -> 10 | O13: =INDIRECT.EXT("'..\mens\[mens_div1.xls]table calculations'!"&ADDRESS(MOD(ROW($A13)-6,12)+13,64+MOD(COLUMN(O$1)-2,8),4)) -> 35 | P13: =INDIRECT.EXT("'..\mens\[mens_div1.xls]table calculations'!"&ADDRESS(MOD(ROW($A13)-6,12)+13,64+MOD(COLUMN(P$1)-2,8)+2,4)) -> 0
B15: Mens Div 2A | J15: Mens Div 2B
B16: League Table | J16: League Table
B17: S T A N D I N G S | C17: p | D17: w | E17: l | F17: rf | G17: ra | H17: pts | J17: S T A N D I N G S | K17: p | L17: w | M17: l | N17: rf | O17: ra | P17: pts
B18: =INDIRECT.EXT("'..\mens\[mens_div2a.xls]table calculations'!"&ADDRESS(MOD(ROW($A18)-6,12)+13,64+MOD(COLUMN(B$1)-2,8),4)) -> Beeston Fields 1st | C18: =INDIRECT.EXT("'..\mens\[mens_div2a.xls]table calculations'!"&ADDRESS(MOD(ROW($A18)-6,12)+13,64+MOD(COLUMN(C$1)-2,8),4)) -> 5 | D18: =INDIRECT.EXT("'..\mens\[mens_div2a.xls]table calculations'!"&ADDRESS(MOD(ROW($A18)-6,12)+13,64+MOD(COLUMN(D$1)-2,8),4)) -> 5 | E18: =INDIRECT.EXT("'..\mens\[mens_div2a.xls]table calculations'!"&ADDRESS(MOD(ROW($A18)-6,12)+13,64+MOD(COLUMN(E$1)-2,8),4)) -> 0 | F18: =INDIRECT.EXT("'..\mens\[mens_div2a.xls]table calculations'!"&ADDRESS(MOD(ROW($A18)-6,12)+13,64+MOD(COLUMN(F$1)-2,8),4)) -> 42 | G18: =INDIRECT.EXT("'..\mens\[mens_div2a.xls]table calculations'!"&ADDRESS(MOD(ROW($A18)-6,12)+13,64+MOD(COLUMN(G$1)-2,8),4)) -> 3 | H18: =INDIRECT.EXT("'..\mens\[mens_div2a.xls]table calculations'!"&ADDRESS(MOD(ROW($A18)-6,12)+13,64+MOD(COLUMN(H$1)-2,8)+2,4)) -> 10 | J18: =INDIRECT.EXT("'..\mens\[mens_div2b.xls]table calculations'!"&ADDRESS(MOD(ROW($A18)-6,12)+13,64+MOD(COLUMN(J$1)-2,8),4)) -> Carlton 1st | K18: =INDIRECT.EXT("'..\mens\[mens_div2b.xls]table calculations'!"&ADDRESS(MOD(ROW($A18)-6,12)+13,64+MOD(COLUMN(K$1)-2,8),4)) -> 4 | L18: =INDIRECT.EXT("'..\mens\[mens_div2b.xls]table calculations'!"&ADDRESS(MOD(ROW($A18)-6,12)+13,64+MOD(COLUMN(L$1)-2,8),4)) -> 4 | M18: =INDIRECT.EXT("'..\mens\[mens_div2b.xls]table calculations'!"&ADDRESS(MOD(ROW($A18)-6,12)+13,64+MOD(COLUMN(M$1)-2,8),4)) -> 0 | N18: =INDIRECT.EXT("'..\mens\[mens_div2b.xls]table calculations'!"&ADDRESS(MOD(ROW($A18)-6,12)+13,64+MOD(COLUMN(N$1)-2,8),4)) -> 34 | O18: =INDIRECT.EXT("'..\mens\[mens_div2b.xls]table calculations'!"&ADDRESS(MOD(ROW($A18)-6,12)+13,64+MOD(COLUMN(O$1)-2,8),4)) -> 2 | P18: =INDIRECT.EXT("'..\mens\[mens_div2b.xls]table calculations'!"&ADDRESS(MOD(ROW($A18)-6,12)+13,64+MOD(COLUMN(P$1)-2,8)+2,4)) -> 8
B19: =INDIRECT.EXT("'..\mens\[mens_div2a.xls]table calculations'!"&ADDRESS(MOD(ROW($A19)-6,12)+13,64+MOD(COLUMN(B$1)-2,8),4)) -> Bingham 4th | C19: =INDIRECT.EXT("'..\mens\[mens_div2a.xls]table calculations'!"&ADDRESS(MOD(ROW($A19)-6,12)+13,64+MOD(COLUMN(C$1)-2,8),4)) -> 3 | D19: =INDIRECT.EXT("'..\mens\[mens_div2a.xls]table calculations'!"&ADDRESS(MOD(ROW($A19)-6,12)+13,64+MOD(COLUMN(D$1)-2,8),4)) -> 3 | E19: =INDIRECT.EXT("'..\mens\[mens_div2a.xls]table calculations'!"&ADDRESS(MOD(ROW($A19)-6,12)+13,64+MOD(COLUMN(E$1)-2,8),4)) -> 0 | F19: =INDIRECT.EXT("'..\mens\[mens_div2a.xls]table calculations'!"&ADDRESS(MOD(ROW($A19)-6,12)+13,64+MOD(COLUMN(F$1)-2,8),4)) -> 19 | G19: =INDIRECT.EXT("'..\mens\[mens_div2a.xls]table calculations'!"&ADDRESS(MOD(ROW($A19)-6,12)+13,64+MOD(COLUMN(G$1)-2,8),4)) -> 8 | H19: =INDIRECT.EXT("'..\mens\[mens_div2a.xls]table calculations'!"&ADDRESS(MOD(ROW($A19)-6,12)+13,64+MOD(COLUMN(H$1)-2,8)+2,4)) -> 6 | J19: =INDIRECT.EXT("'..\mens\[mens_div2b.xls]table calculations'!"&ADDRESS(MOD(ROW($A19)-6,12)+13,64+MOD(COLUMN(J$1)-2,8),4)) -> Phoenixwood 1st | K19: =INDIRECT.EXT("'..\mens\[mens_div2b.xls]table calculations'!"&ADDRESS(MOD(ROW($A19)-6,12)+13,64+MOD(COLUMN(K$1)-2,8),4)) -> 3 | L19: =INDIRECT.EXT("'..\mens\[mens_div2b.xls]table calculations'!"&ADDRESS(MOD(ROW($A19)-6,12)+13,64+MOD(COLUMN(L$1)-2,8),4)) -> 2 | M19: =INDIRECT.EXT("'..\mens\[mens_div2b.xls]table calculations'!"&ADDRESS(MOD(ROW($A19)-6,12)+13,64+MOD(COLUMN(M$1)-2,8),4)) -> 1 | N19: =INDIRECT.EXT("'..\mens\[mens_div2b.xls]table calculations'!"&ADDRESS(MOD(ROW($A19)-6,12)+13,64+MOD(COLUMN(N$1)-2,8),4)) -> 18 | O19: =INDIRECT.EXT("'..\mens\[mens_div2b.xls]table calculations'!"&ADDRESS(MOD(ROW($A19)-6,12)+13,64+MOD(COLUMN(O$1)-2,8),4)) -> 9 | P19: =INDIRECT.EXT("'..\mens\[mens_div2b.xls]table calculations'!"&ADDRESS(MOD(ROW($A19)-6,12)+13,64+MOD(COLUMN(P$1)-2,8)+2,4)) -> 4
B20: =INDIRECT.EXT("'..\mens\[mens_div2a.xls]table calculations'!"&ADDRESS(MOD(ROW($A20)-6,12)+13,64+MOD(COLUMN(B$1)-2,8),4)) -> Naseeb 1st | C20: =INDIRECT.EXT("'..\mens\[mens_div2a.xls]table calculations'!"&ADDRESS(MOD(ROW($A20)-6,12)+13,64+MOD(COLUMN(C$1)-2,8),4)) -> 4 | D20: =INDIRECT.EXT("'..\mens\[mens_div2a.xls]table calculations'!"&ADDRESS(MOD(ROW($A20)-6,12)+13,64+MOD(COLUMN(D$1)-2,8),4)) -> 3 | E20: =INDIRECT.EXT("'..\mens\[mens_div2a.xls]table calculations'!"&ADDRESS(MOD(ROW($A20)-6,12)+13,64+MOD(COLUMN(E$1)-2,8),4)) -> 1 | F20: =INDIRECT.EXT("'..\mens\[mens_div2a.xls]table calculations'!"&ADDRESS(MOD(ROW($A20)-6,12)+13,64+MOD(COLUMN(F$1)-2,8),4)) -> 25 | G20: =INDIRECT.EXT("'..\mens\[mens_div2a.xls]table calculations'!"&ADDRESS(MOD(ROW($A20)-6,12)+13,64+MOD(COLUMN(G$1)-2,8),4)) -> 11 | H20: =INDIRECT.EXT("'..\mens\[mens_div2a.xls]table calculations'!"&ADDRESS(MOD(ROW($A20)-6,12)+13,64+MOD(COLUMN(H$1)-2,8)+2,4)) -> 6 | J20: =INDIRECT.EXT("'..\mens\[mens_div2b.xls]table calculations'!"&ADDRESS(MOD(ROW($A20)-6,12)+13,64+MOD(COLUMN(J$1)-2,8),4)) -> University Staff | K20: =INDIRECT.EXT("'..\mens\[mens_div2b.xls]table calculations'!"&ADDRESS(MOD(ROW($A20)-6,12)+13,64+MOD(COLUMN(K$1)-2,8),4)) -> 3 | L20: =INDIRECT.EXT("'..\mens\[mens_div2b.xls]table calculations'!"&ADDRESS(MOD(ROW($A20)-6,12)+13,64+MOD(COLUMN(L$1)-2,8),4)) -> 2 | M20: =INDIRECT.EXT("'..\mens\[mens_div2b.xls]table calculations'!"&ADDRESS(MOD(ROW($A20)-6,12)+13,64+MOD(COLUMN(M$1)-2,8),4)) -> 1 | N20: =INDIRECT.EXT("'..\mens\[mens_div2b.xls]table calculations'!"&ADDRESS(MOD(ROW($A20)-6,12)+13,64+MOD(COLUMN(N$1)-2,8),4)) -> 11 | O20: =INDIRECT.EXT("'..\mens\[mens_div2b.xls]table calculations'!"&ADDRESS(MOD(ROW($A20)-6,12)+13,64+MOD(COLUMN(O$1)-2,8),4)) -> 16 | P20: =INDIRECT.EXT("'..\mens\[mens_div2b.xls]table calculations'!"&ADDRESS(MOD(ROW($A20)-6,12)+13,64+MOD(COLUMN(P$1)-2,8)+2,4)) -> 4
B21: =INDIRECT.EXT("'..\mens\[mens_div2a.xls]table calculations'!"&ADDRESS(MOD(ROW($A21)-6,12)+13,64+MOD(COLUMN(B$1)-2,8),4)) -> Nottingham Vets 1st | C21: =INDIRECT.EXT("'..\mens\[mens_div2a.xls]table calculations'!"&ADDRESS(MOD(ROW($A21)-6,12)+13,64+MOD(COLUMN(C$1)-2,8),4)) -> 5 | D21: =INDIRECT.EXT("'..\mens\[mens_div2a.xls]table calculations'!"&ADDRESS(MOD(ROW($A21)-6,12)+13,64+MOD(COLUMN(D$1)-2,8),4)) -> 2 | E21: =INDIRECT.EXT("'..\mens\[mens_div2a.xls]table calculations'!"&ADDRESS(MOD(ROW($A21)-6,12)+13,64+MOD(COLUMN(E$1)-2,8),4)) -> 3 | F21: =INDIRECT.EXT("'..\mens\[mens_div2a.xls]table calculations'!"&ADDRESS(MOD(ROW($A21)-6,12)+13,64+MOD(COLUMN(F$1)-2,8),4)) -> 16 | G21: =INDIRECT.EXT("'..\mens\[mens_div2a.xls]table calculations'!"&ADDRESS(MOD(ROW($A21)-6,12)+13,64+MOD(COLUMN(G$1)-2,8),4)) -> 29 | H21: =INDIRECT.EXT("'..\mens\[mens_div2a.xls]table calculations'!"&ADDRESS(MOD(ROW($A21)-6,12)+13,64+MOD(COLUMN(H$1)-2,8)+2,4)) -> 4 | J21: =INDIRECT.EXT("'..\mens\[mens_div2b.xls]table calculations'!"&ADDRESS(MOD(ROW($A21)-6,12)+13,64+MOD(COLUMN(J$1)-2,8),4)) -> Mansfield Oaktree | K21: =INDIRECT.EXT("'..\mens\[mens_div2b.xls]table calculations'!"&ADDRESS(MOD(ROW($A21)-6,12)+13,64+MOD(COLUMN(K$1)-2,8),4)) -> 2 | L21: =INDIRECT.EXT("'..\mens\[mens_div2b.xls]table calculations'!"&ADDRESS(MOD(ROW($A21)-6,12)+13,64+MOD(COLUMN(L$1)-2,8),4)) -> 1 | M21: =INDIRECT.EXT("'..\mens\[mens_div2b.xls]table calculations'!"&ADDRESS(MOD(ROW($A21)-6,12)+13,64+MOD(COLUMN(M$1)-2,8),4)) -> 1 | N21: =INDIRECT.EXT("'..\mens\[mens_div2b.xls]table calculations'!"&ADDRESS(MOD(ROW($A21)-6,12)+13,64+MOD(COLUMN(N$1)-2,8),4)) -> 10 | O21: =INDIRECT.EXT("'..\mens\[mens_div2b.xls]table calculations'!"&ADDRESS(MOD(ROW($A21)-6,12)+13,64+MOD(COLUMN(O$1)-2,8),4)) -> 8 | P21: =INDIRECT.EXT("'..\mens\[mens_div2b.xls]table calculations'!"&ADDRESS(MOD(ROW($A21)-6,12)+13,64+MOD(COLUMN(P$1)-2,8)+2,4)) -> 2
B22: =INDIRECT.EXT("'..\mens\[mens_div2a.xls]table calculations'!"&ADDRESS(MOD(ROW($A22)-6,12)+13,64+MOD(COLUMN(B$1)-2,8),4)) -> Carlton 2nd | C22: =INDIRECT.EXT("'..\mens\[mens_div2a.xls]table calculations'!"&ADDRESS(MOD(ROW($A22)-6,12)+13,64+MOD(COLUMN(C$1)-2,8),4)) -> 5 | D22: =INDIRECT.EXT("'..\mens\[mens_div2a.xls]table calculations'!"&ADDRESS(MOD(ROW($A22)-6,12)+13,64+MOD(COLUMN(D$1)-2,8),4)) -> 1 | E22: =INDIRECT.EXT("'..\mens\[mens_div2a.xls]table calculations'!"&ADDRESS(MOD(ROW($A22)-6,12)+13,64+MOD(COLUMN(E$1)-2,8),4)) -> 4 | F22: =INDIRECT.EXT("'..\mens\[mens_div2a.xls]table calculations'!"&ADDRESS(MOD(ROW($A22)-6,12)+13,64+MOD(COLUMN(F$1)-2,8),4)) -> 16 | G22: =INDIRECT.EXT("'..\mens\[mens_div2a.xls]table calculations'!"&ADDRESS(MOD(ROW($A22)-6,12)+13,64+MOD(COLUMN(G$1)-2,8),4)) -> 29 | H22: =INDIRECT.EXT("'..\mens\[mens_div2a.xls]table calculations'!"&ADDRESS(MOD(ROW($A22)-6,12)+13,64+MOD(COLUMN(H$1)-2,8)+2,4)) -> 2 | J22: =INDIRECT.EXT("'..\mens\[mens_div2b.xls]table calculations'!"&ADDRESS(MOD(ROW($A22)-6,12)+13,64+MOD(COLUMN(J$1)-2,8),4)) -> Boots 1st | K22: =INDIRECT.EXT("'..\mens\[mens_div2b.xls]table calculations'!"&ADDRESS(MOD(ROW($A22)-6,12)+13,64+MOD(COLUMN(K$1)-2,8),4)) -> 5 | L22: =INDIRECT.EXT("'..\mens\[mens_div2b.xls]table calculations'!"&ADDRESS(MOD(ROW($A22)-6,12)+13,64+MOD(COLUMN(L$1)-2,8),4)) -> 1 | M22: =INDIRECT.EXT("'..\mens\[mens_div2b.xls]table calculations'!"&ADDRESS(MOD(ROW($A22)-6,12)+13,64+MOD(COLUMN(M$1)-2,8),4)) -> 4 | N22: =INDIRECT.EXT("'..\mens\[mens_div2b.xls]table calculations'!"&ADDRESS(MOD(ROW($A22)-6,12)+13,64+MOD(COLUMN(N$1)-2,8),4)) -> 13 | O22: =INDIRECT.EXT("'..\mens\[mens_div2b.xls]table calculations'!"&ADDRESS(MOD(ROW($A22)-6,12)+13,64+MOD(COLUMN(O$1)-2,8),4)) -> 32 | P22: =INDIRECT.EXT("'..\mens\[mens_div2b.xls]table calculations'!"&ADDRESS(MOD(ROW($A22)-6,12)+13,64+MOD(COLUMN(P$1)-2,8)+2,4)) -> 2
B23: =INDIRECT.EXT("'..\mens\[mens_div2a.xls]table calculations'!"&ADDRESS(MOD(ROW($A23)-6,12)+13,64+MOD(COLUMN(B$1)-2,8),4)) -> Southwell Centre 1st | C23: =INDIRECT.EXT("'..\mens\[mens_div2a.xls]table calculations'!"&ADDRESS(MOD(ROW($A23)-6,12)+13,64+MOD(COLUMN(C$1)-2,8),4)) -> 5 | D23: =INDIRECT.EXT("'..\mens\[mens_div2a.xls]table calculations'!"&ADDRESS(MOD(ROW($A23)-6,12)+13,64+MOD(COLUMN(D$1)-2,8),4)) -> 1 | E23: =INDIRECT.EXT("'..\mens\[mens_div2a.xls]table calculations'!"&ADDRESS(MOD(ROW($A23)-6,12)+13,64+MOD(COLUMN(E$1)-2,8),4)) -> 4 | F23: =INDIRECT.EXT("'..\mens\[mens_div2a.xls]table calculations'!"&ADDRESS(MOD(ROW($A23)-6,12)+13,64+MOD(COLUMN(F$1)-2,8),4)) -> 11 | G23: =INDIRECT.EXT("'..\mens\[mens_div2a.xls]table calculations'!"&ADDRESS(MOD(ROW($A23)-6,12)+13,64+MOD(COLUMN(G$1)-2,8),4)) -> 34 | H23: =INDIRECT.EXT("'..\mens\[mens_div2a.xls]table calculations'!"&ADDRESS(MOD(ROW($A23)-6,12)+13,64+MOD(COLUMN(H$1)-2,8)+2,4)) -> 2 | J23: =INDIRECT.EXT("'..\mens\[mens_div2b.xls]table calculations'!"&ADDRESS(MOD(ROW($A23)-6,12)+13,64+MOD(COLUMN(J$1)-2,8),4)) -> Byron 3rd | K23: =INDIRECT.EXT("'..\mens\[mens_div2b.xls]table calculations'!"&ADDRESS(MOD(ROW($A23)-6,12)+13,64+MOD(COLUMN(K$1)-2,8),4)) -> 3 | L23: =INDIRECT.EXT("'..\mens\[mens_div2b.xls]table calculations'!"&ADDRESS(MOD(ROW($A23)-6,12)+13,64+MOD(COLUMN(L$1)-2,8),4)) -> 1 | M23: =INDIRECT.EXT("'..\mens\[mens_div2b.xls]table calculations'!"&ADDRESS(MOD(ROW($A23)-6,12)+13,64+MOD(COLUMN(M$1)-2,8),4)) -> 2 | N23: =INDIRECT.EXT("'..\mens\[mens_div2b.xls]table calculations'!"&ADDRESS(MOD(ROW($A23)-6,12)+13,64+MOD(COLUMN(N$1)-2,8),4)) -> 8 | O23: =INDIRECT.EXT("'..\mens\[mens_div2b.xls]table calculations'!"&ADDRESS(MOD(ROW($A23)-6,12)+13,64+MOD(COLUMN(O$1)-2,8),4)) -> 19 | P23: =INDIRECT.EXT("'..\mens\[mens_div2b.xls]table calculations'!"&ADDRESS(MOD(ROW($A23)-6,12)+13,64+MOD(COLUMN(P$1)-2,8)+2,4)) -> 2
B24: =INDIRECT.EXT("'..\mens\[mens_div2a.xls]table calculations'!"&ADDRESS(MOD(ROW($A24)-6,12)+13,64+MOD(COLUMN(B$1)-2,8),4)) -> Mapperley Park 3rd | C24: =INDIRECT.EXT("'..\mens\[mens_div2a.xls]table calculations'!"&ADDRESS(MOD(ROW($A24)-6,12)+13,64+MOD(COLUMN(C$1)-2,8),4)) -> 3 | D24: =INDIRECT.EXT("'..\mens\[mens_div2a.xls]table calculations'!"&ADDRESS(MOD(ROW($A24)-6,12)+13,64+MOD(COLUMN(D$1)-2,8),4)) -> 0 | E24: =INDIRECT.EXT("'..\mens\[mens_div2a.xls]table calculations'!"&ADDRESS(MOD(ROW($A24)-6,12)+13,64+MOD(COLUMN(E$1)-2,8),4)) -> 3 | F24: =INDIRECT.EXT("'..\mens\[mens_div2a.xls]table calculations'!"&ADDRESS(MOD(ROW($A24)-6,12)+13,64+MOD(COLUMN(F$1)-2,8),4)) -> 6 | G24: =INDIRECT.EXT("'..\mens\[mens_div2a.xls]table calculations'!"&ADDRESS(MOD(ROW($A24)-6,12)+13,64+MOD(COLUMN(G$1)-2,8),4)) -> 21 | H24: =INDIRECT.EXT("'..\mens\[mens_div2a.xls]table calculations'!"&ADDRESS(MOD(ROW($A24)-6,12)+13,64+MOD(COLUMN(H$1)-2,8)+2,4)) -> 0 | J24: =INDIRECT.EXT("'..\mens\[mens_div2b.xls]table calculations'!"&ADDRESS(MOD(ROW($A24)-6,12)+13,64+MOD(COLUMN(J$1)-2,8),4)) -> Crusader | K24: =INDIRECT.EXT("'..\mens\[mens_div2b.xls]table calculations'!"&ADDRESS(MOD(ROW($A24)-6,12)+13,64+MOD(COLUMN(K$1)-2,8),4)) -> 2 | L24: =INDIRECT.EXT("'..\mens\[mens_div2b.xls]table calculations'!"&ADDRESS(MOD(ROW($A24)-6,12)+13,64+MOD(COLUMN(L$1)-2,8),4)) -> 0 | M24: =INDIRECT.EXT("'..\mens\[mens_div2b.xls]table calculations'!"&ADDRESS(MOD(ROW($A24)-6,12)+13,64+MOD(COLUMN(M$1)-2,8),4)) -> 2 | N24: =INDIRECT.EXT("'..\mens\[mens_div2b.xls]table calculations'!"&ADDRESS(MOD(ROW($A24)-6,12)+13,64+MOD(COLUMN(N$1)-2,8),4)) -> 5 | O24: =INDIRECT.EXT("'..\mens\[mens_div2b.xls]table calculations'!"&ADDRESS(MOD(ROW($A24)-6,12)+13,64+MOD(COLUMN(O$1)-2,8),4)) -> 13 | P24: =INDIRECT.EXT("'..\mens\[mens_div2b.xls]table calculations'!"&ADDRESS(MOD(ROW($A24)-6,12)+13,64+MOD(COLUMN(P$1)-2,8)+2,4)) -> 0
B25: =INDIRECT.EXT("'..\mens\[mens_div2a.xls]table calculations'!"&ADDRESS(MOD(ROW($A25)-6,12)+13,64+MOD(COLUMN(B$1)-2,8),4)) -> _ | C25: =INDIRECT.EXT("'..\mens\[mens_div2a.xls]table calculations'!"&ADDRESS(MOD(ROW($A25)-6,12)+13,64+MOD(COLUMN(C$1)-2,8),4)) -> _ | D25: =INDIRECT.EXT("'..\mens\[mens_div2a.xls]table calculations'!"&ADDRESS(MOD(ROW($A25)-6,12)+13,64+MOD(COLUMN(D$1)-2,8),4)) -> _ | E25: =INDIRECT.EXT("'..\mens\[mens_div2a.xls]table calculations'!"&ADDRESS(MOD(ROW($A25)-6,12)+13,64+MOD(COLUMN(E$1)-2,8),4)) -> _ | F25: =INDIRECT.EXT("'..\mens\[mens_div2a.xls]table calculations'!"&ADDRESS(MOD(ROW($A25)-6,12)+13,64+MOD(COLUMN(F$1)-2,8),4)) -> _ | G25: =INDIRECT.EXT("'..\mens\[mens_div2a.xls]table calculations'!"&ADDRESS(MOD(ROW($A25)-6,12)+13,64+MOD(COLUMN(G$1)-2,8),4)) -> _ | H25: =INDIRECT.EXT("'..\mens\[mens_div2a.xls]table calculations'!"&ADDRESS(MOD(ROW($A25)-6,12)+13,64+MOD(COLUMN(H$1)-2,8)+2,4)) -> _ | J25: =INDIRECT.EXT("'..\mens\[mens_div2b.xls]table calculations'!"&ADDRESS(MOD(ROW($A25)-6,12)+13,64+MOD(COLUMN(J$1)-2,8),4)) -> _ | K25: =INDIRECT.EXT("'..\mens\[mens_div2b.xls]table calculations'!"&ADDRESS(MOD(ROW($A25)-6,12)+13,64+MOD(COLUMN(K$1)-2,8),4)) -> _ | L25: =INDIRECT.EXT("'..\mens\[mens_div2b.xls]table calculations'!"&ADDRESS(MOD(ROW($A25)-6,12)+13,64+MOD(COLUMN(L$1)-2,8),4)) -> _ | M25: =INDIRECT.EXT("'..\mens\[mens_div2b.xls]table calculations'!"&ADDRESS(MOD(ROW($A25)-6,12)+13,64+MOD(COLUMN(M$1)-2,8),4)) -> _ | N25: =INDIRECT.EXT("'..\mens\[mens_div2b.xls]table calculations'!"&ADDRESS(MOD(ROW($A25)-6,12)+13,64+MOD(COLUMN(N$1)-2,8),4)) -> _ | O25: =INDIRECT.EXT("'..\mens\[mens_div2b.xls]table calculations'!"&ADDRESS(MOD(ROW($A25)-6,12)+13,64+MOD(COLUMN(O$1)-2,8),4)) -> _ | P25: =INDIRECT.EXT("'..\mens\[mens_div2b.xls]table calculations'!"&ADDRESS(MOD(ROW($A25)-6,12)+13,64+MOD(COLUMN(P$1)-2,8)+2,4)) -> _
B27: Mens Div 3A | J27: Mens Div 3B
B28: League Table | J28: League Table
B29: S T A N D I N G S | C29: p | D29: w | E29: l | F29: rf | G29: ra | H29: pts | J29: S T A N D I N G S | K29: p | L29: w | M29: l | N29: rf | O29: ra | P29: pts
B30: =INDIRECT.EXT("'..\mens\[mens_div3a.xls]table calculations'!"&ADDRESS(MOD(ROW($A30)-6,12)+13,64+MOD(COLUMN(B$1)-2,8),4)) -> Rolls Royce 3rd | C30: =INDIRECT.EXT("'..\mens\[mens_div3a.xls]table calculations'!"&ADDRESS(MOD(ROW($A30)-6,12)+13,64+MOD(COLUMN(C$1)-2,8),4)) -> 2 | D30: =INDIRECT.EXT("'..\mens\[mens_div3a.xls]table calculations'!"&ADDRESS(MOD(ROW($A30)-6,12)+13,64+MOD(COLUMN(D$1)-2,8),4)) -> 2 | E30: =INDIRECT.EXT("'..\mens\[mens_div3a.xls]table calculations'!"&ADDRESS(MOD(ROW($A30)-6,12)+13,64+MOD(COLUMN(E$1)-2,8),4)) -> 0 | F30: =INDIRECT.EXT("'..\mens\[mens_div3a.xls]table calculations'!"&ADDRESS(MOD(ROW($A30)-6,12)+13,64+MOD(COLUMN(F$1)-2,8),4)) -> 14 | G30: =INDIRECT.EXT("'..\mens\[mens_div3a.xls]table calculations'!"&ADDRESS(MOD(ROW($A30)-6,12)+13,64+MOD(COLUMN(G$1)-2,8),4)) -> 4 | H30: =INDIRECT.EXT("'..\mens\[mens_div3a.xls]table calculations'!"&ADDRESS(MOD(ROW($A30)-6,12)+13,64+MOD(COLUMN(H$1)-2,8)+2,4)) -> 4 | J30: =INDIRECT.EXT("'..\mens\[mens_div3b.xls]table calculations'!"&ADDRESS(MOD(ROW($A30)-6,12)+13,64+MOD(COLUMN(J$1)-2,8),4)) -> St Giles 1st | K30: =INDIRECT.EXT("'..\mens\[mens_div3b.xls]table calculations'!"&ADDRESS(MOD(ROW($A30)-6,12)+13,64+MOD(COLUMN(K$1)-2,8),4)) -> 3 | L30: =INDIRECT.EXT("'..\mens\[mens_div3b.xls]table calculations'!"&ADDRESS(MOD(ROW($A30)-6,12)+13,64+MOD(COLUMN(L$1)-2,8),4)) -> 3 | M30: =INDIRECT.EXT("'..\mens\[mens_div3b.xls]table calculations'!"&ADDRESS(MOD(ROW($A30)-6,12)+13,64+MOD(COLUMN(M$1)-2,8),4)) -> 0 | N30: =INDIRECT.EXT("'..\mens\[mens_div3b.xls]table calculations'!"&ADDRESS(MOD(ROW($A30)-6,12)+13,64+MOD(COLUMN(N$1)-2,8),4)) -> 20 | O30: =INDIRECT.EXT("'..\mens\[mens_div3b.xls]table calculations'!"&ADDRESS(MOD(ROW($A30)-6,12)+13,64+MOD(COLUMN(O$1)-2,8),4)) -> 7 | P30: =INDIRECT.EXT("'..\mens\[mens_div3b.xls]table calculations'!"&ADDRESS(MOD(ROW($A30)-6,12)+13,64+MOD(COLUMN(P$1)-2,8)+2,4)) -> 6
B31: =INDIRECT.EXT("'..\mens\[mens_div3a.xls]table calculations'!"&ADDRESS(MOD(ROW($A31)-6,12)+13,64+MOD(COLUMN(B$1)-2,8),4)) -> University 4th | C31: =INDIRECT.EXT("'..\mens\[mens_div3a.xls]table calculations'!"&ADDRESS(MOD(ROW($A31)-6,12)+13,64+MOD(COLUMN(C$1)-2,8),4)) -> 2 | D31: =INDIRECT.EXT("'..\mens\[mens_div3a.xls]table calculations'!"&ADDRESS(MOD(ROW($A31)-6,12)+13,64+MOD(COLUMN(D$1)-2,8),4)) -> 2 | E31: =INDIRECT.EXT("'..\mens\[mens_div3a.xls]table calculations'!"&ADDRESS(MOD(ROW($A31)-6,12)+13,64+MOD(COLUMN(E$1)-2,8),4)) -> 0 | F31: =INDIRECT.EXT("'..\mens\[mens_div3a.xls]table calculations'!"&ADDRESS(MOD(ROW($A31)-6,12)+13,64+MOD(COLUMN(F$1)-2,8),4)) -> 12 | G31: =INDIRECT.EXT("'..\mens\[mens_div3a.xls]table calculations'!"&ADDRESS(MOD(ROW($A31)-6,12)+13,64+MOD(COLUMN(G$1)-2,8),4)) -> 6 | H31: =INDIRECT.EXT("'..\mens\[mens_div3a.xls]table calculations'!"&ADDRESS(MOD(ROW($A31)-6,12)+13,64+MOD(COLUMN(H$1)-2,8)+2,4)) -> 4 | J31: =INDIRECT.EXT("'..\mens\[mens_div3b.xls]table calculations'!"&ADDRESS(MOD(ROW($A31)-6,12)+13,64+MOD(COLUMN(J$1)-2,8),4)) -> Beeston Fields 2nd | K31: =INDIRECT.EXT("'..\mens\[mens_div3b.xls]table calculations'!"&ADDRESS(MOD(ROW($A31)-6,12)+13,64+MOD(COLUMN(K$1)-2,8),4)) -> 4 | L31: =INDIRECT.EXT("'..\mens\[mens_div3b.xls]table calculations'!"&ADDRESS(MOD(ROW($A31)-6,12)+13,64+MOD(COLUMN(L$1)-2,8),4)) -> 3 | M31: =INDIRECT.EXT("'..\mens\[mens_div3b.xls]table calculations'!"&ADDRESS(MOD(ROW($A31)-6,12)+13,64+MOD(COLUMN(M$1)-2,8),4)) -> 1 | N31: =INDIRECT.EXT("'..\mens\[mens_div3b.xls]table calculations'!"&ADDRESS(MOD(ROW($A31)-6,12)+13,64+MOD(COLUMN(N$1)-2,8),4)) -> 24 | O31: =INDIRECT.EXT("'..\mens\[mens_div3b.xls]table calculations'!"&ADDRESS(MOD(ROW($A31)-6,12)+13,64+MOD(COLUMN(O$1)-2,8),4)) -> 12 | P31: =INDIRECT.EXT("'..\mens\[mens_div3b.xls]table calculations'!"&ADDRESS(MOD(ROW($A31)-6,12)+13,64+MOD(COLUMN(P$1)-2,8)+2,4)) -> 6
B32: =INDIRECT.EXT("'..\mens\[mens_div3a.xls]table calculations'!"&ADDRESS(MOD(ROW($A32)-6,12)+13,64+MOD(COLUMN(B$1)-2,8),4)) -> Phoenixwood 2nd | C32: =INDIRECT.EXT("'..\mens\[mens_div3a.xls]table calculations'!"&ADDRESS(MOD(ROW($A32)-6,12)+13,64+MOD(COLUMN(C$1)-2,8),4)) -> 1 | D32: =INDIRECT.EXT("'..\mens\[mens_div3a.xls]table calculations'!"&ADDRESS(MOD(ROW($A32)-6,12)+13,64+MOD(COLUMN(D$1)-2,8),4)) -> 1 | E32: =INDIRECT.EXT("'..\mens\[mens_div3a.xls]table calculations'!"&ADDRESS(MOD(ROW($A32)-6,12)+13,64+MOD(COLUMN(E$1)-2,8),4)) -> 0 | F32: =INDIRECT.EXT("'..\mens\[mens_div3a.xls]table calculations'!"&ADDRESS(MOD(ROW($A32)-6,12)+13,64+MOD(COLUMN(F$1)-2,8),4)) -> 9 | G32: =INDIRECT.EXT("'..\mens\[mens_div3a.xls]table calculations'!"&ADDRESS(MOD(ROW($A32)-6,12)+13,64+MOD(COLUMN(G$1)-2,8),4)) -> 0 | H32: =INDIRECT.EXT("'..\mens\[mens_div3a.xls]table calculations'!"&ADDRESS(MOD(ROW($A32)-6,12)+13,64+MOD(COLUMN(H$1)-2,8)+2,4)) -> 2 | J32: =INDIRECT.EXT("'..\mens\[mens_div3b.xls]table calculations'!"&ADDRESS(MOD(ROW($A32)-6,12)+13,64+MOD(COLUMN(J$1)-2,8),4)) -> University 3rd | K32: =INDIRECT.EXT("'..\mens\[mens_div3b.xls]table calculations'!"&ADDRESS(MOD(ROW($A32)-6,12)+13,64+MOD(COLUMN(K$1)-2,8),4)) -> 4 | L32: =INDIRECT.EXT("'..\mens\[mens_div3b.xls]table calculations'!"&ADDRESS(MOD(ROW($A32)-6,12)+13,64+MOD(COLUMN(L$1)-2,8),4)) -> 2 | M32: =INDIRECT.EXT("'..\mens\[mens_div3b.xls]table calculations'!"&ADDRESS(MOD(ROW($A32)-6,12)+13,64+MOD(COLUMN(M$1)-2,8),4)) -> 2 | N32: =INDIRECT.EXT("'..\mens\[mens_div3b.xls]table calculations'!"&ADDRESS(MOD(ROW($A32)-6,12)+13,64+MOD(COLUMN(N$1)-2,8),4)) -> 24 | O32: =INDIRECT.EXT("'..\mens\[mens_div3b.xls]table calculations'!"&ADDRESS(MOD(ROW($A32)-6,12)+13,64+MOD(COLUMN(O$1)-2,8),4)) -> 12 | P32: =INDIRECT.EXT("'..\mens\[mens_div3b.xls]table calculations'!"&ADDRESS(MOD(ROW($A32)-6,12)+13,64+MOD(COLUMN(P$1)-2,8)+2,4)) -> 4
B33: =INDIRECT.EXT("'..\mens\[mens_div3a.xls]table calculations'!"&ADDRESS(MOD(ROW($A33)-6,12)+13,64+MOD(COLUMN(B$1)-2,8),4)) -> Boots 2nd | C33: =INDIRECT.EXT("'..\mens\[mens_div3a.xls]table calculations'!"&ADDRESS(MOD(ROW($A33)-6,12)+13,64+MOD(COLUMN(C$1)-2,8),4)) -> 2 | D33: =INDIRECT.EXT("'..\mens\[mens_div3a.xls]table calculations'!"&ADDRESS(MOD(ROW($A33)-6,12)+13,64+MOD(COLUMN(D$1)-2,8),4)) -> 1 | E33: =INDIRECT.EXT("'..\mens\[mens_div3a.xls]table calculations'!"&ADDRESS(MOD(ROW($A33)-6,12)+13,64+MOD(COLUMN(E$1)-2,8),4)) -> 1 | F33: =INDIRECT.EXT("'..\mens\[mens_div3a.xls]table calculations'!"&ADDRESS(MOD(ROW($A33)-6,12)+13,64+MOD(COLUMN(F$1)-2,8),4)) -> 13 | G33: =INDIRECT.EXT("'..\mens\[mens_div3a.xls]table calculations'!"&ADDRESS(MOD(ROW($A33)-6,12)+13,64+MOD(COLUMN(G$1)-2,8),4)) -> 5 | H33: =INDIRECT.EXT("'..\mens\[mens_div3a.xls]table calculations'!"&ADDRESS(MOD(ROW($A33)-6,12)+13,64+MOD(COLUMN(H$1)-2,8)+2,4)) -> 2 | J33: =INDIRECT.EXT("'..\mens\[mens_div3b.xls]table calculations'!"&ADDRESS(MOD(ROW($A33)-6,12)+13,64+MOD(COLUMN(J$1)-2,8),4)) -> East Leake 2nd | K33: =INDIRECT.EXT("'..\mens\[mens_div3b.xls]table calculations'!"&ADDRESS(MOD(ROW($A33)-6,12)+13,64+MOD(COLUMN(K$1)-2,8),4)) -> 2 | L33: =INDIRECT.EXT("'..\mens\[mens_div3b.xls]table calculations'!"&ADDRESS(MOD(ROW($A33)-6,12)+13,64+MOD(COLUMN(L$1)-2,8),4)) -> 1 | M33: =INDIRECT.EXT("'..\mens\[mens_div3b.xls]table calculations'!"&ADDRESS(MOD(ROW($A33)-6,12)+13,64+MOD(COLUMN(M$1)-2,8),4)) -> 1 | N33: =INDIRECT.EXT("'..\mens\[mens_div3b.xls]table calculations'!"&ADDRESS(MOD(ROW($A33)-6,12)+13,64+MOD(COLUMN(N$1)-2,8),4)) -> 9 | O33: =INDIRECT.EXT("'..\mens\[mens_div3b.xls]table calculations'!"&ADDRESS(MOD(ROW($A33)-6,12)+13,64+MOD(COLUMN(O$1)-2,8),4)) -> 9 | P33: =INDIRECT.EXT("'..\mens\[mens_div3b.xls]table calculations'!"&ADDRESS(MOD(ROW($A33)-6,12)+13,64+MOD(COLUMN(P$1)-2,8)+2,4)) -> 2
B34: =INDIRECT.EXT("'..\mens\[mens_div3a.xls]table calculations'!"&ADDRESS(MOD(ROW($A34)-6,12)+13,64+MOD(COLUMN(B$1)-2,8),4)) -> Beeston Valley 1st | C34: =INDIRECT.EXT("'..\mens\[mens_div3a.xls]table calculations'!"&ADDRESS(MOD(ROW($A34)-6,12)+13,64+MOD(COLUMN(C$1)-2,8),4)) -> 2 | D34: =INDIRECT.EXT("'..\mens\[mens_div3a.xls]table calculations'!"&ADDRESS(MOD(ROW($A34)-6,12)+13,64+MOD(COLUMN(D$1)-2,8),4)) -> 1 | E34: =INDIRECT.EXT("'..\mens\[mens_div3a.xls]table calculations'!"&ADDRESS(MOD(ROW($A34)-6,12)+13,64+MOD(COLUMN(E$1)-2,8),4)) -> 1 | F34: =INDIRECT.EXT("'..\mens\[mens_div3a.xls]table calculations'!"&ADDRESS(MOD(ROW($A34)-6,12)+13,64+MOD(COLUMN(F$1)-2,8),4)) -> 10 | G34: =INDIRECT.EXT("'..\mens\[mens_div3a.xls]table calculations'!"&ADDRESS(MOD(ROW($A34)-6,12)+13,64+MOD(COLUMN(G$1)-2,8),4)) -> 8 | H34: =INDIRECT.EXT("'..\mens\[mens_div3a.xls]table calculations'!"&ADDRESS(MOD(ROW($A34)-6,12)+13,64+MOD(COLUMN(H$1)-2,8)+2,4)) -> 2 | J34: =INDIRECT.EXT("'..\mens\[mens_div3b.xls]table calculations'!"&ADDRESS(MOD(ROW($A34)-6,12)+13,64+MOD(COLUMN(J$1)-2,8),4)) -> Naseeb 2nd | K34: =INDIRECT.EXT("'..\mens\[mens_div3b.xls]table calculations'!"&ADDRESS(MOD(ROW($A34)-6,12)+13,64+MOD(COLUMN(K$1)-2,8),4)) -> 3 | L34: =INDIRECT.EXT("'..\mens\[mens_div3b.xls]table calculations'!"&ADDRESS(MOD(ROW($A34)-6,12)+13,64+MOD(COLUMN(L$1)-2,8),4)) -> 1 | M34: =INDIRECT.EXT("'..\mens\[mens_div3b.xls]table calculations'!"&ADDRESS(MOD(ROW($A34)-6,12)+13,64+MOD(COLUMN(M$1)-2,8),4)) -> 2 | N34: =INDIRECT.EXT("'..\mens\[mens_div3b.xls]table calculations'!"&ADDRESS(MOD(ROW($A34)-6,12)+13,64+MOD(COLUMN(N$1)-2,8),4)) -> 11 | O34: =INDIRECT.EXT("'..\mens\[mens_div3b.xls]table calculations'!"&ADDRESS(MOD(ROW($A34)-6,12)+13,64+MOD(COLUMN(O$1)-2,8),4)) -> 16 | P34: =INDIRECT.EXT("'..\mens\[mens_div3b.xls]table calculations'!"&ADDRESS(MOD(ROW($A34)-6,12)+13,64+MOD(COLUMN(P$1)-2,8)+2,4)) -> 2
B35: =INDIRECT.EXT("'..\mens\[mens_div3a.xls]table calculations'!"&ADDRESS(MOD(ROW($A35)-6,12)+13,64+MOD(COLUMN(B$1)-2,8),4)) -> Kimberley 1st | C35: =INDIRECT.EXT("'..\mens\[mens_div3a.xls]table calculations'!"&ADDRESS(MOD(ROW($A35)-6,12)+13,64+MOD(COLUMN(C$1)-2,8),4)) -> 3 | D35: =INDIRECT.EXT("'..\mens\[mens_div3a.xls]table calculations'!"&ADDRESS(MOD(ROW($A35)-6,12)+13,64+MOD(COLUMN(D$1)-2,8),4)) -> 1 | E35: =INDIRECT.EXT("'..\mens\[mens_div3a.xls]table calculations'!"&ADDRESS(MOD(ROW($A35)-6,12)+13,64+MOD(COLUMN(E$1)-2,8),4)) -> 2 | F35: =INDIRECT.EXT("'..\mens\[mens_div3a.xls]table calculations'!"&ADDRESS(MOD(ROW($A35)-6,12)+13,64+MOD(COLUMN(F$1)-2,8),4)) -> 12 | G35: =INDIRECT.EXT("'..\mens\[mens_div3a.xls]table calculations'!"&ADDRESS(MOD(ROW($A35)-6,12)+13,64+MOD(COLUMN(G$1)-2,8),4)) -> 15 | H35: =INDIRECT.EXT("'..\mens\[mens_div3a.xls]table calculations'!"&ADDRESS(MOD(ROW($A35)-6,12)+13,64+MOD(COLUMN(H$1)-2,8)+2,4)) -> 2 | J35: =INDIRECT.EXT("'..\mens\[mens_div3b.xls]table calculations'!"&ADDRESS(MOD(ROW($A35)-6,12)+13,64+MOD(COLUMN(J$1)-2,8),4)) -> Carlton 3rd | K35: =INDIRECT.EXT("'..\mens\[mens_div3b.xls]table calculations'!"&ADDRESS(MOD(ROW($A35)-6,12)+13,64+MOD(COLUMN(K$1)-2,8),4)) -> 4 | L35: =INDIRECT.EXT("'..\mens\[mens_div3b.xls]table calculations'!"&ADDRESS(MOD(ROW($A35)-6,12)+13,64+MOD(COLUMN(L$1)-2,8),4)) -> 0 | M35: =INDIRECT.EXT("'..\mens\[mens_div3b.xls]table calculations'!"&ADDRESS(MOD(ROW($A35)-6,12)+13,64+MOD(COLUMN(M$1)-2,8),4)) -> 4 | N35: =INDIRECT.EXT("'..\mens\[mens_div3b.xls]table calculations'!"&ADDRESS(MOD(ROW($A35)-6,12)+13,64+MOD(COLUMN(N$1)-2,8),4)) -> 2 | O35: =INDIRECT.EXT("'..\mens\[mens_div3b.xls]table calculations'!"&ADDRESS(MOD(ROW($A35)-6,12)+13,64+MOD(COLUMN(O$1)-2,8),4)) -> 34 | P35: =INDIRECT.EXT("'..\mens\[mens_div3b.xls]table calculations'!"&ADDRESS(MOD(ROW($A35)-6,12)+13,64+MOD(COLUMN(P$1)-2,8)+2,4)) -> 0
B36: =INDIRECT.EXT("'..\mens\[mens_div3a.xls]table calculations'!"&ADDRESS(MOD(ROW($A36)-6,12)+13,64+MOD(COLUMN(B$1)-2,8),4)) -> Redhill 1st | C36: =INDIRECT.EXT("'..\mens\[mens_div3a.xls]table calculations'!"&ADDRESS(MOD(ROW($A36)-6,12)+13,64+MOD(COLUMN(C$1)-2,8),4)) -> 4 | D36: =INDIRECT.EXT("'..\mens\[mens_div3a.xls]table calculations'!"&ADDRESS(MOD(ROW($A36)-6,12)+13,64+MOD(COLUMN(D$1)-2,8),4)) -> 0 | E36: =INDIRECT.EXT("'..\mens\[mens_div3a.xls]table calculations'!"&ADDRESS(MOD(ROW($A36)-6,12)+13,64+MOD(COLUMN(E$1)-2,8),4)) -> 4 | F36: =INDIRECT.EXT("'..\mens\[mens_div3a.xls]table calculations'!"&ADDRESS(MOD(ROW($A36)-6,12)+13,64+MOD(COLUMN(F$1)-2,8),4)) -> 2 | G36: =INDIRECT.EXT("'..\mens\[mens_div3a.xls]table calculations'!"&ADDRESS(MOD(ROW($A36)-6,12)+13,64+MOD(COLUMN(G$1)-2,8),4)) -> 34 | H36: =INDIRECT.EXT("'..\mens\[mens_div3a.xls]table calculations'!"&ADDRESS(MOD(ROW($A36)-6,12)+13,64+MOD(COLUMN(H$1)-2,8)+2,4)) -> 0 | J36: =INDIRECT.EXT("'..\mens\[mens_div3b.xls]table calculations'!"&ADDRESS(MOD(ROW($A36)-6,12)+13,64+MOD(COLUMN(J$1)-2,8),4)) -> David Lloyd WB | K36: =INDIRECT.EXT("'..\mens\[mens_div3b.xls]table calculations'!"&ADDRESS(MOD(ROW($A36)-6,12)+13,64+MOD(COLUMN(K$1)-2,8),4)) -> 0 | L36: =INDIRECT.EXT("'..\mens\[mens_div3b.xls]table calculations'!"&ADDRESS(MOD(ROW($A36)-6,12)+13,64+MOD(COLUMN(L$1)-2,8),4)) -> 0 | M36: =INDIRECT.EXT("'..\mens\[mens_div3b.xls]table calculations'!"&ADDRESS(MOD(ROW($A36)-6,12)+13,64+MOD(COLUMN(M$1)-2,8),4)) -> 0 | N36: =INDIRECT.EXT("'..\mens\[mens_div3b.xls]table calculations'!"&ADDRESS(MOD(ROW($A36)-6,12)+13,64+MOD(COLUMN(N$1)-2,8),4)) -> 0 | O36: =INDIRECT.EXT("'..\mens\[mens_div3b.xls]table calculations'!"&ADDRESS(MOD(ROW($A36)-6,12)+13,64+MOD(COLUMN(O$1)-2,8),4)) -> 0 | P36: =INDIRECT.EXT("'..\mens\[mens_div3b.xls]table calculations'!"&ADDRESS(MOD(ROW($A36)-6,12)+13,64+MOD(COLUMN(P$1)-2,8)+2,4)) -> 0
B37: =INDIRECT.EXT("'..\mens\[mens_div3a.xls]table calculations'!"&ADDRESS(MOD(ROW($A37)-6,12)+13,64+MOD(COLUMN(B$1)-2,8),4)) -> _ | C37: =INDIRECT.EXT("'..\mens\[mens_div3a.xls]table calculations'!"&ADDRESS(MOD(ROW($A37)-6,12)+13,64+MOD(COLUMN(C$1)-2,8),4)) -> _ | D37: =INDIRECT.EXT("'..\mens\[mens_div3a.xls]table calculations'!"&ADDRESS(MOD(ROW($A37)-6,12)+13,64+MOD(COLUMN(D$1)-2,8),4)) -> _ | E37: =INDIRECT.EXT("'..\mens\[mens_div3a.xls]table calculations'!"&ADDRESS(MOD(ROW($A37)-6,12)+13,64+MOD(COLUMN(E$1)-2,8),4)) -> _ | F37: =INDIRECT.EXT("'..\mens\[mens_div3a.xls]table calculations'!"&ADDRESS(MOD(ROW($A37)-6,12)+13,64+MOD(COLUMN(F$1)-2,8),4)) -> _ | G37: =INDIRECT.EXT("'..\mens\[mens_div3a.xls]table calculations'!"&ADDRESS(MOD(ROW($A37)-6,12)+13,64+MOD(COLUMN(G$1)-2,8),4)) -> _ | H37: =INDIRECT.EXT("'..\mens\[mens_div3a.xls]table calculations'!"&ADDRESS(MOD(ROW($A37)-6,12)+13,64+MOD(COLUMN(H$1)-2,8)+2,4)) -> _ | J37: =INDIRECT.EXT("'..\mens\[mens_div3b.xls]table calculations'!"&ADDRESS(MOD(ROW($A37)-6,12)+13,64+MOD(COLUMN(J$1)-2,8),4)) -> _ | K37: =INDIRECT.EXT("'..\mens\[mens_div3b.xls]table calculations'!"&ADDRESS(MOD(ROW($A37)-6,12)+13,64+MOD(COLUMN(K$1)-2,8),4)) -> _ | L37: =INDIRECT.EXT("'..\mens\[mens_div3b.xls]table calculations'!"&ADDRESS(MOD(ROW($A37)-6,12)+13,64+MOD(COLUMN(L$1)-2,8),4)) -> _ | M37: =INDIRECT.EXT("'..\mens\[mens_div3b.xls]table calculations'!"&ADDRESS(MOD(ROW($A37)-6,12)+13,64+MOD(COLUMN(M$1)-2,8),4)) -> _ | N37: =INDIRECT.EXT("'..\mens\[mens_div3b.xls]table calculations'!"&ADDRESS(MOD(ROW($A37)-6,12)+13,64+MOD(COLUMN(N$1)-2,8),4)) -> _ | O37: =INDIRECT.EXT("'..\mens\[mens_div3b.xls]table calculations'!"&ADDRESS(MOD(ROW($A37)-6,12)+13,64+MOD(COLUMN(O$1)-2,8),4)) -> _ | P37: =INDIRECT.EXT("'..\mens\[mens_div3b.xls]table calculations'!"&ADDRESS(MOD(ROW($A37)-6,12)+13,64+MOD(COLUMN(P$1)-2,8)+2,4)) -> _
B39: Mens Div 4A | J39: Mens Div 4B
B40: League Table | J40: League Table
B41: S T A N D I N G S | C41: p | D41: w | E41: l | F41: rf | G41: ra | H41: pts | J41: S T A N D I N G S | K41: p | L41: w | M41: l | N41: rf | O41: ra | P41: pts
B42: =INDIRECT.EXT("'..\mens\[mens_div4a.xls]table calculations'!"&ADDRESS(MOD(ROW($A42)-6,12)+13,64+MOD(COLUMN(B$1)-2,8),4)) -> West Bridgford & LE 3rd | C42: =INDIRECT.EXT("'..\mens\[mens_div4a.xls]table calculations'!"&ADDRESS(MOD(ROW($A42)-6,12)+13,64+MOD(COLUMN(C$1)-2,8),4)) -> 3 | D42: =INDIRECT.EXT("'..\mens\[mens_div4a.xls]table calculations'!"&ADDRESS(MOD(ROW($A42)-6,12)+13,64+MOD(COLUMN(D$1)-2,8),4)) -> 3 | E42: =INDIRECT.EXT("'..\mens\[mens_div4a.xls]table calculations'!"&ADDRESS(MOD(ROW($A42)-6,12)+13,64+MOD(COLUMN(E$1)-2,8),4)) -> 0 | F42: =INDIRECT.EXT("'..\mens\[mens_div4a.xls]table calculations'!"&ADDRESS(MOD(ROW($A42)-6,12)+13,64+MOD(COLUMN(F$1)-2,8),4)) -> 27 | G42: =INDIRECT.EXT("'..\mens\[mens_div4a.xls]table calculations'!"&ADDRESS(MOD(ROW($A42)-6,12)+13,64+MOD(COLUMN(G$1)-2,8),4)) -> 0 | H42: =INDIRECT.EXT("'..\mens\[mens_div4a.xls]table calculations'!"&ADDRESS(MOD(ROW($A42)-6,12)+13,64+MOD(COLUMN(H$1)-2,8)+2,4)) -> 6 | J42: =INDIRECT.EXT("'..\mens\[mens_div4b.xls]table calculations'!"&ADDRESS(MOD(ROW($A42)-6,12)+13,64+MOD(COLUMN(J$1)-2,8),4)) -> Naseeb 3rd | K42: =INDIRECT.EXT("'..\mens\[mens_div4b.xls]table calculations'!"&ADDRESS(MOD(ROW($A42)-6,12)+13,64+MOD(COLUMN(K$1)-2,8),4)) -> 5 | L42: =INDIRECT.EXT("'..\mens\[mens_div4b.xls]table calculations'!"&ADDRESS(MOD(ROW($A42)-6,12)+13,64+MOD(COLUMN(L$1)-2,8),4)) -> 4 | M42: =INDIRECT.EXT("'..\mens\[mens_div4b.xls]table calculations'!"&ADDRESS(MOD(ROW($A42)-6,12)+13,64+MOD(COLUMN(M$1)-2,8),4)) -> 1 | N42: =INDIRECT.EXT("'..\mens\[mens_div4b.xls]table calculations'!"&ADDRESS(MOD(ROW($A42)-6,12)+13,64+MOD(COLUMN(N$1)-2,8),4)) -> 30 | O42: =INDIRECT.EXT("'..\mens\[mens_div4b.xls]table calculations'!"&ADDRESS(MOD(ROW($A42)-6,12)+13,64+MOD(COLUMN(O$1)-2,8),4)) -> 15 | P42: =INDIRECT.EXT("'..\mens\[mens_div4b.xls]table calculations'!"&ADDRESS(MOD(ROW($A42)-6,12)+13,64+MOD(COLUMN(P$1)-2,8)+2,4)) -> 8
B43: =INDIRECT.EXT("'..\mens\[mens_div4a.xls]table calculations'!"&ADDRESS(MOD(ROW($A43)-6,12)+13,64+MOD(COLUMN(B$1)-2,8),4)) -> David Lloyd Aspley 1st | C43: =INDIRECT.EXT("'..\mens\[mens_div4a.xls]table calculations'!"&ADDRESS(MOD(ROW($A43)-6,12)+13,64+MOD(COLUMN(C$1)-2,8),4)) -> 3 | D43: =INDIRECT.EXT("'..\mens\[mens_div4a.xls]table calculations'!"&ADDRESS(MOD(ROW($A43)-6,12)+13,64+MOD(COLUMN(D$1)-2,8),4)) -> 3 | E43: =INDIRECT.EXT("'..\mens\[mens_div4a.xls]table calculations'!"&ADDRESS(MOD(ROW($A43)-6,12)+13,64+MOD(COLUMN(E$1)-2,8),4)) -> 0 | F43: =INDIRECT.EXT("'..\mens\[mens_div4a.xls]table calculations'!"&ADDRESS(MOD(ROW($A43)-6,12)+13,64+MOD(COLUMN(F$1)-2,8),4)) -> 18 | G43: =INDIRECT.EXT("'..\mens\[mens_div4a.xls]table calculations'!"&ADDRESS(MOD(ROW($A43)-6,12)+13,64+MOD(COLUMN(G$1)-2,8),4)) -> 9 | H43: =INDIRECT.EXT("'..\mens\[mens_div4a.xls]table calculations'!"&ADDRESS(MOD(ROW($A43)-6,12)+13,64+MOD(COLUMN(H$1)-2,8)+2,4)) -> 6 | J43: =INDIRECT.EXT("'..\mens\[mens_div4b.xls]table calculations'!"&ADDRESS(MOD(ROW($A43)-6,12)+13,64+MOD(COLUMN(J$1)-2,8),4)) -> Mapperley Park 4th | K43: =INDIRECT.EXT("'..\mens\[mens_div4b.xls]table calculations'!"&ADDRESS(MOD(ROW($A43)-6,12)+13,64+MOD(COLUMN(K$1)-2,8),4)) -> 4 | L43: =INDIRECT.EXT("'..\mens\[mens_div4b.xls]table calculations'!"&ADDRESS(MOD(ROW($A43)-6,12)+13,64+MOD(COLUMN(L$1)-2,8),4)) -> 4 | M43: =INDIRECT.EXT("'..\mens\[mens_div4b.xls]table calculations'!"&ADDRESS(MOD(ROW($A43)-6,12)+13,64+MOD(COLUMN(M$1)-2,8),4)) -> 0 | N43: =INDIRECT.EXT("'..\mens\[mens_div4b.xls]table calculations'!"&ADDRESS(MOD(ROW($A43)-6,12)+13,64+MOD(COLUMN(N$1)-2,8),4)) -> 22 | O43: =INDIRECT.EXT("'..\mens\[mens_div4b.xls]table calculations'!"&ADDRESS(MOD(ROW($A43)-6,12)+13,64+MOD(COLUMN(O$1)-2,8),4)) -> 14 | P43: =INDIRECT.EXT("'..\mens\[mens_div4b.xls]table calculations'!"&ADDRESS(MOD(ROW($A43)-6,12)+13,64+MOD(COLUMN(P$1)-2,8)+2,4)) -> 8
B44: =INDIRECT.EXT("'..\mens\[mens_div4a.xls]table calculations'!"&ADDRESS(MOD(ROW($A44)-6,12)+13,64+MOD(COLUMN(B$1)-2,8),4)) -> East Leake 3rd | C44: =INDIRECT.EXT("'..\mens\[mens_div4a.xls]table calculations'!"&ADDRESS(MOD(ROW($A44)-6,12)+13,64+MOD(COLUMN(C$1)-2,8),4)) -> 3 | D44: =INDIRECT.EXT("'..\mens\[mens_div4a.xls]table calculations'!"&ADDRESS(MOD(ROW($A44)-6,12)+13,64+MOD(COLUMN(D$1)-2,8),4)) -> 1 | E44: =INDIRECT.EXT("'..\mens\[mens_div4a.xls]table calculations'!"&ADDRESS(MOD(ROW($A44)-6,12)+13,64+MOD(COLUMN(E$1)-2,8),4)) -> 2 | F44: =INDIRECT.EXT("'..\mens\[mens_div4a.xls]table calculations'!"&ADDRESS(MOD(ROW($A44)-6,12)+13,64+MOD(COLUMN(F$1)-2,8),4)) -> 11 | G44: =INDIRECT.EXT("'..\mens\[mens_div4a.xls]table calculations'!"&ADDRESS(MOD(ROW($A44)-6,12)+13,64+MOD(COLUMN(G$1)-2,8),4)) -> 16 | H44: =INDIRECT.EXT("'..\mens\[mens_div4a.xls]table calculations'!"&ADDRESS(MOD(ROW($A44)-6,12)+13,64+MOD(COLUMN(H$1)-2,8)+2,4)) -> 2 | J44: =INDIRECT.EXT("'..\mens\[mens_div4b.xls]table calculations'!"&ADDRESS(MOD(ROW($A44)-6,12)+13,64+MOD(COLUMN(J$1)-2,8),4)) -> Byron 4th | K44: =INDIRECT.EXT("'..\mens\[mens_div4b.xls]table calculations'!"&ADDRESS(MOD(ROW($A44)-6,12)+13,64+MOD(COLUMN(K$1)-2,8),4)) -> 4 | L44: =INDIRECT.EXT("'..\mens\[mens_div4b.xls]table calculations'!"&ADDRESS(MOD(ROW($A44)-6,12)+13,64+MOD(COLUMN(L$1)-2,8),4)) -> 2 | M44: =INDIRECT.EXT("'..\mens\[mens_div4b.xls]table calculations'!"&ADDRESS(MOD(ROW($A44)-6,12)+13,64+MOD(COLUMN(M$1)-2,8),4)) -> 2 | N44: =INDIRECT.EXT("'..\mens\[mens_div4b.xls]table calculations'!"&ADDRESS(MOD(ROW($A44)-6,12)+13,64+MOD(COLUMN(N$1)-2,8),4)) -> 23 | O44: =INDIRECT.EXT("'..\mens\[mens_div4b.xls]table calculations'!"&ADDRESS(MOD(ROW($A44)-6,12)+13,64+MOD(COLUMN(O$1)-2,8),4)) -> 13 | P44: =INDIRECT.EXT("'..\mens\[mens_div4b.xls]table calculations'!"&ADDRESS(MOD(ROW($A44)-6,12)+13,64+MOD(COLUMN(P$1)-2,8)+2,4)) -> 4
B45: =INDIRECT.EXT("'..\mens\[mens_div4a.xls]table calculations'!"&ADDRESS(MOD(ROW($A45)-6,12)+13,64+MOD(COLUMN(B$1)-2,8),4)) -> Beeston Valley 2nd | C45: =INDIRECT.EXT("'..\mens\[mens_div4a.xls]table calculations'!"&ADDRESS(MOD(ROW($A45)-6,12)+13,64+MOD(COLUMN(C$1)-2,8),4)) -> 2 | D45: =INDIRECT.EXT("'..\mens\[mens_div4a.xls]table calculations'!"&ADDRESS(MOD(ROW($A45)-6,12)+13,64+MOD(COLUMN(D$1)-2,8),4)) -> 1 | E45: =INDIRECT.EXT("'..\mens\[mens_div4a.xls]table calculations'!"&ADDRESS(MOD(ROW($A45)-6,12)+13,64+MOD(COLUMN(E$1)-2,8),4)) -> 1 | F45: =INDIRECT.EXT("'..\mens\[mens_div4a.xls]table calculations'!"&ADDRESS(MOD(ROW($A45)-6,12)+13,64+MOD(COLUMN(F$1)-2,8),4)) -> 7 | G45: =INDIRECT.EXT("'..\mens\[mens_div4a.xls]table calculations'!"&ADDRESS(MOD(ROW($A45)-6,12)+13,64+MOD(COLUMN(G$1)-2,8),4)) -> 11 | H45: =INDIRECT.EXT("'..\mens\[mens_div4a.xls]table calculations'!"&ADDRESS(MOD(ROW($A45)-6,12)+13,64+MOD(COLUMN(H$1)-2,8)+2,4)) -> 2 | J45: =INDIRECT.EXT("'..\mens\[mens_div4b.xls]table calculations'!"&ADDRESS(MOD(ROW($A45)-6,12)+13,64+MOD(COLUMN(J$1)-2,8),4)) -> Arboretum 1st | K45: =INDIRECT.EXT("'..\mens\[mens_div4b.xls]table calculations'!"&ADDRESS(MOD(ROW($A45)-6,12)+13,64+MOD(COLUMN(K$1)-2,8),4)) -> 3 | L45: =INDIRECT.EXT("'..\mens\[mens_div4b.xls]table calculations'!"&ADDRESS(MOD(ROW($A45)-6,12)+13,64+MOD(COLUMN(L$1)-2,8),4)) -> 1 | M45: =INDIRECT.EXT("'..\mens\[mens_div4b.xls]table calculations'!"&ADDRESS(MOD(ROW($A45)-6,12)+13,64+MOD(COLUMN(M$1)-2,8),4)) -> 2 | N45: =INDIRECT.EXT("'..\mens\[mens_div4b.xls]table calculations'!"&ADDRESS(MOD(ROW($A45)-6,12)+13,64+MOD(COLUMN(N$1)-2,8),4)) -> 16 | O45: =INDIRECT.EXT("'..\mens\[mens_div4b.xls]table calculations'!"&ADDRESS(MOD(ROW($A45)-6,12)+13,64+MOD(COLUMN(O$1)-2,8),4)) -> 11 | P45: =INDIRECT.EXT("'..\mens\[mens_div4b.xls]table calculations'!"&ADDRESS(MOD(ROW($A45)-6,12)+13,64+MOD(COLUMN(P$1)-2,8)+2,4)) -> 2
B46: =INDIRECT.EXT("'..\mens\[mens_div4a.xls]table calculations'!"&ADDRESS(MOD(ROW($A46)-6,12)+13,64+MOD(COLUMN(B$1)-2,8),4)) -> Nottingham Vets 2nd | C46: =INDIRECT.EXT("'..\mens\[mens_div4a.xls]table calculations'!"&ADDRESS(MOD(ROW($A46)-6,12)+13,64+MOD(COLUMN(C$1)-2,8),4)) -> 3 | D46: =INDIRECT.EXT("'..\mens\[mens_div4a.xls]table calculations'!"&ADDRESS(MOD(ROW($A46)-6,12)+13,64+MOD(COLUMN(D$1)-2,8),4)) -> 1 | E46: =INDIRECT.EXT("'..\mens\[mens_div4a.xls]table calculations'!"&ADDRESS(MOD(ROW($A46)-6,12)+13,64+MOD(COLUMN(E$1)-2,8),4)) -> 2 | F46: =INDIRECT.EXT("'..\mens\[mens_div4a.xls]table calculations'!"&ADDRESS(MOD(ROW($A46)-6,12)+13,64+MOD(COLUMN(F$1)-2,8),4)) -> 8 | G46: =INDIRECT.EXT("'..\mens\[mens_div4a.xls]table calculations'!"&ADDRESS(MOD(ROW($A46)-6,12)+13,64+MOD(COLUMN(G$1)-2,8),4)) -> 19 | H46: =INDIRECT.EXT("'..\mens\[mens_div4a.xls]table calculations'!"&ADDRESS(MOD(ROW($A46)-6,12)+13,64+MOD(COLUMN(H$1)-2,8)+2,4)) -> 2 | J46: =INDIRECT.EXT("'..\mens\[mens_div4b.xls]table calculations'!"&ADDRESS(MOD(ROW($A46)-6,12)+13,64+MOD(COLUMN(J$1)-2,8),4)) -> Southwell Centre 2nd | K46: =INDIRECT.EXT("'..\mens\[mens_div4b.xls]table calculations'!"&ADDRESS(MOD(ROW($A46)-6,12)+13,64+MOD(COLUMN(K$1)-2,8),4)) -> 2 | L46: =INDIRECT.EXT("'..\mens\[mens_div4b.xls]table calculations'!"&ADDRESS(MOD(ROW($A46)-6,12)+13,64+MOD(COLUMN(L$1)-2,8),4)) -> 1 | M46: =INDIRECT.EXT("'..\mens\[mens_div4b.xls]table calculations'!"&ADDRESS(MOD(ROW($A46)-6,12)+13,64+MOD(COLUMN(M$1)-2,8),4)) -> 1 | N46: =INDIRECT.EXT("'..\mens\[mens_div4b.xls]table calculations'!"&ADDRESS(MOD(ROW($A46)-6,12)+13,64+MOD(COLUMN(N$1)-2,8),4)) -> 10 | O46: =INDIRECT.EXT("'..\mens\[mens_div4b.xls]table calculations'!"&ADDRESS(MOD(ROW($A46)-6,12)+13,64+MOD(COLUMN(O$1)-2,8),4)) -> 8 | P46: =INDIRECT.EXT("'..\mens\[mens_div4b.xls]table calculations'!"&ADDRESS(MOD(ROW($A46)-6,12)+13,64+MOD(COLUMN(P$1)-2,8)+2,4)) -> 2
B47: =INDIRECT.EXT("'..\mens\[mens_div4a.xls]table calculations'!"&ADDRESS(MOD(ROW($A47)-6,12)+13,64+MOD(COLUMN(B$1)-2,8),4)) -> Woodborough 1st | C47: =INDIRECT.EXT("'..\mens\[mens_div4a.xls]table calculations'!"&ADDRESS(MOD(ROW($A47)-6,12)+13,64+MOD(COLUMN(C$1)-2,8),4)) -> 2 | D47: =INDIRECT.EXT("'..\mens\[mens_div4a.xls]table calculations'!"&ADDRESS(MOD(ROW($A47)-6,12)+13,64+MOD(COLUMN(D$1)-2,8),4)) -> 0 | E47: =INDIRECT.EXT("'..\mens\[mens_div4a.xls]table calculations'!"&ADDRESS(MOD(ROW($A47)-6,12)+13,64+MOD(COLUMN(E$1)-2,8),4)) -> 2 | F47: =INDIRECT.EXT("'..\mens\[mens_div4a.xls]table calculations'!"&ADDRESS(MOD(ROW($A47)-6,12)+13,64+MOD(COLUMN(F$1)-2,8),4)) -> 6 | G47: =INDIRECT.EXT("'..\mens\[mens_div4a.xls]table calculations'!"&ADDRESS(MOD(ROW($A47)-6,12)+13,64+MOD(COLUMN(G$1)-2,8),4)) -> 12 | H47: =INDIRECT.EXT("'..\mens\[mens_div4a.xls]table calculations'!"&ADDRESS(MOD(ROW($A47)-6,12)+13,64+MOD(COLUMN(H$1)-2,8)+2,4)) -> 0 | J47: =INDIRECT.EXT("'..\mens\[mens_div4b.xls]table calculations'!"&ADDRESS(MOD(ROW($A47)-6,12)+13,64+MOD(COLUMN(J$1)-2,8),4)) -> Phoenixwood 3rd | K47: =INDIRECT.EXT("'..\mens\[mens_div4b.xls]table calculations'!"&ADDRESS(MOD(ROW($A47)-6,12)+13,64+MOD(COLUMN(K$1)-2,8),4)) -> 4 | L47: =INDIRECT.EXT("'..\mens\[mens_div4b.xls]table calculations'!"&ADDRESS(MOD(ROW($A47)-6,12)+13,64+MOD(COLUMN(L$1)-2,8),4)) -> 1 | M47: =INDIRECT.EXT("'..\mens\[mens_div4b.xls]table calculations'!"&ADDRESS(MOD(ROW($A47)-6,12)+13,64+MOD(COLUMN(M$1)-2,8),4)) -> 3 | N47: =INDIRECT.EXT("'..\mens\[mens_div4b.xls]table calculations'!"&ADDRESS(MOD(ROW($A47)-6,12)+13,64+MOD(COLUMN(N$1)-2,8),4)) -> 8 | O47: =INDIRECT.EXT("'..\mens\[mens_div4b.xls]table calculations'!"&ADDRESS(MOD(ROW($A47)-6,12)+13,64+MOD(COLUMN(O$1)-2,8),4)) -> 28 | P47: =INDIRECT.EXT("'..\mens\[mens_div4b.xls]table calculations'!"&ADDRESS(MOD(ROW($A47)-6,12)+13,64+MOD(COLUMN(P$1)-2,8)+2,4)) -> 2
B48: =INDIRECT.EXT("'..\mens\[mens_div4a.xls]table calculations'!"&ADDRESS(MOD(ROW($A48)-6,12)+13,64+MOD(COLUMN(B$1)-2,8),4)) -> St Giles 2nd | C48: =INDIRECT.EXT("'..\mens\[mens_div4a.xls]table calculations'!"&ADDRESS(MOD(ROW($A48)-6,12)+13,64+MOD(COLUMN(C$1)-2,8),4)) -> 2 | D48: =INDIRECT.EXT("'..\mens\[mens_div4a.xls]table calculations'!"&ADDRESS(MOD(ROW($A48)-6,12)+13,64+MOD(COLUMN(D$1)-2,8),4)) -> 0 | E48: =INDIRECT.EXT("'..\mens\[mens_div4a.xls]table calculations'!"&ADDRESS(MOD(ROW($A48)-6,12)+13,64+MOD(COLUMN(E$1)-2,8),4)) -> 2 | F48: =INDIRECT.EXT("'..\mens\[mens_div4a.xls]table calculations'!"&ADDRESS(MOD(ROW($A48)-6,12)+13,64+MOD(COLUMN(F$1)-2,8),4)) -> 4 | G48: =INDIRECT.EXT("'..\mens\[mens_div4a.xls]table calculations'!"&ADDRESS(MOD(ROW($A48)-6,12)+13,64+MOD(COLUMN(G$1)-2,8),4)) -> 14 | H48: =INDIRECT.EXT("'..\mens\[mens_div4a.xls]table calculations'!"&ADDRESS(MOD(ROW($A48)-6,12)+13,64+MOD(COLUMN(H$1)-2,8)+2,4)) -> 0 | J48: =INDIRECT.EXT("'..\mens\[mens_div4b.xls]table calculations'!"&ADDRESS(MOD(ROW($A48)-6,12)+13,64+MOD(COLUMN(J$1)-2,8),4)) -> David Lloyd Aspley 2nd | K48: =INDIRECT.EXT("'..\mens\[mens_div4b.xls]table calculations'!"&ADDRESS(MOD(ROW($A48)-6,12)+13,64+MOD(COLUMN(K$1)-2,8),4)) -> 4 | L48: =INDIRECT.EXT("'..\mens\[mens_div4b.xls]table calculations'!"&ADDRESS(MOD(ROW($A48)-6,12)+13,64+MOD(COLUMN(L$1)-2,8),4)) -> 0 | M48: =INDIRECT.EXT("'..\mens\[mens_div4b.xls]table calculations'!"&ADDRESS(MOD(ROW($A48)-6,12)+13,64+MOD(COLUMN(M$1)-2,8),4)) -> 4 | N48: =INDIRECT.EXT("'..\mens\[mens_div4b.xls]table calculations'!"&ADDRESS(MOD(ROW($A48)-6,12)+13,64+MOD(COLUMN(N$1)-2,8),4)) -> 8 | O48: =INDIRECT.EXT("'..\mens\[mens_div4b.xls]table calculations'!"&ADDRESS(MOD(ROW($A48)-6,12)+13,64+MOD(COLUMN(O$1)-2,8),4)) -> 28 | P48: =INDIRECT.EXT("'..\mens\[mens_div4b.xls]table calculations'!"&ADDRESS(MOD(ROW($A48)-6,12)+13,64+MOD(COLUMN(P$1)-2,8)+2,4)) -> 0
B49: =INDIRECT.EXT("'..\mens\[mens_div4a.xls]table calculations'!"&ADDRESS(MOD(ROW($A49)-6,12)+13,64+MOD(COLUMN(B$1)-2,8),4)) -> _ | C49: =INDIRECT.EXT("'..\mens\[mens_div4a.xls]table calculations'!"&ADDRESS(MOD(ROW($A49)-6,12)+13,64+MOD(COLUMN(C$1)-2,8),4)) -> _ | D49: =INDIRECT.EXT("'..\mens\[mens_div4a.xls]table calculations'!"&ADDRESS(MOD(ROW($A49)-6,12)+13,64+MOD(COLUMN(D$1)-2,8),4)) -> _ | E49: =INDIRECT.EXT("'..\mens\[mens_div4a.xls]table calculations'!"&ADDRESS(MOD(ROW($A49)-6,12)+13,64+MOD(COLUMN(E$1)-2,8),4)) -> _ | F49: =INDIRECT.EXT("'..\mens\[mens_div4a.xls]table calculations'!"&ADDRESS(MOD(ROW($A49)-6,12)+13,64+MOD(COLUMN(F$1)-2,8),4)) -> _ | G49: =INDIRECT.EXT("'..\mens\[mens_div4a.xls]table calculations'!"&ADDRESS(MOD(ROW($A49)-6,12)+13,64+MOD(COLUMN(G$1)-2,8),4)) -> _ | H49: =INDIRECT.EXT("'..\mens\[mens_div4a.xls]table calculations'!"&ADDRESS(MOD(ROW($A49)-6,12)+13,64+MOD(COLUMN(H$1)-2,8)+2,4)) -> _ | J49: =INDIRECT.EXT("'..\mens\[mens_div4b.xls]table calculations'!"&ADDRESS(MOD(ROW($A49)-6,12)+13,64+MOD(COLUMN(J$1)-2,8),4)) -> _ | K49: =INDIRECT.EXT("'..\mens\[mens_div4b.xls]table calculations'!"&ADDRESS(MOD(ROW($A49)-6,12)+13,64+MOD(COLUMN(K$1)-2,8),4)) -> _ | L49: =INDIRECT.EXT("'..\mens\[mens_div4b.xls]table calculations'!"&ADDRESS(MOD(ROW($A49)-6,12)+13,64+MOD(COLUMN(L$1)-2,8),4)) -> _ | M49: =INDIRECT.EXT("'..\mens\[mens_div4b.xls]table calculations'!"&ADDRESS(MOD(ROW($A49)-6,12)+13,64+MOD(COLUMN(M$1)-2,8),4)) -> _ | N49: =INDIRECT.EXT("'..\mens\[mens_div4b.xls]table calculations'!"&ADDRESS(MOD(ROW($A49)-6,12)+13,64+MOD(COLUMN(N$1)-2,8),4)) -> _ | O49: =INDIRECT.EXT("'..\mens\[mens_div4b.xls]table calculations'!"&ADDRESS(MOD(ROW($A49)-6,12)+13,64+MOD(COLUMN(O$1)-2,8),4)) -> _ | P49: =INDIRECT.EXT("'..\mens\[mens_div4b.xls]table calculations'!"&ADDRESS(MOD(ROW($A49)-6,12)+13,64+MOD(COLUMN(P$1)-2,8)+2,4)) -> _
B51: Mens Div 5A | J51: Mens Div 5B
B52: League Table | J52: League Table
B53: S T A N D I N G S | C53: p | D53: w | E53: l | F53: rf | G53: ra | H53: pts | J53: S T A N D I N G S | K53: p | L53: w | M53: l | N53: rf | O53: ra | P53: pts
B54: =INDIRECT.EXT("'..\mens\[mens_div5a.xls]table calculations'!"&ADDRESS(MOD(ROW($A54)-6,12)+13,64+MOD(COLUMN(B$1)-2,8),4)) -> Rushcliffe Arena 1st | C54: =INDIRECT.EXT("'..\mens\[mens_div5a.xls]table calculations'!"&ADDRESS(MOD(ROW($A54)-6,12)+13,64+MOD(COLUMN(C$1)-2,8),4)) -> 4 | D54: =INDIRECT.EXT("'..\mens\[mens_div5a.xls]table calculations'!"&ADDRESS(MOD(ROW($A54)-6,12)+13,64+MOD(COLUMN(D$1)-2,8),4)) -> 4 | E54: =INDIRECT.EXT("'..\mens\[mens_div5a.xls]table calculations'!"&ADDRESS(MOD(ROW($A54)-6,12)+13,64+MOD(COLUMN(E$1)-2,8),4)) -> 0 | F54: =INDIRECT.EXT("'..\mens\[mens_div5a.xls]table calculations'!"&ADDRESS(MOD(ROW($A54)-6,12)+13,64+MOD(COLUMN(F$1)-2,8),4)) -> 28 | G54: =INDIRECT.EXT("'..\mens\[mens_div5a.xls]table calculations'!"&ADDRESS(MOD(ROW($A54)-6,12)+13,64+MOD(COLUMN(G$1)-2,8),4)) -> 8 | H54: =INDIRECT.EXT("'..\mens\[mens_div5a.xls]table calculations'!"&ADDRESS(MOD(ROW($A54)-6,12)+13,64+MOD(COLUMN(H$1)-2,8)+2,4)) -> 8 | J54: =INDIRECT.EXT("'..\mens\[mens_div5b.xls]table calculations'!"&ADDRESS(MOD(ROW($A54)-6,12)+13,64+MOD(COLUMN(J$1)-2,8),4)) -> Forest 3rd | K54: =INDIRECT.EXT("'..\mens\[mens_div5b.xls]table calculations'!"&ADDRESS(MOD(ROW($A54)-6,12)+13,64+MOD(COLUMN(K$1)-2,8),4)) -> 3 | L54: =INDIRECT.EXT("'..\mens\[mens_div5b.xls]table calculations'!"&ADDRESS(MOD(ROW($A54)-6,12)+13,64+MOD(COLUMN(L$1)-2,8),4)) -> 3 | M54: =INDIRECT.EXT("'..\mens\[mens_div5b.xls]table calculations'!"&ADDRESS(MOD(ROW($A54)-6,12)+13,64+MOD(COLUMN(M$1)-2,8),4)) -> 0 | N54: =INDIRECT.EXT("'..\mens\[mens_div5b.xls]table calculations'!"&ADDRESS(MOD(ROW($A54)-6,12)+13,64+MOD(COLUMN(N$1)-2,8),4)) -> 26 | O54: =INDIRECT.EXT("'..\mens\[mens_div5b.xls]table calculations'!"&ADDRESS(MOD(ROW($A54)-6,12)+13,64+MOD(COLUMN(O$1)-2,8),4)) -> 1 | P54: =INDIRECT.EXT("'..\mens\[mens_div5b.xls]table calculations'!"&ADDRESS(MOD(ROW($A54)-6,12)+13,64+MOD(COLUMN(P$1)-2,8)+2,4)) -> 6
B55: =INDIRECT.EXT("'..\mens\[mens_div5a.xls]table calculations'!"&ADDRESS(MOD(ROW($A55)-6,12)+13,64+MOD(COLUMN(B$1)-2,8),4)) -> Carlton 4th | C55: =INDIRECT.EXT("'..\mens\[mens_div5a.xls]table calculations'!"&ADDRESS(MOD(ROW($A55)-6,12)+13,64+MOD(COLUMN(C$1)-2,8),4)) -> 4 | D55: =INDIRECT.EXT("'..\mens\[mens_div5a.xls]table calculations'!"&ADDRESS(MOD(ROW($A55)-6,12)+13,64+MOD(COLUMN(D$1)-2,8),4)) -> 3 | E55: =INDIRECT.EXT("'..\mens\[mens_div5a.xls]table calculations'!"&ADDRESS(MOD(ROW($A55)-6,12)+13,64+MOD(COLUMN(E$1)-2,8),4)) -> 1 | F55: =INDIRECT.EXT("'..\mens\[mens_div5a.xls]table calculations'!"&ADDRESS(MOD(ROW($A55)-6,12)+13,64+MOD(COLUMN(F$1)-2,8),4)) -> 31 | G55: =INDIRECT.EXT("'..\mens\[mens_div5a.xls]table calculations'!"&ADDRESS(MOD(ROW($A55)-6,12)+13,64+MOD(COLUMN(G$1)-2,8),4)) -> 5 | H55: =INDIRECT.EXT("'..\mens\[mens_div5a.xls]table calculations'!"&ADDRESS(MOD(ROW($A55)-6,12)+13,64+MOD(COLUMN(H$1)-2,8)+2,4)) -> 6 | J55: =INDIRECT.EXT("'..\mens\[mens_div5b.xls]table calculations'!"&ADDRESS(MOD(ROW($A55)-6,12)+13,64+MOD(COLUMN(J$1)-2,8),4)) -> Unity | K55: =INDIRECT.EXT("'..\mens\[mens_div5b.xls]table calculations'!"&ADDRESS(MOD(ROW($A55)-6,12)+13,64+MOD(COLUMN(K$1)-2,8),4)) -> 2 | L55: =INDIRECT.EXT("'..\mens\[mens_div5b.xls]table calculations'!"&ADDRESS(MOD(ROW($A55)-6,12)+13,64+MOD(COLUMN(L$1)-2,8),4)) -> 2 | M55: =INDIRECT.EXT("'..\mens\[mens_div5b.xls]table calculations'!"&ADDRESS(MOD(ROW($A55)-6,12)+13,64+MOD(COLUMN(M$1)-2,8),4)) -> 0 | N55: =INDIRECT.EXT("'..\mens\[mens_div5b.xls]table calculations'!"&ADDRESS(MOD(ROW($A55)-6,12)+13,64+MOD(COLUMN(N$1)-2,8),4)) -> 17 | O55: =INDIRECT.EXT("'..\mens\[mens_div5b.xls]table calculations'!"&ADDRESS(MOD(ROW($A55)-6,12)+13,64+MOD(COLUMN(O$1)-2,8),4)) -> 1 | P55: =INDIRECT.EXT("'..\mens\[mens_div5b.xls]table calculations'!"&ADDRESS(MOD(ROW($A55)-6,12)+13,64+MOD(COLUMN(P$1)-2,8)+2,4)) -> 4
B56: =INDIRECT.EXT("'..\mens\[mens_div5a.xls]table calculations'!"&ADDRESS(MOD(ROW($A56)-6,12)+13,64+MOD(COLUMN(B$1)-2,8),4)) -> Radcliffe Knights | C56: =INDIRECT.EXT("'..\mens\[mens_div5a.xls]table calculations'!"&ADDRESS(MOD(ROW($A56)-6,12)+13,64+MOD(COLUMN(C$1)-2,8),4)) -> 2 | D56: =INDIRECT.EXT("'..\mens\[mens_div5a.xls]table calculations'!"&ADDRESS(MOD(ROW($A56)-6,12)+13,64+MOD(COLUMN(D$1)-2,8),4)) -> 0 | E56: =INDIRECT.EXT("'..\mens\[mens_div5a.xls]table calculations'!"&ADDRESS(MOD(ROW($A56)-6,12)+13,64+MOD(COLUMN(E$1)-2,8),4)) -> 2 | F56: =INDIRECT.EXT("'..\mens\[mens_div5a.xls]table calculations'!"&ADDRESS(MOD(ROW($A56)-6,12)+13,64+MOD(COLUMN(F$1)-2,8),4)) -> 3 | G56: =INDIRECT.EXT("'..\mens\[mens_div5a.xls]table calculations'!"&ADDRESS(MOD(ROW($A56)-6,12)+13,64+MOD(COLUMN(G$1)-2,8),4)) -> 15 | H56: =INDIRECT.EXT("'..\mens\[mens_div5a.xls]table calculations'!"&ADDRESS(MOD(ROW($A56)-6,12)+13,64+MOD(COLUMN(H$1)-2,8)+2,4)) -> 0 | J56: =INDIRECT.EXT("'..\mens\[mens_div5b.xls]table calculations'!"&ADDRESS(MOD(ROW($A56)-6,12)+13,64+MOD(COLUMN(J$1)-2,8),4)) -> East Leake 4th | K56: =INDIRECT.EXT("'..\mens\[mens_div5b.xls]table calculations'!"&ADDRESS(MOD(ROW($A56)-6,12)+13,64+MOD(COLUMN(K$1)-2,8),4)) -> 4 | L56: =INDIRECT.EXT("'..\mens\[mens_div5b.xls]table calculations'!"&ADDRESS(MOD(ROW($A56)-6,12)+13,64+MOD(COLUMN(L$1)-2,8),4)) -> 2 | M56: =INDIRECT.EXT("'..\mens\[mens_div5b.xls]table calculations'!"&ADDRESS(MOD(ROW($A56)-6,12)+13,64+MOD(COLUMN(M$1)-2,8),4)) -> 2 | N56: =INDIRECT.EXT("'..\mens\[mens_div5b.xls]table calculations'!"&ADDRESS(MOD(ROW($A56)-6,12)+13,64+MOD(COLUMN(N$1)-2,8),4)) -> 13 | O56: =INDIRECT.EXT("'..\mens\[mens_div5b.xls]table calculations'!"&ADDRESS(MOD(ROW($A56)-6,12)+13,64+MOD(COLUMN(O$1)-2,8),4)) -> 23 | P56: =INDIRECT.EXT("'..\mens\[mens_div5b.xls]table calculations'!"&ADDRESS(MOD(ROW($A56)-6,12)+13,64+MOD(COLUMN(P$1)-2,8)+2,4)) -> 4
B57: =INDIRECT.EXT("'..\mens\[mens_div5a.xls]table calculations'!"&ADDRESS(MOD(ROW($A57)-6,12)+13,64+MOD(COLUMN(B$1)-2,8),4)) -> Kimberley 2nd | C57: =INDIRECT.EXT("'..\mens\[mens_div5a.xls]table calculations'!"&ADDRESS(MOD(ROW($A57)-6,12)+13,64+MOD(COLUMN(C$1)-2,8),4)) -> 1 | D57: =INDIRECT.EXT("'..\mens\[mens_div5a.xls]table calculations'!"&ADDRESS(MOD(ROW($A57)-6,12)+13,64+MOD(COLUMN(D$1)-2,8),4)) -> 0 | E57: =INDIRECT.EXT("'..\mens\[mens_div5a.xls]table calculations'!"&ADDRESS(MOD(ROW($A57)-6,12)+13,64+MOD(COLUMN(E$1)-2,8),4)) -> 1 | F57: =INDIRECT.EXT("'..\mens\[mens_div5a.xls]table calculations'!"&ADDRESS(MOD(ROW($A57)-6,12)+13,64+MOD(COLUMN(F$1)-2,8),4)) -> 1 | G57: =INDIRECT.EXT("'..\mens\[mens_div5a.xls]table calculations'!"&ADDRESS(MOD(ROW($A57)-6,12)+13,64+MOD(COLUMN(G$1)-2,8),4)) -> 8 | H57: =INDIRECT.EXT("'..\mens\[mens_div5a.xls]table calculations'!"&ADDRESS(MOD(ROW($A57)-6,12)+13,64+MOD(COLUMN(H$1)-2,8)+2,4)) -> 0 | J57: =INDIRECT.EXT("'..\mens\[mens_div5b.xls]table calculations'!"&ADDRESS(MOD(ROW($A57)-6,12)+13,64+MOD(COLUMN(J$1)-2,8),4)) -> Redhill 2nd | K57: =INDIRECT.EXT("'..\mens\[mens_div5b.xls]table calculations'!"&ADDRESS(MOD(ROW($A57)-6,12)+13,64+MOD(COLUMN(K$1)-2,8),4)) -> 3 | L57: =INDIRECT.EXT("'..\mens\[mens_div5b.xls]table calculations'!"&ADDRESS(MOD(ROW($A57)-6,12)+13,64+MOD(COLUMN(L$1)-2,8),4)) -> 1 | M57: =INDIRECT.EXT("'..\mens\[mens_div5b.xls]table calculations'!"&ADDRESS(MOD(ROW($A57)-6,12)+13,64+MOD(COLUMN(M$1)-2,8),4)) -> 2 | N57: =INDIRECT.EXT("'..\mens\[mens_div5b.xls]table calculations'!"&ADDRESS(MOD(ROW($A57)-6,12)+13,64+MOD(COLUMN(N$1)-2,8),4)) -> 9 | O57: =INDIRECT.EXT("'..\mens\[mens_div5b.xls]table calculations'!"&ADDRESS(MOD(ROW($A57)-6,12)+13,64+MOD(COLUMN(O$1)-2,8),4)) -> 18 | P57: =INDIRECT.EXT("'..\mens\[mens_div5b.xls]table calculations'!"&ADDRESS(MOD(ROW($A57)-6,12)+13,64+MOD(COLUMN(P$1)-2,8)+2,4)) -> 2
B58: =INDIRECT.EXT("'..\mens\[mens_div5a.xls]table calculations'!"&ADDRESS(MOD(ROW($A58)-6,12)+13,64+MOD(COLUMN(B$1)-2,8),4)) -> Arboretum 2nd | C58: =INDIRECT.EXT("'..\mens\[mens_div5a.xls]table calculations'!"&ADDRESS(MOD(ROW($A58)-6,12)+13,64+MOD(COLUMN(C$1)-2,8),4)) -> 2 | D58: =INDIRECT.EXT("'..\mens\[mens_div5a.xls]table calculations'!"&ADDRESS(MOD(ROW($A58)-6,12)+13,64+MOD(COLUMN(D$1)-2,8),4)) -> 0 | E58: =INDIRECT.EXT("'..\mens\[mens_div5a.xls]table calculations'!"&ADDRESS(MOD(ROW($A58)-6,12)+13,64+MOD(COLUMN(E$1)-2,8),4)) -> 2 | F58: =INDIRECT.EXT("'..\mens\[mens_div5a.xls]table calculations'!"&ADDRESS(MOD(ROW($A58)-6,12)+13,64+MOD(COLUMN(F$1)-2,8),4)) -> 0 | G58: =INDIRECT.EXT("'..\mens\[mens_div5a.xls]table calculations'!"&ADDRESS(MOD(ROW($A58)-6,12)+13,64+MOD(COLUMN(G$1)-2,8),4)) -> 18 | H58: =INDIRECT.EXT("'..\mens\[mens_div5a.xls]table calculations'!"&ADDRESS(MOD(ROW($A58)-6,12)+13,64+MOD(COLUMN(H$1)-2,8)+2,4)) -> 0 | J58: =INDIRECT.EXT("'..\mens\[mens_div5b.xls]table calculations'!"&ADDRESS(MOD(ROW($A58)-6,12)+13,64+MOD(COLUMN(J$1)-2,8),4)) -> St Giles 3rd | K58: =INDIRECT.EXT("'..\mens\[mens_div5b.xls]table calculations'!"&ADDRESS(MOD(ROW($A58)-6,12)+13,64+MOD(COLUMN(K$1)-2,8),4)) -> 3 | L58: =INDIRECT.EXT("'..\mens\[mens_div5b.xls]table calculations'!"&ADDRESS(MOD(ROW($A58)-6,12)+13,64+MOD(COLUMN(L$1)-2,8),4)) -> 1 | M58: =INDIRECT.EXT("'..\mens\[mens_div5b.xls]table calculations'!"&ADDRESS(MOD(ROW($A58)-6,12)+13,64+MOD(COLUMN(M$1)-2,8),4)) -> 2 | N58: =INDIRECT.EXT("'..\mens\[mens_div5b.xls]table calculations'!"&ADDRESS(MOD(ROW($A58)-6,12)+13,64+MOD(COLUMN(N$1)-2,8),4)) -> 8 | O58: =INDIRECT.EXT("'..\mens\[mens_div5b.xls]table calculations'!"&ADDRESS(MOD(ROW($A58)-6,12)+13,64+MOD(COLUMN(O$1)-2,8),4)) -> 19 | P58: =INDIRECT.EXT("'..\mens\[mens_div5b.xls]table calculations'!"&ADDRESS(MOD(ROW($A58)-6,12)+13,64+MOD(COLUMN(P$1)-2,8)+2,4)) -> 2
B59: =INDIRECT.EXT("'..\mens\[mens_div5a.xls]table calculations'!"&ADDRESS(MOD(ROW($A59)-6,12)+13,64+MOD(COLUMN(B$1)-2,8),4)) -> David Lloyd Aspley 3rd | C59: =INDIRECT.EXT("'..\mens\[mens_div5a.xls]table calculations'!"&ADDRESS(MOD(ROW($A59)-6,12)+13,64+MOD(COLUMN(C$1)-2,8),4)) -> 1 | D59: =INDIRECT.EXT("'..\mens\[mens_div5a.xls]table calculations'!"&ADDRESS(MOD(ROW($A59)-6,12)+13,64+MOD(COLUMN(D$1)-2,8),4)) -> 0 | E59: =INDIRECT.EXT("'..\mens\[mens_div5a.xls]table calculations'!"&ADDRESS(MOD(ROW($A59)-6,12)+13,64+MOD(COLUMN(E$1)-2,8),4)) -> 1 | F59: =INDIRECT.EXT("'..\mens\[mens_div5a.xls]table calculations'!"&ADDRESS(MOD(ROW($A59)-6,12)+13,64+MOD(COLUMN(F$1)-2,8),4)) -> 0 | G59: =INDIRECT.EXT("'..\mens\[mens_div5a.xls]table calculations'!"&ADDRESS(MOD(ROW($A59)-6,12)+13,64+MOD(COLUMN(G$1)-2,8),4)) -> 9 | H59: =INDIRECT.EXT("'..\mens\[mens_div5a.xls]table calculations'!"&ADDRESS(MOD(ROW($A59)-6,12)+13,64+MOD(COLUMN(H$1)-2,8)+2,4)) -> 0 | J59: =INDIRECT.EXT("'..\mens\[mens_div5b.xls]table calculations'!"&ADDRESS(MOD(ROW($A59)-6,12)+13,64+MOD(COLUMN(J$1)-2,8),4)) -> Woodborough 2nd | K59: =INDIRECT.EXT("'..\mens\[mens_div5b.xls]table calculations'!"&ADDRESS(MOD(ROW($A59)-6,12)+13,64+MOD(COLUMN(K$1)-2,8),4)) -> 1 | L59: =INDIRECT.EXT("'..\mens\[mens_div5b.xls]table calculations'!"&ADDRESS(MOD(ROW($A59)-6,12)+13,64+MOD(COLUMN(L$1)-2,8),4)) -> 0 | M59: =INDIRECT.EXT("'..\mens\[mens_div5b.xls]table calculations'!"&ADDRESS(MOD(ROW($A59)-6,12)+13,64+MOD(COLUMN(M$1)-2,8),4)) -> 1 | N59: =INDIRECT.EXT("'..\mens\[mens_div5b.xls]table calculations'!"&ADDRESS(MOD(ROW($A59)-6,12)+13,64+MOD(COLUMN(N$1)-2,8),4)) -> 4 | O59: =INDIRECT.EXT("'..\mens\[mens_div5b.xls]table calculations'!"&ADDRESS(MOD(ROW($A59)-6,12)+13,64+MOD(COLUMN(O$1)-2,8),4)) -> 5 | P59: =INDIRECT.EXT("'..\mens\[mens_div5b.xls]table calculations'!"&ADDRESS(MOD(ROW($A59)-6,12)+13,64+MOD(COLUMN(P$1)-2,8)+2,4)) -> 0
B60: =INDIRECT.EXT("'..\mens\[mens_div5a.xls]table calculations'!"&ADDRESS(MOD(ROW($A60)-6,12)+13,64+MOD(COLUMN(B$1)-2,8),4)) -> _ | C60: =INDIRECT.EXT("'..\mens\[mens_div5a.xls]table calculations'!"&ADDRESS(MOD(ROW($A60)-6,12)+13,64+MOD(COLUMN(C$1)-2,8),4)) -> _ | D60: =INDIRECT.EXT("'..\mens\[mens_div5a.xls]table calculations'!"&ADDRESS(MOD(ROW($A60)-6,12)+13,64+MOD(COLUMN(D$1)-2,8),4)) -> _ | E60: =INDIRECT.EXT("'..\mens\[mens_div5a.xls]table calculations'!"&ADDRESS(MOD(ROW($A60)-6,12)+13,64+MOD(COLUMN(E$1)-2,8),4)) -> _ | F60: =INDIRECT.EXT("'..\mens\[mens_div5a.xls]table calculations'!"&ADDRESS(MOD(ROW($A60)-6,12)+13,64+MOD(COLUMN(F$1)-2,8),4)) -> _ | G60: =INDIRECT.EXT("'..\mens\[mens_div5a.xls]table calculations'!"&ADDRESS(MOD(ROW($A60)-6,12)+13,64+MOD(COLUMN(G$1)-2,8),4)) -> _ | H60: =INDIRECT.EXT("'..\mens\[mens_div5a.xls]table calculations'!"&ADDRESS(MOD(ROW($A60)-6,12)+13,64+MOD(COLUMN(H$1)-2,8)+2,4)) -> _ | J60: =INDIRECT.EXT("'..\mens\[mens_div5b.xls]table calculations'!"&ADDRESS(MOD(ROW($A60)-6,12)+13,64+MOD(COLUMN(J$1)-2,8),4)) -> Beeston Valley 3rd | K60: =INDIRECT.EXT("'..\mens\[mens_div5b.xls]table calculations'!"&ADDRESS(MOD(ROW($A60)-6,12)+13,64+MOD(COLUMN(K$1)-2,8),4)) -> 2 | L60: =INDIRECT.EXT("'..\mens\[mens_div5b.xls]table calculations'!"&ADDRESS(MOD(ROW($A60)-6,12)+13,64+MOD(COLUMN(L$1)-2,8),4)) -> 0 | M60: =INDIRECT.EXT("'..\mens\[mens_div5b.xls]table calculations'!"&ADDRESS(MOD(ROW($A60)-6,12)+13,64+MOD(COLUMN(M$1)-2,8),4)) -> 2 | N60: =INDIRECT.EXT("'..\mens\[mens_div5b.xls]table calculations'!"&ADDRESS(MOD(ROW($A60)-6,12)+13,64+MOD(COLUMN(N$1)-2,8),4)) -> 4 | O60: =INDIRECT.EXT("'..\mens\[mens_div5b.xls]table calculations'!"&ADDRESS(MOD(ROW($A60)-6,12)+13,64+MOD(COLUMN(O$1)-2,8),4)) -> 14 | P60: =INDIRECT.EXT("'..\mens\[mens_div5b.xls]table calculations'!"&ADDRESS(MOD(ROW($A60)-6,12)+13,64+MOD(COLUMN(P$1)-2,8)+2,4)) -> 0
B61: =INDIRECT.EXT("'..\mens\[mens_div5a.xls]table calculations'!"&ADDRESS(MOD(ROW($A61)-6,12)+13,64+MOD(COLUMN(B$1)-2,8),4)) -> _ | C61: =INDIRECT.EXT("'..\mens\[mens_div5a.xls]table calculations'!"&ADDRESS(MOD(ROW($A61)-6,12)+13,64+MOD(COLUMN(C$1)-2,8),4)) -> _ | D61: =INDIRECT.EXT("'..\mens\[mens_div5a.xls]table calculations'!"&ADDRESS(MOD(ROW($A61)-6,12)+13,64+MOD(COLUMN(D$1)-2,8),4)) -> _ | E61: =INDIRECT.EXT("'..\mens\[mens_div5a.xls]table calculations'!"&ADDRESS(MOD(ROW($A61)-6,12)+13,64+MOD(COLUMN(E$1)-2,8),4)) -> _ | F61: =INDIRECT.EXT("'..\mens\[mens_div5a.xls]table calculations'!"&ADDRESS(MOD(ROW($A61)-6,12)+13,64+MOD(COLUMN(F$1)-2,8),4)) -> _ | G61: =INDIRECT.EXT("'..\mens\[mens_div5a.xls]table calculations'!"&ADDRESS(MOD(ROW($A61)-6,12)+13,64+MOD(COLUMN(G$1)-2,8),4)) -> _ | H61: =INDIRECT.EXT("'..\mens\[mens_div5a.xls]table calculations'!"&ADDRESS(MOD(ROW($A61)-6,12)+13,64+MOD(COLUMN(H$1)-2,8)+2,4)) -> _ | J61: =INDIRECT.EXT("'..\mens\[mens_div5b.xls]table calculations'!"&ADDRESS(MOD(ROW($A61)-6,12)+13,64+MOD(COLUMN(J$1)-2,8),4)) -> _ | K61: =INDIRECT.EXT("'..\mens\[mens_div5b.xls]table calculations'!"&ADDRESS(MOD(ROW($A61)-6,12)+13,64+MOD(COLUMN(K$1)-2,8),4)) -> _ | L61: =INDIRECT.EXT("'..\mens\[mens_div5b.xls]table calculations'!"&ADDRESS(MOD(ROW($A61)-6,12)+13,64+MOD(COLUMN(L$1)-2,8),4)) -> _ | M61: =INDIRECT.EXT("'..\mens\[mens_div5b.xls]table calculations'!"&ADDRESS(MOD(ROW($A61)-6,12)+13,64+MOD(COLUMN(M$1)-2,8),4)) -> _ | N61: =INDIRECT.EXT("'..\mens\[mens_div5b.xls]table calculations'!"&ADDRESS(MOD(ROW($A61)-6,12)+13,64+MOD(COLUMN(N$1)-2,8),4)) -> _ | O61: =INDIRECT.EXT("'..\mens\[mens_div5b.xls]table calculations'!"&ADDRESS(MOD(ROW($A61)-6,12)+13,64+MOD(COLUMN(O$1)-2,8),4)) -> _ | P61: =INDIRECT.EXT("'..\mens\[mens_div5b.xls]table calculations'!"&ADDRESS(MOD(ROW($A61)-6,12)+13,64+MOD(COLUMN(P$1)-2,8)+2,4)) -> _
B63: Mens Div 6A
B64: League Table
B65: S T A N D I N G S | C65: p | D65: w | E65: l | F65: rf | G65: ra | H65: pts
B66: =INDIRECT.EXT("'..\mens\[mens_div6a.xls]table calculations'!"&ADDRESS(MOD(ROW($A66)-6,12)+13,64+MOD(COLUMN(B$1)-2,8),4)) -> Southwell Centre 3rd | C66: =INDIRECT.EXT("'..\mens\[mens_div6a.xls]table calculations'!"&ADDRESS(MOD(ROW($A66)-6,12)+13,64+MOD(COLUMN(C$1)-2,8),4)) -> 4 | D66: =INDIRECT.EXT("'..\mens\[mens_div6a.xls]table calculations'!"&ADDRESS(MOD(ROW($A66)-6,12)+13,64+MOD(COLUMN(D$1)-2,8),4)) -> 4 | E66: =INDIRECT.EXT("'..\mens\[mens_div6a.xls]table calculations'!"&ADDRESS(MOD(ROW($A66)-6,12)+13,64+MOD(COLUMN(E$1)-2,8),4)) -> 0 | F66: =INDIRECT.EXT("'..\mens\[mens_div6a.xls]table calculations'!"&ADDRESS(MOD(ROW($A66)-6,12)+13,64+MOD(COLUMN(F$1)-2,8),4)) -> 35 | G66: =INDIRECT.EXT("'..\mens\[mens_div6a.xls]table calculations'!"&ADDRESS(MOD(ROW($A66)-6,12)+13,64+MOD(COLUMN(G$1)-2,8),4)) -> 1 | H66: =INDIRECT.EXT("'..\mens\[mens_div6a.xls]table calculations'!"&ADDRESS(MOD(ROW($A66)-6,12)+13,64+MOD(COLUMN(H$1)-2,8)+2,4)) -> 8
B67: =INDIRECT.EXT("'..\mens\[mens_div6a.xls]table calculations'!"&ADDRESS(MOD(ROW($A67)-6,12)+13,64+MOD(COLUMN(B$1)-2,8),4)) -> Trent Uni Students | C67: =INDIRECT.EXT("'..\mens\[mens_div6a.xls]table calculations'!"&ADDRESS(MOD(ROW($A67)-6,12)+13,64+MOD(COLUMN(C$1)-2,8),4)) -> 2 | D67: =INDIRECT.EXT("'..\mens\[mens_div6a.xls]table calculations'!"&ADDRESS(MOD(ROW($A67)-6,12)+13,64+MOD(COLUMN(D$1)-2,8),4)) -> 2 | E67: =INDIRECT.EXT("'..\mens\[mens_div6a.xls]table calculations'!"&ADDRESS(MOD(ROW($A67)-6,12)+13,64+MOD(COLUMN(E$1)-2,8),4)) -> 0 | F67: =INDIRECT.EXT("'..\mens\[mens_div6a.xls]table calculations'!"&ADDRESS(MOD(ROW($A67)-6,12)+13,64+MOD(COLUMN(F$1)-2,8),4)) -> 16 | G67: =INDIRECT.EXT("'..\mens\[mens_div6a.xls]table calculations'!"&ADDRESS(MOD(ROW($A67)-6,12)+13,64+MOD(COLUMN(G$1)-2,8),4)) -> 2 | H67: =INDIRECT.EXT("'..\mens\[mens_div6a.xls]table calculations'!"&ADDRESS(MOD(ROW($A67)-6,12)+13,64+MOD(COLUMN(H$1)-2,8)+2,4)) -> 4
B68: =INDIRECT.EXT("'..\mens\[mens_div6a.xls]table calculations'!"&ADDRESS(MOD(ROW($A68)-6,12)+13,64+MOD(COLUMN(B$1)-2,8),4)) -> Rushcliffe Arena 2nd | C68: =INDIRECT.EXT("'..\mens\[mens_div6a.xls]table calculations'!"&ADDRESS(MOD(ROW($A68)-6,12)+13,64+MOD(COLUMN(C$1)-2,8),4)) -> 3 | D68: =INDIRECT.EXT("'..\mens\[mens_div6a.xls]table calculations'!"&ADDRESS(MOD(ROW($A68)-6,12)+13,64+MOD(COLUMN(D$1)-2,8),4)) -> 2 | E68: =INDIRECT.EXT("'..\mens\[mens_div6a.xls]table calculations'!"&ADDRESS(MOD(ROW($A68)-6,12)+13,64+MOD(COLUMN(E$1)-2,8),4)) -> 1 | F68: =INDIRECT.EXT("'..\mens\[mens_div6a.xls]table calculations'!"&ADDRESS(MOD(ROW($A68)-6,12)+13,64+MOD(COLUMN(F$1)-2,8),4)) -> 19 | G68: =INDIRECT.EXT("'..\mens\[mens_div6a.xls]table calculations'!"&ADDRESS(MOD(ROW($A68)-6,12)+13,64+MOD(COLUMN(G$1)-2,8),4)) -> 8 | H68: =INDIRECT.EXT("'..\mens\[mens_div6a.xls]table calculations'!"&ADDRESS(MOD(ROW($A68)-6,12)+13,64+MOD(COLUMN(H$1)-2,8)+2,4)) -> 4
B69: =INDIRECT.EXT("'..\mens\[mens_div6a.xls]table calculations'!"&ADDRESS(MOD(ROW($A69)-6,12)+13,64+MOD(COLUMN(B$1)-2,8),4)) -> Arboretum 3rd | C69: =INDIRECT.EXT("'..\mens\[mens_div6a.xls]table calculations'!"&ADDRESS(MOD(ROW($A69)-6,12)+13,64+MOD(COLUMN(C$1)-2,8),4)) -> 5 | D69: =INDIRECT.EXT("'..\mens\[mens_div6a.xls]table calculations'!"&ADDRESS(MOD(ROW($A69)-6,12)+13,64+MOD(COLUMN(D$1)-2,8),4)) -> 2 | E69: =INDIRECT.EXT("'..\mens\[mens_div6a.xls]table calculations'!"&ADDRESS(MOD(ROW($A69)-6,12)+13,64+MOD(COLUMN(E$1)-2,8),4)) -> 3 | F69: =INDIRECT.EXT("'..\mens\[mens_div6a.xls]table calculations'!"&ADDRESS(MOD(ROW($A69)-6,12)+13,64+MOD(COLUMN(F$1)-2,8),4)) -> 15 | G69: =INDIRECT.EXT("'..\mens\[mens_div6a.xls]table calculations'!"&ADDRESS(MOD(ROW($A69)-6,12)+13,64+MOD(COLUMN(G$1)-2,8),4)) -> 30 | H69: =INDIRECT.EXT("'..\mens\[mens_div6a.xls]table calculations'!"&ADDRESS(MOD(ROW($A69)-6,12)+13,64+MOD(COLUMN(H$1)-2,8)+2,4)) -> 4
B70: =INDIRECT.EXT("'..\mens\[mens_div6a.xls]table calculations'!"&ADDRESS(MOD(ROW($A70)-6,12)+13,64+MOD(COLUMN(B$1)-2,8),4)) -> Experian | C70: =INDIRECT.EXT("'..\mens\[mens_div6a.xls]table calculations'!"&ADDRESS(MOD(ROW($A70)-6,12)+13,64+MOD(COLUMN(C$1)-2,8),4)) -> 6 | D70: =INDIRECT.EXT("'..\mens\[mens_div6a.xls]table calculations'!"&ADDRESS(MOD(ROW($A70)-6,12)+13,64+MOD(COLUMN(D$1)-2,8),4)) -> 0 | E70: =INDIRECT.EXT("'..\mens\[mens_div6a.xls]table calculations'!"&ADDRESS(MOD(ROW($A70)-6,12)+13,64+MOD(COLUMN(E$1)-2,8),4)) -> 6 | F70: =INDIRECT.EXT("'..\mens\[mens_div6a.xls]table calculations'!"&ADDRESS(MOD(ROW($A70)-6,12)+13,64+MOD(COLUMN(F$1)-2,8),4)) -> 5 | G70: =INDIRECT.EXT("'..\mens\[mens_div6a.xls]table calculations'!"&ADDRESS(MOD(ROW($A70)-6,12)+13,64+MOD(COLUMN(G$1)-2,8),4)) -> 49 | H70: =INDIRECT.EXT("'..\mens\[mens_div6a.xls]table calculations'!"&ADDRESS(MOD(ROW($A70)-6,12)+13,64+MOD(COLUMN(H$1)-2,8)+2,4)) -> 0
B71: =INDIRECT.EXT("'..\mens\[mens_div6a.xls]table calculations'!"&ADDRESS(MOD(ROW($A71)-6,12)+13,64+MOD(COLUMN(B$1)-2,8),4)) -> _ | C71: =INDIRECT.EXT("'..\mens\[mens_div6a.xls]table calculations'!"&ADDRESS(MOD(ROW($A71)-6,12)+13,64+MOD(COLUMN(C$1)-2,8),4)) -> _ | D71: =INDIRECT.EXT("'..\mens\[mens_div6a.xls]table calculations'!"&ADDRESS(MOD(ROW($A71)-6,12)+13,64+MOD(COLUMN(D$1)-2,8),4)) -> _ | E71: =INDIRECT.EXT("'..\mens\[mens_div6a.xls]table calculations'!"&ADDRESS(MOD(ROW($A71)-6,12)+13,64+MOD(COLUMN(E$1)-2,8),4)) -> _ | F71: =INDIRECT.EXT("'..\mens\[mens_div6a.xls]table calculations'!"&ADDRESS(MOD(ROW($A71)-6,12)+13,64+MOD(COLUMN(F$1)-2,8),4)) -> _ | G71: =INDIRECT.EXT("'..\mens\[mens_div6a.xls]table calculations'!"&ADDRESS(MOD(ROW($A71)-6,12)+13,64+MOD(COLUMN(G$1)-2,8),4)) -> _ | H71: =INDIRECT.EXT("'..\mens\[mens_div6a.xls]table calculations'!"&ADDRESS(MOD(ROW($A71)-6,12)+13,64+MOD(COLUMN(H$1)-2,8)+2,4)) -> _
B72: =INDIRECT.EXT("'..\mens\[mens_div6a.xls]table calculations'!"&ADDRESS(MOD(ROW($A72)-6,12)+13,64+MOD(COLUMN(B$1)-2,8),4)) -> _ | C72: =INDIRECT.EXT("'..\mens\[mens_div6a.xls]table calculations'!"&ADDRESS(MOD(ROW($A72)-6,12)+13,64+MOD(COLUMN(C$1)-2,8),4)) -> _ | D72: =INDIRECT.EXT("'..\mens\[mens_div6a.xls]table calculations'!"&ADDRESS(MOD(ROW($A72)-6,12)+13,64+MOD(COLUMN(D$1)-2,8),4)) -> _ | E72: =INDIRECT.EXT("'..\mens\[mens_div6a.xls]table calculations'!"&ADDRESS(MOD(ROW($A72)-6,12)+13,64+MOD(COLUMN(E$1)-2,8),4)) -> _ | F72: =INDIRECT.EXT("'..\mens\[mens_div6a.xls]table calculations'!"&ADDRESS(MOD(ROW($A72)-6,12)+13,64+MOD(COLUMN(F$1)-2,8),4)) -> _ | G72: =INDIRECT.EXT("'..\mens\[mens_div6a.xls]table calculations'!"&ADDRESS(MOD(ROW($A72)-6,12)+13,64+MOD(COLUMN(G$1)-2,8),4)) -> _ | H72: =INDIRECT.EXT("'..\mens\[mens_div6a.xls]table calculations'!"&ADDRESS(MOD(ROW($A72)-6,12)+13,64+MOD(COLUMN(H$1)-2,8)+2,4)) -> _
B73: =INDIRECT.EXT("'..\mens\[mens_div6a.xls]table calculations'!"&ADDRESS(MOD(ROW($A73)-6,12)+13,64+MOD(COLUMN(B$1)-2,8),4)) -> _ | C73: =INDIRECT.EXT("'..\mens\[mens_div6a.xls]table calculations'!"&ADDRESS(MOD(ROW($A73)-6,12)+13,64+MOD(COLUMN(C$1)-2,8),4)) -> _ | D73: =INDIRECT.EXT("'..\mens\[mens_div6a.xls]table calculations'!"&ADDRESS(MOD(ROW($A73)-6,12)+13,64+MOD(COLUMN(D$1)-2,8),4)) -> _ | E73: =INDIRECT.EXT("'..\mens\[mens_div6a.xls]table calculations'!"&ADDRESS(MOD(ROW($A73)-6,12)+13,64+MOD(COLUMN(E$1)-2,8),4)) -> _ | F73: =INDIRECT.EXT("'..\mens\[mens_div6a.xls]table calculations'!"&ADDRESS(MOD(ROW($A73)-6,12)+13,64+MOD(COLUMN(F$1)-2,8),4)) -> _ | G73: =INDIRECT.EXT("'..\mens\[mens_div6a.xls]table calculations'!"&ADDRESS(MOD(ROW($A73)-6,12)+13,64+MOD(COLUMN(G$1)-2,8),4)) -> _ | H73: =INDIRECT.EXT("'..\mens\[mens_div6a.xls]table calculations'!"&ADDRESS(MOD(ROW($A73)-6,12)+13,64+MOD(COLUMN(H$1)-2,8)+2,4)) -> _