B1: Nottinghamshire Badminton Association
B3: Premier Ladies | J3: Ladies Division 1
B4: League Table | J4: League Table
B5: S T A N D I N G S | C5: p | D5: w | E5: l | F5: rf | G5: ra | H5: pts | J5: S T A N D I N G S | K5: p | L5: w | M5: l | N5: rf | O5: ra | P5: pts
B6: =INDIRECT.EXT("'..\ladies\[ladies_prem.xls]table calculations'!"&ADDRESS(MOD(ROW($A6)-6,12)+13,64+MOD(COLUMN(B$1)-2,8),4)) -> Forest 1st | C6: =INDIRECT.EXT("'..\ladies\[ladies_prem.xls]table calculations'!"&ADDRESS(MOD(ROW($A6)-6,12)+13,64+MOD(COLUMN(C$1)-2,8),4)) -> 5 | D6: =INDIRECT.EXT("'..\ladies\[ladies_prem.xls]table calculations'!"&ADDRESS(MOD(ROW($A6)-6,12)+13,64+MOD(COLUMN(D$1)-2,8),4)) -> 5 | E6: =INDIRECT.EXT("'..\ladies\[ladies_prem.xls]table calculations'!"&ADDRESS(MOD(ROW($A6)-6,12)+13,64+MOD(COLUMN(E$1)-2,8),4)) -> 0 | F6: =INDIRECT.EXT("'..\ladies\[ladies_prem.xls]table calculations'!"&ADDRESS(MOD(ROW($A6)-6,12)+13,64+MOD(COLUMN(F$1)-2,8),4)) -> 35 | G6: =INDIRECT.EXT("'..\ladies\[ladies_prem.xls]table calculations'!"&ADDRESS(MOD(ROW($A6)-6,12)+13,64+MOD(COLUMN(G$1)-2,8),4)) -> 10 | H6: =INDIRECT.EXT("'..\ladies\[ladies_prem.xls]table calculations'!"&ADDRESS(MOD(ROW($A6)-6,12)+13,64+MOD(COLUMN(H$1)-2,8)+2,4)) -> 10 | J6: =INDIRECT.EXT("'..\ladies\[ladies_div1.xls]table calculations'!"&ADDRESS(MOD(ROW($A6)-6,12)+13,64+MOD(COLUMN(J$1)-2,8),4)) -> Mansfield Oaktree | K6: =INDIRECT.EXT("'..\ladies\[ladies_div1.xls]table calculations'!"&ADDRESS(MOD(ROW($A6)-6,12)+13,64+MOD(COLUMN(K$1)-2,8),4)) -> 5 | L6: =INDIRECT.EXT("'..\ladies\[ladies_div1.xls]table calculations'!"&ADDRESS(MOD(ROW($A6)-6,12)+13,64+MOD(COLUMN(L$1)-2,8),4)) -> 3 | M6: =INDIRECT.EXT("'..\ladies\[ladies_div1.xls]table calculations'!"&ADDRESS(MOD(ROW($A6)-6,12)+13,64+MOD(COLUMN(M$1)-2,8),4)) -> 2 | N6: =INDIRECT.EXT("'..\ladies\[ladies_div1.xls]table calculations'!"&ADDRESS(MOD(ROW($A6)-6,12)+13,64+MOD(COLUMN(N$1)-2,8),4)) -> 23 | O6: =INDIRECT.EXT("'..\ladies\[ladies_div1.xls]table calculations'!"&ADDRESS(MOD(ROW($A6)-6,12)+13,64+MOD(COLUMN(O$1)-2,8),4)) -> 22 | P6: =INDIRECT.EXT("'..\ladies\[ladies_div1.xls]table calculations'!"&ADDRESS(MOD(ROW($A6)-6,12)+13,64+MOD(COLUMN(P$1)-2,8)+2,4)) -> 6
B7: =INDIRECT.EXT("'..\ladies\[ladies_prem.xls]table calculations'!"&ADDRESS(MOD(ROW($A7)-6,12)+13,64+MOD(COLUMN(B$1)-2,8),4)) -> West Bridgford & LE | C7: =INDIRECT.EXT("'..\ladies\[ladies_prem.xls]table calculations'!"&ADDRESS(MOD(ROW($A7)-6,12)+13,64+MOD(COLUMN(C$1)-2,8),4)) -> 3 | D7: =INDIRECT.EXT("'..\ladies\[ladies_prem.xls]table calculations'!"&ADDRESS(MOD(ROW($A7)-6,12)+13,64+MOD(COLUMN(D$1)-2,8),4)) -> 3 | E7: =INDIRECT.EXT("'..\ladies\[ladies_prem.xls]table calculations'!"&ADDRESS(MOD(ROW($A7)-6,12)+13,64+MOD(COLUMN(E$1)-2,8),4)) -> 0 | F7: =INDIRECT.EXT("'..\ladies\[ladies_prem.xls]table calculations'!"&ADDRESS(MOD(ROW($A7)-6,12)+13,64+MOD(COLUMN(F$1)-2,8),4)) -> 24 | G7: =INDIRECT.EXT("'..\ladies\[ladies_prem.xls]table calculations'!"&ADDRESS(MOD(ROW($A7)-6,12)+13,64+MOD(COLUMN(G$1)-2,8),4)) -> 3 | H7: =INDIRECT.EXT("'..\ladies\[ladies_prem.xls]table calculations'!"&ADDRESS(MOD(ROW($A7)-6,12)+13,64+MOD(COLUMN(H$1)-2,8)+2,4)) -> 6 | J7: =INDIRECT.EXT("'..\ladies\[ladies_div1.xls]table calculations'!"&ADDRESS(MOD(ROW($A7)-6,12)+13,64+MOD(COLUMN(J$1)-2,8),4)) -> Mapperley Park 1st | K7: =INDIRECT.EXT("'..\ladies\[ladies_div1.xls]table calculations'!"&ADDRESS(MOD(ROW($A7)-6,12)+13,64+MOD(COLUMN(K$1)-2,8),4)) -> 2 | L7: =INDIRECT.EXT("'..\ladies\[ladies_div1.xls]table calculations'!"&ADDRESS(MOD(ROW($A7)-6,12)+13,64+MOD(COLUMN(L$1)-2,8),4)) -> 2 | M7: =INDIRECT.EXT("'..\ladies\[ladies_div1.xls]table calculations'!"&ADDRESS(MOD(ROW($A7)-6,12)+13,64+MOD(COLUMN(M$1)-2,8),4)) -> 0 | N7: =INDIRECT.EXT("'..\ladies\[ladies_div1.xls]table calculations'!"&ADDRESS(MOD(ROW($A7)-6,12)+13,64+MOD(COLUMN(N$1)-2,8),4)) -> 16 | O7: =INDIRECT.EXT("'..\ladies\[ladies_div1.xls]table calculations'!"&ADDRESS(MOD(ROW($A7)-6,12)+13,64+MOD(COLUMN(O$1)-2,8),4)) -> 2 | P7: =INDIRECT.EXT("'..\ladies\[ladies_div1.xls]table calculations'!"&ADDRESS(MOD(ROW($A7)-6,12)+13,64+MOD(COLUMN(P$1)-2,8)+2,4)) -> 4
B8: =INDIRECT.EXT("'..\ladies\[ladies_prem.xls]table calculations'!"&ADDRESS(MOD(ROW($A8)-6,12)+13,64+MOD(COLUMN(B$1)-2,8),4)) -> Bingham 1st | C8: =INDIRECT.EXT("'..\ladies\[ladies_prem.xls]table calculations'!"&ADDRESS(MOD(ROW($A8)-6,12)+13,64+MOD(COLUMN(C$1)-2,8),4)) -> 5 | D8: =INDIRECT.EXT("'..\ladies\[ladies_prem.xls]table calculations'!"&ADDRESS(MOD(ROW($A8)-6,12)+13,64+MOD(COLUMN(D$1)-2,8),4)) -> 3 | E8: =INDIRECT.EXT("'..\ladies\[ladies_prem.xls]table calculations'!"&ADDRESS(MOD(ROW($A8)-6,12)+13,64+MOD(COLUMN(E$1)-2,8),4)) -> 2 | F8: =INDIRECT.EXT("'..\ladies\[ladies_prem.xls]table calculations'!"&ADDRESS(MOD(ROW($A8)-6,12)+13,64+MOD(COLUMN(F$1)-2,8),4)) -> 32 | G8: =INDIRECT.EXT("'..\ladies\[ladies_prem.xls]table calculations'!"&ADDRESS(MOD(ROW($A8)-6,12)+13,64+MOD(COLUMN(G$1)-2,8),4)) -> 13 | H8: =INDIRECT.EXT("'..\ladies\[ladies_prem.xls]table calculations'!"&ADDRESS(MOD(ROW($A8)-6,12)+13,64+MOD(COLUMN(H$1)-2,8)+2,4)) -> 6 | J8: =INDIRECT.EXT("'..\ladies\[ladies_div1.xls]table calculations'!"&ADDRESS(MOD(ROW($A8)-6,12)+13,64+MOD(COLUMN(J$1)-2,8),4)) -> East Leake | K8: =INDIRECT.EXT("'..\ladies\[ladies_div1.xls]table calculations'!"&ADDRESS(MOD(ROW($A8)-6,12)+13,64+MOD(COLUMN(K$1)-2,8),4)) -> 3 | L8: =INDIRECT.EXT("'..\ladies\[ladies_div1.xls]table calculations'!"&ADDRESS(MOD(ROW($A8)-6,12)+13,64+MOD(COLUMN(L$1)-2,8),4)) -> 2 | M8: =INDIRECT.EXT("'..\ladies\[ladies_div1.xls]table calculations'!"&ADDRESS(MOD(ROW($A8)-6,12)+13,64+MOD(COLUMN(M$1)-2,8),4)) -> 1 | N8: =INDIRECT.EXT("'..\ladies\[ladies_div1.xls]table calculations'!"&ADDRESS(MOD(ROW($A8)-6,12)+13,64+MOD(COLUMN(N$1)-2,8),4)) -> 15 | O8: =INDIRECT.EXT("'..\ladies\[ladies_div1.xls]table calculations'!"&ADDRESS(MOD(ROW($A8)-6,12)+13,64+MOD(COLUMN(O$1)-2,8),4)) -> 12 | P8: =INDIRECT.EXT("'..\ladies\[ladies_div1.xls]table calculations'!"&ADDRESS(MOD(ROW($A8)-6,12)+13,64+MOD(COLUMN(P$1)-2,8)+2,4)) -> 4
B9: =INDIRECT.EXT("'..\ladies\[ladies_prem.xls]table calculations'!"&ADDRESS(MOD(ROW($A9)-6,12)+13,64+MOD(COLUMN(B$1)-2,8),4)) -> Byron 1st | C9: =INDIRECT.EXT("'..\ladies\[ladies_prem.xls]table calculations'!"&ADDRESS(MOD(ROW($A9)-6,12)+13,64+MOD(COLUMN(C$1)-2,8),4)) -> 4 | D9: =INDIRECT.EXT("'..\ladies\[ladies_prem.xls]table calculations'!"&ADDRESS(MOD(ROW($A9)-6,12)+13,64+MOD(COLUMN(D$1)-2,8),4)) -> 3 | E9: =INDIRECT.EXT("'..\ladies\[ladies_prem.xls]table calculations'!"&ADDRESS(MOD(ROW($A9)-6,12)+13,64+MOD(COLUMN(E$1)-2,8),4)) -> 1 | F9: =INDIRECT.EXT("'..\ladies\[ladies_prem.xls]table calculations'!"&ADDRESS(MOD(ROW($A9)-6,12)+13,64+MOD(COLUMN(F$1)-2,8),4)) -> 21 | G9: =INDIRECT.EXT("'..\ladies\[ladies_prem.xls]table calculations'!"&ADDRESS(MOD(ROW($A9)-6,12)+13,64+MOD(COLUMN(G$1)-2,8),4)) -> 15 | H9: =INDIRECT.EXT("'..\ladies\[ladies_prem.xls]table calculations'!"&ADDRESS(MOD(ROW($A9)-6,12)+13,64+MOD(COLUMN(H$1)-2,8)+2,4)) -> 6 | J9: =INDIRECT.EXT("'..\ladies\[ladies_div1.xls]table calculations'!"&ADDRESS(MOD(ROW($A9)-6,12)+13,64+MOD(COLUMN(J$1)-2,8),4)) -> Nottingham Vets 2nd | K9: =INDIRECT.EXT("'..\ladies\[ladies_div1.xls]table calculations'!"&ADDRESS(MOD(ROW($A9)-6,12)+13,64+MOD(COLUMN(K$1)-2,8),4)) -> 3 | L9: =INDIRECT.EXT("'..\ladies\[ladies_div1.xls]table calculations'!"&ADDRESS(MOD(ROW($A9)-6,12)+13,64+MOD(COLUMN(L$1)-2,8),4)) -> 2 | M9: =INDIRECT.EXT("'..\ladies\[ladies_div1.xls]table calculations'!"&ADDRESS(MOD(ROW($A9)-6,12)+13,64+MOD(COLUMN(M$1)-2,8),4)) -> 1 | N9: =INDIRECT.EXT("'..\ladies\[ladies_div1.xls]table calculations'!"&ADDRESS(MOD(ROW($A9)-6,12)+13,64+MOD(COLUMN(N$1)-2,8),4)) -> 15 | O9: =INDIRECT.EXT("'..\ladies\[ladies_div1.xls]table calculations'!"&ADDRESS(MOD(ROW($A9)-6,12)+13,64+MOD(COLUMN(O$1)-2,8),4)) -> 12 | P9: =INDIRECT.EXT("'..\ladies\[ladies_div1.xls]table calculations'!"&ADDRESS(MOD(ROW($A9)-6,12)+13,64+MOD(COLUMN(P$1)-2,8)+2,4)) -> 4
B10: =INDIRECT.EXT("'..\ladies\[ladies_prem.xls]table calculations'!"&ADDRESS(MOD(ROW($A10)-6,12)+13,64+MOD(COLUMN(B$1)-2,8),4)) -> Beeston Fields 1st | C10: =INDIRECT.EXT("'..\ladies\[ladies_prem.xls]table calculations'!"&ADDRESS(MOD(ROW($A10)-6,12)+13,64+MOD(COLUMN(C$1)-2,8),4)) -> 3 | D10: =INDIRECT.EXT("'..\ladies\[ladies_prem.xls]table calculations'!"&ADDRESS(MOD(ROW($A10)-6,12)+13,64+MOD(COLUMN(D$1)-2,8),4)) -> 0 | E10: =INDIRECT.EXT("'..\ladies\[ladies_prem.xls]table calculations'!"&ADDRESS(MOD(ROW($A10)-6,12)+13,64+MOD(COLUMN(E$1)-2,8),4)) -> 3 | F10: =INDIRECT.EXT("'..\ladies\[ladies_prem.xls]table calculations'!"&ADDRESS(MOD(ROW($A10)-6,12)+13,64+MOD(COLUMN(F$1)-2,8),4)) -> 6 | G10: =INDIRECT.EXT("'..\ladies\[ladies_prem.xls]table calculations'!"&ADDRESS(MOD(ROW($A10)-6,12)+13,64+MOD(COLUMN(G$1)-2,8),4)) -> 21 | H10: =INDIRECT.EXT("'..\ladies\[ladies_prem.xls]table calculations'!"&ADDRESS(MOD(ROW($A10)-6,12)+13,64+MOD(COLUMN(H$1)-2,8)+2,4)) -> 0 | J10: =INDIRECT.EXT("'..\ladies\[ladies_div1.xls]table calculations'!"&ADDRESS(MOD(ROW($A10)-6,12)+13,64+MOD(COLUMN(J$1)-2,8),4)) -> Bingham 3rd | K10: =INDIRECT.EXT("'..\ladies\[ladies_div1.xls]table calculations'!"&ADDRESS(MOD(ROW($A10)-6,12)+13,64+MOD(COLUMN(K$1)-2,8),4)) -> 3 | L10: =INDIRECT.EXT("'..\ladies\[ladies_div1.xls]table calculations'!"&ADDRESS(MOD(ROW($A10)-6,12)+13,64+MOD(COLUMN(L$1)-2,8),4)) -> 1 | M10: =INDIRECT.EXT("'..\ladies\[ladies_div1.xls]table calculations'!"&ADDRESS(MOD(ROW($A10)-6,12)+13,64+MOD(COLUMN(M$1)-2,8),4)) -> 2 | N10: =INDIRECT.EXT("'..\ladies\[ladies_div1.xls]table calculations'!"&ADDRESS(MOD(ROW($A10)-6,12)+13,64+MOD(COLUMN(N$1)-2,8),4)) -> 11 | O10: =INDIRECT.EXT("'..\ladies\[ladies_div1.xls]table calculations'!"&ADDRESS(MOD(ROW($A10)-6,12)+13,64+MOD(COLUMN(O$1)-2,8),4)) -> 16 | P10: =INDIRECT.EXT("'..\ladies\[ladies_div1.xls]table calculations'!"&ADDRESS(MOD(ROW($A10)-6,12)+13,64+MOD(COLUMN(P$1)-2,8)+2,4)) -> 2
B11: =INDIRECT.EXT("'..\ladies\[ladies_prem.xls]table calculations'!"&ADDRESS(MOD(ROW($A11)-6,12)+13,64+MOD(COLUMN(B$1)-2,8),4)) -> Bingham 2nd | C11: =INDIRECT.EXT("'..\ladies\[ladies_prem.xls]table calculations'!"&ADDRESS(MOD(ROW($A11)-6,12)+13,64+MOD(COLUMN(C$1)-2,8),4)) -> 4 | D11: =INDIRECT.EXT("'..\ladies\[ladies_prem.xls]table calculations'!"&ADDRESS(MOD(ROW($A11)-6,12)+13,64+MOD(COLUMN(D$1)-2,8),4)) -> 0 | E11: =INDIRECT.EXT("'..\ladies\[ladies_prem.xls]table calculations'!"&ADDRESS(MOD(ROW($A11)-6,12)+13,64+MOD(COLUMN(E$1)-2,8),4)) -> 4 | F11: =INDIRECT.EXT("'..\ladies\[ladies_prem.xls]table calculations'!"&ADDRESS(MOD(ROW($A11)-6,12)+13,64+MOD(COLUMN(F$1)-2,8),4)) -> 5 | G11: =INDIRECT.EXT("'..\ladies\[ladies_prem.xls]table calculations'!"&ADDRESS(MOD(ROW($A11)-6,12)+13,64+MOD(COLUMN(G$1)-2,8),4)) -> 31 | H11: =INDIRECT.EXT("'..\ladies\[ladies_prem.xls]table calculations'!"&ADDRESS(MOD(ROW($A11)-6,12)+13,64+MOD(COLUMN(H$1)-2,8)+2,4)) -> 0 | J11: =INDIRECT.EXT("'..\ladies\[ladies_div1.xls]table calculations'!"&ADDRESS(MOD(ROW($A11)-6,12)+13,64+MOD(COLUMN(J$1)-2,8),4)) -> Phoenixwood 1st | K11: =INDIRECT.EXT("'..\ladies\[ladies_div1.xls]table calculations'!"&ADDRESS(MOD(ROW($A11)-6,12)+13,64+MOD(COLUMN(K$1)-2,8),4)) -> 1 | L11: =INDIRECT.EXT("'..\ladies\[ladies_div1.xls]table calculations'!"&ADDRESS(MOD(ROW($A11)-6,12)+13,64+MOD(COLUMN(L$1)-2,8),4)) -> 0 | M11: =INDIRECT.EXT("'..\ladies\[ladies_div1.xls]table calculations'!"&ADDRESS(MOD(ROW($A11)-6,12)+13,64+MOD(COLUMN(M$1)-2,8),4)) -> 1 | N11: =INDIRECT.EXT("'..\ladies\[ladies_div1.xls]table calculations'!"&ADDRESS(MOD(ROW($A11)-6,12)+13,64+MOD(COLUMN(N$1)-2,8),4)) -> 4 | O11: =INDIRECT.EXT("'..\ladies\[ladies_div1.xls]table calculations'!"&ADDRESS(MOD(ROW($A11)-6,12)+13,64+MOD(COLUMN(O$1)-2,8),4)) -> 5 | P11: =INDIRECT.EXT("'..\ladies\[ladies_div1.xls]table calculations'!"&ADDRESS(MOD(ROW($A11)-6,12)+13,64+MOD(COLUMN(P$1)-2,8)+2,4)) -> 0
B12: =INDIRECT.EXT("'..\ladies\[ladies_prem.xls]table calculations'!"&ADDRESS(MOD(ROW($A12)-6,12)+13,64+MOD(COLUMN(B$1)-2,8),4)) -> Nottingham Vets 1st | C12: =INDIRECT.EXT("'..\ladies\[ladies_prem.xls]table calculations'!"&ADDRESS(MOD(ROW($A12)-6,12)+13,64+MOD(COLUMN(C$1)-2,8),4)) -> 4 | D12: =INDIRECT.EXT("'..\ladies\[ladies_prem.xls]table calculations'!"&ADDRESS(MOD(ROW($A12)-6,12)+13,64+MOD(COLUMN(D$1)-2,8),4)) -> 0 | E12: =INDIRECT.EXT("'..\ladies\[ladies_prem.xls]table calculations'!"&ADDRESS(MOD(ROW($A12)-6,12)+13,64+MOD(COLUMN(E$1)-2,8),4)) -> 4 | F12: =INDIRECT.EXT("'..\ladies\[ladies_prem.xls]table calculations'!"&ADDRESS(MOD(ROW($A12)-6,12)+13,64+MOD(COLUMN(F$1)-2,8),4)) -> 3 | G12: =INDIRECT.EXT("'..\ladies\[ladies_prem.xls]table calculations'!"&ADDRESS(MOD(ROW($A12)-6,12)+13,64+MOD(COLUMN(G$1)-2,8),4)) -> 33 | H12: =INDIRECT.EXT("'..\ladies\[ladies_prem.xls]table calculations'!"&ADDRESS(MOD(ROW($A12)-6,12)+13,64+MOD(COLUMN(H$1)-2,8)+2,4)) -> 0 | J12: =INDIRECT.EXT("'..\ladies\[ladies_div1.xls]table calculations'!"&ADDRESS(MOD(ROW($A12)-6,12)+13,64+MOD(COLUMN(J$1)-2,8),4)) -> Mapperley Park 2nd | K12: =INDIRECT.EXT("'..\ladies\[ladies_div1.xls]table calculations'!"&ADDRESS(MOD(ROW($A12)-6,12)+13,64+MOD(COLUMN(K$1)-2,8),4)) -> 3 | L12: =INDIRECT.EXT("'..\ladies\[ladies_div1.xls]table calculations'!"&ADDRESS(MOD(ROW($A12)-6,12)+13,64+MOD(COLUMN(L$1)-2,8),4)) -> 0 | M12: =INDIRECT.EXT("'..\ladies\[ladies_div1.xls]table calculations'!"&ADDRESS(MOD(ROW($A12)-6,12)+13,64+MOD(COLUMN(M$1)-2,8),4)) -> 3 | N12: =INDIRECT.EXT("'..\ladies\[ladies_div1.xls]table calculations'!"&ADDRESS(MOD(ROW($A12)-6,12)+13,64+MOD(COLUMN(N$1)-2,8),4)) -> 6 | O12: =INDIRECT.EXT("'..\ladies\[ladies_div1.xls]table calculations'!"&ADDRESS(MOD(ROW($A12)-6,12)+13,64+MOD(COLUMN(O$1)-2,8),4)) -> 21 | P12: =INDIRECT.EXT("'..\ladies\[ladies_div1.xls]table calculations'!"&ADDRESS(MOD(ROW($A12)-6,12)+13,64+MOD(COLUMN(P$1)-2,8)+2,4)) -> 0
B13: =INDIRECT.EXT("'..\ladies\[ladies_prem.xls]table calculations'!"&ADDRESS(MOD(ROW($A13)-6,12)+13,64+MOD(COLUMN(B$1)-2,8),4)) -> _ | C13: =INDIRECT.EXT("'..\ladies\[ladies_prem.xls]table calculations'!"&ADDRESS(MOD(ROW($A13)-6,12)+13,64+MOD(COLUMN(C$1)-2,8),4)) -> _ | D13: =INDIRECT.EXT("'..\ladies\[ladies_prem.xls]table calculations'!"&ADDRESS(MOD(ROW($A13)-6,12)+13,64+MOD(COLUMN(D$1)-2,8),4)) -> _ | E13: =INDIRECT.EXT("'..\ladies\[ladies_prem.xls]table calculations'!"&ADDRESS(MOD(ROW($A13)-6,12)+13,64+MOD(COLUMN(E$1)-2,8),4)) -> _ | F13: =INDIRECT.EXT("'..\ladies\[ladies_prem.xls]table calculations'!"&ADDRESS(MOD(ROW($A13)-6,12)+13,64+MOD(COLUMN(F$1)-2,8),4)) -> _ | G13: =INDIRECT.EXT("'..\ladies\[ladies_prem.xls]table calculations'!"&ADDRESS(MOD(ROW($A13)-6,12)+13,64+MOD(COLUMN(G$1)-2,8),4)) -> _ | H13: =INDIRECT.EXT("'..\ladies\[ladies_prem.xls]table calculations'!"&ADDRESS(MOD(ROW($A13)-6,12)+13,64+MOD(COLUMN(H$1)-2,8)+2,4)) -> _ | J13: =INDIRECT.EXT("'..\ladies\[ladies_div1.xls]table calculations'!"&ADDRESS(MOD(ROW($A13)-6,12)+13,64+MOD(COLUMN(J$1)-2,8),4)) -> _ | K13: =INDIRECT.EXT("'..\ladies\[ladies_div1.xls]table calculations'!"&ADDRESS(MOD(ROW($A13)-6,12)+13,64+MOD(COLUMN(K$1)-2,8),4)) -> _ | L13: =INDIRECT.EXT("'..\ladies\[ladies_div1.xls]table calculations'!"&ADDRESS(MOD(ROW($A13)-6,12)+13,64+MOD(COLUMN(L$1)-2,8),4)) -> _ | M13: =INDIRECT.EXT("'..\ladies\[ladies_div1.xls]table calculations'!"&ADDRESS(MOD(ROW($A13)-6,12)+13,64+MOD(COLUMN(M$1)-2,8),4)) -> _ | N13: =INDIRECT.EXT("'..\ladies\[ladies_div1.xls]table calculations'!"&ADDRESS(MOD(ROW($A13)-6,12)+13,64+MOD(COLUMN(N$1)-2,8),4)) -> _ | O13: =INDIRECT.EXT("'..\ladies\[ladies_div1.xls]table calculations'!"&ADDRESS(MOD(ROW($A13)-6,12)+13,64+MOD(COLUMN(O$1)-2,8),4)) -> _ | P13: =INDIRECT.EXT("'..\ladies\[ladies_div1.xls]table calculations'!"&ADDRESS(MOD(ROW($A13)-6,12)+13,64+MOD(COLUMN(P$1)-2,8)+2,4)) -> _
B15: Ladies Division 2 | J15: Ladies Division 3
B16: League Table | J16: League Table
B17: S T A N D I N G S | C17: p | D17: w | E17: l | F17: rf | G17: ra | H17: pts | J17: S T A N D I N G S | K17: p | L17: w | M17: l | N17: rf | O17: ra | P17: pts
B18: =INDIRECT.EXT("'..\ladies\[ladies_div2.xls]table calculations'!"&ADDRESS(MOD(ROW($A18)-6,12)+13,64+MOD(COLUMN(B$1)-2,8),4)) -> University 1st | C18: =INDIRECT.EXT("'..\ladies\[ladies_div2.xls]table calculations'!"&ADDRESS(MOD(ROW($A18)-6,12)+13,64+MOD(COLUMN(C$1)-2,8),4)) -> 3 | D18: =INDIRECT.EXT("'..\ladies\[ladies_div2.xls]table calculations'!"&ADDRESS(MOD(ROW($A18)-6,12)+13,64+MOD(COLUMN(D$1)-2,8),4)) -> 3 | E18: =INDIRECT.EXT("'..\ladies\[ladies_div2.xls]table calculations'!"&ADDRESS(MOD(ROW($A18)-6,12)+13,64+MOD(COLUMN(E$1)-2,8),4)) -> 0 | F18: =INDIRECT.EXT("'..\ladies\[ladies_div2.xls]table calculations'!"&ADDRESS(MOD(ROW($A18)-6,12)+13,64+MOD(COLUMN(F$1)-2,8),4)) -> 22 | G18: =INDIRECT.EXT("'..\ladies\[ladies_div2.xls]table calculations'!"&ADDRESS(MOD(ROW($A18)-6,12)+13,64+MOD(COLUMN(G$1)-2,8),4)) -> 5 | H18: =INDIRECT.EXT("'..\ladies\[ladies_div2.xls]table calculations'!"&ADDRESS(MOD(ROW($A18)-6,12)+13,64+MOD(COLUMN(H$1)-2,8)+2,4)) -> 6 | J18: =INDIRECT.EXT("'..\ladies\[ladies_div3.xls]table calculations'!"&ADDRESS(MOD(ROW($A18)-6,12)+13,64+MOD(COLUMN(J$1)-2,8),4)) -> Phoenixwood 2nd | K18: =INDIRECT.EXT("'..\ladies\[ladies_div3.xls]table calculations'!"&ADDRESS(MOD(ROW($A18)-6,12)+13,64+MOD(COLUMN(K$1)-2,8),4)) -> 4 | L18: =INDIRECT.EXT("'..\ladies\[ladies_div3.xls]table calculations'!"&ADDRESS(MOD(ROW($A18)-6,12)+13,64+MOD(COLUMN(L$1)-2,8),4)) -> 4 | M18: =INDIRECT.EXT("'..\ladies\[ladies_div3.xls]table calculations'!"&ADDRESS(MOD(ROW($A18)-6,12)+13,64+MOD(COLUMN(M$1)-2,8),4)) -> 0 | N18: =INDIRECT.EXT("'..\ladies\[ladies_div3.xls]table calculations'!"&ADDRESS(MOD(ROW($A18)-6,12)+13,64+MOD(COLUMN(N$1)-2,8),4)) -> 22 | O18: =INDIRECT.EXT("'..\ladies\[ladies_div3.xls]table calculations'!"&ADDRESS(MOD(ROW($A18)-6,12)+13,64+MOD(COLUMN(O$1)-2,8),4)) -> 14 | P18: =INDIRECT.EXT("'..\ladies\[ladies_div3.xls]table calculations'!"&ADDRESS(MOD(ROW($A18)-6,12)+13,64+MOD(COLUMN(P$1)-2,8)+2,4)) -> 8
B19: =INDIRECT.EXT("'..\ladies\[ladies_div2.xls]table calculations'!"&ADDRESS(MOD(ROW($A19)-6,12)+13,64+MOD(COLUMN(B$1)-2,8),4)) -> Carlton | C19: =INDIRECT.EXT("'..\ladies\[ladies_div2.xls]table calculations'!"&ADDRESS(MOD(ROW($A19)-6,12)+13,64+MOD(COLUMN(C$1)-2,8),4)) -> 3 | D19: =INDIRECT.EXT("'..\ladies\[ladies_div2.xls]table calculations'!"&ADDRESS(MOD(ROW($A19)-6,12)+13,64+MOD(COLUMN(D$1)-2,8),4)) -> 2 | E19: =INDIRECT.EXT("'..\ladies\[ladies_div2.xls]table calculations'!"&ADDRESS(MOD(ROW($A19)-6,12)+13,64+MOD(COLUMN(E$1)-2,8),4)) -> 1 | F19: =INDIRECT.EXT("'..\ladies\[ladies_div2.xls]table calculations'!"&ADDRESS(MOD(ROW($A19)-6,12)+13,64+MOD(COLUMN(F$1)-2,8),4)) -> 17 | G19: =INDIRECT.EXT("'..\ladies\[ladies_div2.xls]table calculations'!"&ADDRESS(MOD(ROW($A19)-6,12)+13,64+MOD(COLUMN(G$1)-2,8),4)) -> 10 | H19: =INDIRECT.EXT("'..\ladies\[ladies_div2.xls]table calculations'!"&ADDRESS(MOD(ROW($A19)-6,12)+13,64+MOD(COLUMN(H$1)-2,8)+2,4)) -> 4 | J19: =INDIRECT.EXT("'..\ladies\[ladies_div3.xls]table calculations'!"&ADDRESS(MOD(ROW($A19)-6,12)+13,64+MOD(COLUMN(J$1)-2,8),4)) -> Southwell Centre | K19: =INDIRECT.EXT("'..\ladies\[ladies_div3.xls]table calculations'!"&ADDRESS(MOD(ROW($A19)-6,12)+13,64+MOD(COLUMN(K$1)-2,8),4)) -> 4 | L19: =INDIRECT.EXT("'..\ladies\[ladies_div3.xls]table calculations'!"&ADDRESS(MOD(ROW($A19)-6,12)+13,64+MOD(COLUMN(L$1)-2,8),4)) -> 3 | M19: =INDIRECT.EXT("'..\ladies\[ladies_div3.xls]table calculations'!"&ADDRESS(MOD(ROW($A19)-6,12)+13,64+MOD(COLUMN(M$1)-2,8),4)) -> 1 | N19: =INDIRECT.EXT("'..\ladies\[ladies_div3.xls]table calculations'!"&ADDRESS(MOD(ROW($A19)-6,12)+13,64+MOD(COLUMN(N$1)-2,8),4)) -> 26 | O19: =INDIRECT.EXT("'..\ladies\[ladies_div3.xls]table calculations'!"&ADDRESS(MOD(ROW($A19)-6,12)+13,64+MOD(COLUMN(O$1)-2,8),4)) -> 10 | P19: =INDIRECT.EXT("'..\ladies\[ladies_div3.xls]table calculations'!"&ADDRESS(MOD(ROW($A19)-6,12)+13,64+MOD(COLUMN(P$1)-2,8)+2,4)) -> 6
B20: =INDIRECT.EXT("'..\ladies\[ladies_div2.xls]table calculations'!"&ADDRESS(MOD(ROW($A20)-6,12)+13,64+MOD(COLUMN(B$1)-2,8),4)) -> Forest 2nd | C20: =INDIRECT.EXT("'..\ladies\[ladies_div2.xls]table calculations'!"&ADDRESS(MOD(ROW($A20)-6,12)+13,64+MOD(COLUMN(C$1)-2,8),4)) -> 2 | D20: =INDIRECT.EXT("'..\ladies\[ladies_div2.xls]table calculations'!"&ADDRESS(MOD(ROW($A20)-6,12)+13,64+MOD(COLUMN(D$1)-2,8),4)) -> 1 | E20: =INDIRECT.EXT("'..\ladies\[ladies_div2.xls]table calculations'!"&ADDRESS(MOD(ROW($A20)-6,12)+13,64+MOD(COLUMN(E$1)-2,8),4)) -> 1 | F20: =INDIRECT.EXT("'..\ladies\[ladies_div2.xls]table calculations'!"&ADDRESS(MOD(ROW($A20)-6,12)+13,64+MOD(COLUMN(F$1)-2,8),4)) -> 9 | G20: =INDIRECT.EXT("'..\ladies\[ladies_div2.xls]table calculations'!"&ADDRESS(MOD(ROW($A20)-6,12)+13,64+MOD(COLUMN(G$1)-2,8),4)) -> 9 | H20: =INDIRECT.EXT("'..\ladies\[ladies_div2.xls]table calculations'!"&ADDRESS(MOD(ROW($A20)-6,12)+13,64+MOD(COLUMN(H$1)-2,8)+2,4)) -> 2 | J20: =INDIRECT.EXT("'..\ladies\[ladies_div3.xls]table calculations'!"&ADDRESS(MOD(ROW($A20)-6,12)+13,64+MOD(COLUMN(J$1)-2,8),4)) -> Arboretum | K20: =INDIRECT.EXT("'..\ladies\[ladies_div3.xls]table calculations'!"&ADDRESS(MOD(ROW($A20)-6,12)+13,64+MOD(COLUMN(K$1)-2,8),4)) -> 4 | L20: =INDIRECT.EXT("'..\ladies\[ladies_div3.xls]table calculations'!"&ADDRESS(MOD(ROW($A20)-6,12)+13,64+MOD(COLUMN(L$1)-2,8),4)) -> 3 | M20: =INDIRECT.EXT("'..\ladies\[ladies_div3.xls]table calculations'!"&ADDRESS(MOD(ROW($A20)-6,12)+13,64+MOD(COLUMN(M$1)-2,8),4)) -> 1 | N20: =INDIRECT.EXT("'..\ladies\[ladies_div3.xls]table calculations'!"&ADDRESS(MOD(ROW($A20)-6,12)+13,64+MOD(COLUMN(N$1)-2,8),4)) -> 20 | O20: =INDIRECT.EXT("'..\ladies\[ladies_div3.xls]table calculations'!"&ADDRESS(MOD(ROW($A20)-6,12)+13,64+MOD(COLUMN(O$1)-2,8),4)) -> 16 | P20: =INDIRECT.EXT("'..\ladies\[ladies_div3.xls]table calculations'!"&ADDRESS(MOD(ROW($A20)-6,12)+13,64+MOD(COLUMN(P$1)-2,8)+2,4)) -> 6
B21: =INDIRECT.EXT("'..\ladies\[ladies_div2.xls]table calculations'!"&ADDRESS(MOD(ROW($A21)-6,12)+13,64+MOD(COLUMN(B$1)-2,8),4)) -> Crusader | C21: =INDIRECT.EXT("'..\ladies\[ladies_div2.xls]table calculations'!"&ADDRESS(MOD(ROW($A21)-6,12)+13,64+MOD(COLUMN(C$1)-2,8),4)) -> 2 | D21: =INDIRECT.EXT("'..\ladies\[ladies_div2.xls]table calculations'!"&ADDRESS(MOD(ROW($A21)-6,12)+13,64+MOD(COLUMN(D$1)-2,8),4)) -> 0 | E21: =INDIRECT.EXT("'..\ladies\[ladies_div2.xls]table calculations'!"&ADDRESS(MOD(ROW($A21)-6,12)+13,64+MOD(COLUMN(E$1)-2,8),4)) -> 2 | F21: =INDIRECT.EXT("'..\ladies\[ladies_div2.xls]table calculations'!"&ADDRESS(MOD(ROW($A21)-6,12)+13,64+MOD(COLUMN(F$1)-2,8),4)) -> 4 | G21: =INDIRECT.EXT("'..\ladies\[ladies_div2.xls]table calculations'!"&ADDRESS(MOD(ROW($A21)-6,12)+13,64+MOD(COLUMN(G$1)-2,8),4)) -> 14 | H21: =INDIRECT.EXT("'..\ladies\[ladies_div2.xls]table calculations'!"&ADDRESS(MOD(ROW($A21)-6,12)+13,64+MOD(COLUMN(H$1)-2,8)+2,4)) -> 0 | J21: =INDIRECT.EXT("'..\ladies\[ladies_div3.xls]table calculations'!"&ADDRESS(MOD(ROW($A21)-6,12)+13,64+MOD(COLUMN(J$1)-2,8),4)) -> Boots | K21: =INDIRECT.EXT("'..\ladies\[ladies_div3.xls]table calculations'!"&ADDRESS(MOD(ROW($A21)-6,12)+13,64+MOD(COLUMN(K$1)-2,8),4)) -> 3 | L21: =INDIRECT.EXT("'..\ladies\[ladies_div3.xls]table calculations'!"&ADDRESS(MOD(ROW($A21)-6,12)+13,64+MOD(COLUMN(L$1)-2,8),4)) -> 1 | M21: =INDIRECT.EXT("'..\ladies\[ladies_div3.xls]table calculations'!"&ADDRESS(MOD(ROW($A21)-6,12)+13,64+MOD(COLUMN(M$1)-2,8),4)) -> 2 | N21: =INDIRECT.EXT("'..\ladies\[ladies_div3.xls]table calculations'!"&ADDRESS(MOD(ROW($A21)-6,12)+13,64+MOD(COLUMN(N$1)-2,8),4)) -> 12 | O21: =INDIRECT.EXT("'..\ladies\[ladies_div3.xls]table calculations'!"&ADDRESS(MOD(ROW($A21)-6,12)+13,64+MOD(COLUMN(O$1)-2,8),4)) -> 15 | P21: =INDIRECT.EXT("'..\ladies\[ladies_div3.xls]table calculations'!"&ADDRESS(MOD(ROW($A21)-6,12)+13,64+MOD(COLUMN(P$1)-2,8)+2,4)) -> 2
B22: =INDIRECT.EXT("'..\ladies\[ladies_div2.xls]table calculations'!"&ADDRESS(MOD(ROW($A22)-6,12)+13,64+MOD(COLUMN(B$1)-2,8),4)) -> Beeston Valley 1st | C22: =INDIRECT.EXT("'..\ladies\[ladies_div2.xls]table calculations'!"&ADDRESS(MOD(ROW($A22)-6,12)+13,64+MOD(COLUMN(C$1)-2,8),4)) -> 2 | D22: =INDIRECT.EXT("'..\ladies\[ladies_div2.xls]table calculations'!"&ADDRESS(MOD(ROW($A22)-6,12)+13,64+MOD(COLUMN(D$1)-2,8),4)) -> 0 | E22: =INDIRECT.EXT("'..\ladies\[ladies_div2.xls]table calculations'!"&ADDRESS(MOD(ROW($A22)-6,12)+13,64+MOD(COLUMN(E$1)-2,8),4)) -> 2 | F22: =INDIRECT.EXT("'..\ladies\[ladies_div2.xls]table calculations'!"&ADDRESS(MOD(ROW($A22)-6,12)+13,64+MOD(COLUMN(F$1)-2,8),4)) -> 2 | G22: =INDIRECT.EXT("'..\ladies\[ladies_div2.xls]table calculations'!"&ADDRESS(MOD(ROW($A22)-6,12)+13,64+MOD(COLUMN(G$1)-2,8),4)) -> 16 | H22: =INDIRECT.EXT("'..\ladies\[ladies_div2.xls]table calculations'!"&ADDRESS(MOD(ROW($A22)-6,12)+13,64+MOD(COLUMN(H$1)-2,8)+2,4)) -> 0 | J22: =INDIRECT.EXT("'..\ladies\[ladies_div3.xls]table calculations'!"&ADDRESS(MOD(ROW($A22)-6,12)+13,64+MOD(COLUMN(J$1)-2,8),4)) -> Kimberley | K22: =INDIRECT.EXT("'..\ladies\[ladies_div3.xls]table calculations'!"&ADDRESS(MOD(ROW($A22)-6,12)+13,64+MOD(COLUMN(K$1)-2,8),4)) -> 4 | L22: =INDIRECT.EXT("'..\ladies\[ladies_div3.xls]table calculations'!"&ADDRESS(MOD(ROW($A22)-6,12)+13,64+MOD(COLUMN(L$1)-2,8),4)) -> 1 | M22: =INDIRECT.EXT("'..\ladies\[ladies_div3.xls]table calculations'!"&ADDRESS(MOD(ROW($A22)-6,12)+13,64+MOD(COLUMN(M$1)-2,8),4)) -> 3 | N22: =INDIRECT.EXT("'..\ladies\[ladies_div3.xls]table calculations'!"&ADDRESS(MOD(ROW($A22)-6,12)+13,64+MOD(COLUMN(N$1)-2,8),4)) -> 15 | O22: =INDIRECT.EXT("'..\ladies\[ladies_div3.xls]table calculations'!"&ADDRESS(MOD(ROW($A22)-6,12)+13,64+MOD(COLUMN(O$1)-2,8),4)) -> 21 | P22: =INDIRECT.EXT("'..\ladies\[ladies_div3.xls]table calculations'!"&ADDRESS(MOD(ROW($A22)-6,12)+13,64+MOD(COLUMN(P$1)-2,8)+2,4)) -> 2
B23: =INDIRECT.EXT("'..\ladies\[ladies_div2.xls]table calculations'!"&ADDRESS(MOD(ROW($A23)-6,12)+13,64+MOD(COLUMN(B$1)-2,8),4)) -> Rolls Royce | C23: =INDIRECT.EXT("'..\ladies\[ladies_div2.xls]table calculations'!"&ADDRESS(MOD(ROW($A23)-6,12)+13,64+MOD(COLUMN(C$1)-2,8),4)) -> 0 | D23: =INDIRECT.EXT("'..\ladies\[ladies_div2.xls]table calculations'!"&ADDRESS(MOD(ROW($A23)-6,12)+13,64+MOD(COLUMN(D$1)-2,8),4)) -> 0 | E23: =INDIRECT.EXT("'..\ladies\[ladies_div2.xls]table calculations'!"&ADDRESS(MOD(ROW($A23)-6,12)+13,64+MOD(COLUMN(E$1)-2,8),4)) -> 0 | F23: =INDIRECT.EXT("'..\ladies\[ladies_div2.xls]table calculations'!"&ADDRESS(MOD(ROW($A23)-6,12)+13,64+MOD(COLUMN(F$1)-2,8),4)) -> 0 | G23: =INDIRECT.EXT("'..\ladies\[ladies_div2.xls]table calculations'!"&ADDRESS(MOD(ROW($A23)-6,12)+13,64+MOD(COLUMN(G$1)-2,8),4)) -> 0 | H23: =INDIRECT.EXT("'..\ladies\[ladies_div2.xls]table calculations'!"&ADDRESS(MOD(ROW($A23)-6,12)+13,64+MOD(COLUMN(H$1)-2,8)+2,4)) -> 0 | J23: =INDIRECT.EXT("'..\ladies\[ladies_div3.xls]table calculations'!"&ADDRESS(MOD(ROW($A23)-6,12)+13,64+MOD(COLUMN(J$1)-2,8),4)) -> Beeston Fields 2nd | K23: =INDIRECT.EXT("'..\ladies\[ladies_div3.xls]table calculations'!"&ADDRESS(MOD(ROW($A23)-6,12)+13,64+MOD(COLUMN(K$1)-2,8),4)) -> 3 | L23: =INDIRECT.EXT("'..\ladies\[ladies_div3.xls]table calculations'!"&ADDRESS(MOD(ROW($A23)-6,12)+13,64+MOD(COLUMN(L$1)-2,8),4)) -> 0 | M23: =INDIRECT.EXT("'..\ladies\[ladies_div3.xls]table calculations'!"&ADDRESS(MOD(ROW($A23)-6,12)+13,64+MOD(COLUMN(M$1)-2,8),4)) -> 3 | N23: =INDIRECT.EXT("'..\ladies\[ladies_div3.xls]table calculations'!"&ADDRESS(MOD(ROW($A23)-6,12)+13,64+MOD(COLUMN(N$1)-2,8),4)) -> 8 | O23: =INDIRECT.EXT("'..\ladies\[ladies_div3.xls]table calculations'!"&ADDRESS(MOD(ROW($A23)-6,12)+13,64+MOD(COLUMN(O$1)-2,8),4)) -> 19 | P23: =INDIRECT.EXT("'..\ladies\[ladies_div3.xls]table calculations'!"&ADDRESS(MOD(ROW($A23)-6,12)+13,64+MOD(COLUMN(P$1)-2,8)+2,4)) -> 0
B24: =INDIRECT.EXT("'..\ladies\[ladies_div2.xls]table calculations'!"&ADDRESS(MOD(ROW($A24)-6,12)+13,64+MOD(COLUMN(B$1)-2,8),4)) -> _ | C24: =INDIRECT.EXT("'..\ladies\[ladies_div2.xls]table calculations'!"&ADDRESS(MOD(ROW($A24)-6,12)+13,64+MOD(COLUMN(C$1)-2,8),4)) -> _ | D24: =INDIRECT.EXT("'..\ladies\[ladies_div2.xls]table calculations'!"&ADDRESS(MOD(ROW($A24)-6,12)+13,64+MOD(COLUMN(D$1)-2,8),4)) -> _ | E24: =INDIRECT.EXT("'..\ladies\[ladies_div2.xls]table calculations'!"&ADDRESS(MOD(ROW($A24)-6,12)+13,64+MOD(COLUMN(E$1)-2,8),4)) -> _ | F24: =INDIRECT.EXT("'..\ladies\[ladies_div2.xls]table calculations'!"&ADDRESS(MOD(ROW($A24)-6,12)+13,64+MOD(COLUMN(F$1)-2,8),4)) -> _ | G24: =INDIRECT.EXT("'..\ladies\[ladies_div2.xls]table calculations'!"&ADDRESS(MOD(ROW($A24)-6,12)+13,64+MOD(COLUMN(G$1)-2,8),4)) -> _ | H24: =INDIRECT.EXT("'..\ladies\[ladies_div2.xls]table calculations'!"&ADDRESS(MOD(ROW($A24)-6,12)+13,64+MOD(COLUMN(H$1)-2,8)+2,4)) -> _ | J24: =INDIRECT.EXT("'..\ladies\[ladies_div3.xls]table calculations'!"&ADDRESS(MOD(ROW($A24)-6,12)+13,64+MOD(COLUMN(J$1)-2,8),4)) -> Rushcliffe Arena | K24: =INDIRECT.EXT("'..\ladies\[ladies_div3.xls]table calculations'!"&ADDRESS(MOD(ROW($A24)-6,12)+13,64+MOD(COLUMN(K$1)-2,8),4)) -> 2 | L24: =INDIRECT.EXT("'..\ladies\[ladies_div3.xls]table calculations'!"&ADDRESS(MOD(ROW($A24)-6,12)+13,64+MOD(COLUMN(L$1)-2,8),4)) -> 0 | M24: =INDIRECT.EXT("'..\ladies\[ladies_div3.xls]table calculations'!"&ADDRESS(MOD(ROW($A24)-6,12)+13,64+MOD(COLUMN(M$1)-2,8),4)) -> 2 | N24: =INDIRECT.EXT("'..\ladies\[ladies_div3.xls]table calculations'!"&ADDRESS(MOD(ROW($A24)-6,12)+13,64+MOD(COLUMN(N$1)-2,8),4)) -> 5 | O24: =INDIRECT.EXT("'..\ladies\[ladies_div3.xls]table calculations'!"&ADDRESS(MOD(ROW($A24)-6,12)+13,64+MOD(COLUMN(O$1)-2,8),4)) -> 13 | P24: =INDIRECT.EXT("'..\ladies\[ladies_div3.xls]table calculations'!"&ADDRESS(MOD(ROW($A24)-6,12)+13,64+MOD(COLUMN(P$1)-2,8)+2,4)) -> 0
B25: =INDIRECT.EXT("'..\ladies\[ladies_div2.xls]table calculations'!"&ADDRESS(MOD(ROW($A25)-6,12)+13,64+MOD(COLUMN(B$1)-2,8),4)) -> _ | C25: =INDIRECT.EXT("'..\ladies\[ladies_div2.xls]table calculations'!"&ADDRESS(MOD(ROW($A25)-6,12)+13,64+MOD(COLUMN(C$1)-2,8),4)) -> _ | D25: =INDIRECT.EXT("'..\ladies\[ladies_div2.xls]table calculations'!"&ADDRESS(MOD(ROW($A25)-6,12)+13,64+MOD(COLUMN(D$1)-2,8),4)) -> _ | E25: =INDIRECT.EXT("'..\ladies\[ladies_div2.xls]table calculations'!"&ADDRESS(MOD(ROW($A25)-6,12)+13,64+MOD(COLUMN(E$1)-2,8),4)) -> _ | F25: =INDIRECT.EXT("'..\ladies\[ladies_div2.xls]table calculations'!"&ADDRESS(MOD(ROW($A25)-6,12)+13,64+MOD(COLUMN(F$1)-2,8),4)) -> _ | G25: =INDIRECT.EXT("'..\ladies\[ladies_div2.xls]table calculations'!"&ADDRESS(MOD(ROW($A25)-6,12)+13,64+MOD(COLUMN(G$1)-2,8),4)) -> _ | H25: =INDIRECT.EXT("'..\ladies\[ladies_div2.xls]table calculations'!"&ADDRESS(MOD(ROW($A25)-6,12)+13,64+MOD(COLUMN(H$1)-2,8)+2,4)) -> _ | J25: =INDIRECT.EXT("'..\ladies\[ladies_div3.xls]table calculations'!"&ADDRESS(MOD(ROW($A25)-6,12)+13,64+MOD(COLUMN(J$1)-2,8),4)) -> _ | K25: =INDIRECT.EXT("'..\ladies\[ladies_div3.xls]table calculations'!"&ADDRESS(MOD(ROW($A25)-6,12)+13,64+MOD(COLUMN(K$1)-2,8),4)) -> _ | L25: =INDIRECT.EXT("'..\ladies\[ladies_div3.xls]table calculations'!"&ADDRESS(MOD(ROW($A25)-6,12)+13,64+MOD(COLUMN(L$1)-2,8),4)) -> _ | M25: =INDIRECT.EXT("'..\ladies\[ladies_div3.xls]table calculations'!"&ADDRESS(MOD(ROW($A25)-6,12)+13,64+MOD(COLUMN(M$1)-2,8),4)) -> _ | N25: =INDIRECT.EXT("'..\ladies\[ladies_div3.xls]table calculations'!"&ADDRESS(MOD(ROW($A25)-6,12)+13,64+MOD(COLUMN(N$1)-2,8),4)) -> _ | O25: =INDIRECT.EXT("'..\ladies\[ladies_div3.xls]table calculations'!"&ADDRESS(MOD(ROW($A25)-6,12)+13,64+MOD(COLUMN(O$1)-2,8),4)) -> _ | P25: =INDIRECT.EXT("'..\ladies\[ladies_div3.xls]table calculations'!"&ADDRESS(MOD(ROW($A25)-6,12)+13,64+MOD(COLUMN(P$1)-2,8)+2,4)) -> _
B27: Ladies Division 4
B28: League Table
B29: S T A N D I N G S | C29: p | D29: w | E29: l | F29: rf | G29: ra | H29: pts
B30: =INDIRECT.EXT("'..\ladies\[ladies_div4.xls]table calculations'!"&ADDRESS(MOD(ROW($A30)-6,12)+13,64+MOD(COLUMN(B$1)-2,8),4)) -> St Giles 1st | C30: =INDIRECT.EXT("'..\ladies\[ladies_div4.xls]table calculations'!"&ADDRESS(MOD(ROW($A30)-6,12)+13,64+MOD(COLUMN(C$1)-2,8),4)) -> 4 | D30: =INDIRECT.EXT("'..\ladies\[ladies_div4.xls]table calculations'!"&ADDRESS(MOD(ROW($A30)-6,12)+13,64+MOD(COLUMN(D$1)-2,8),4)) -> 4 | E30: =INDIRECT.EXT("'..\ladies\[ladies_div4.xls]table calculations'!"&ADDRESS(MOD(ROW($A30)-6,12)+13,64+MOD(COLUMN(E$1)-2,8),4)) -> 0 | F30: =INDIRECT.EXT("'..\ladies\[ladies_div4.xls]table calculations'!"&ADDRESS(MOD(ROW($A30)-6,12)+13,64+MOD(COLUMN(F$1)-2,8),4)) -> 30 | G30: =INDIRECT.EXT("'..\ladies\[ladies_div4.xls]table calculations'!"&ADDRESS(MOD(ROW($A30)-6,12)+13,64+MOD(COLUMN(G$1)-2,8),4)) -> 6 | H30: =INDIRECT.EXT("'..\ladies\[ladies_div4.xls]table calculations'!"&ADDRESS(MOD(ROW($A30)-6,12)+13,64+MOD(COLUMN(H$1)-2,8)+2,4)) -> 8
B31: =INDIRECT.EXT("'..\ladies\[ladies_div4.xls]table calculations'!"&ADDRESS(MOD(ROW($A31)-6,12)+13,64+MOD(COLUMN(B$1)-2,8),4)) -> Byron 2nd | C31: =INDIRECT.EXT("'..\ladies\[ladies_div4.xls]table calculations'!"&ADDRESS(MOD(ROW($A31)-6,12)+13,64+MOD(COLUMN(C$1)-2,8),4)) -> 4 | D31: =INDIRECT.EXT("'..\ladies\[ladies_div4.xls]table calculations'!"&ADDRESS(MOD(ROW($A31)-6,12)+13,64+MOD(COLUMN(D$1)-2,8),4)) -> 2 | E31: =INDIRECT.EXT("'..\ladies\[ladies_div4.xls]table calculations'!"&ADDRESS(MOD(ROW($A31)-6,12)+13,64+MOD(COLUMN(E$1)-2,8),4)) -> 2 | F31: =INDIRECT.EXT("'..\ladies\[ladies_div4.xls]table calculations'!"&ADDRESS(MOD(ROW($A31)-6,12)+13,64+MOD(COLUMN(F$1)-2,8),4)) -> 23 | G31: =INDIRECT.EXT("'..\ladies\[ladies_div4.xls]table calculations'!"&ADDRESS(MOD(ROW($A31)-6,12)+13,64+MOD(COLUMN(G$1)-2,8),4)) -> 13 | H31: =INDIRECT.EXT("'..\ladies\[ladies_div4.xls]table calculations'!"&ADDRESS(MOD(ROW($A31)-6,12)+13,64+MOD(COLUMN(H$1)-2,8)+2,4)) -> 4
B32: =INDIRECT.EXT("'..\ladies\[ladies_div4.xls]table calculations'!"&ADDRESS(MOD(ROW($A32)-6,12)+13,64+MOD(COLUMN(B$1)-2,8),4)) -> University 2nd | C32: =INDIRECT.EXT("'..\ladies\[ladies_div4.xls]table calculations'!"&ADDRESS(MOD(ROW($A32)-6,12)+13,64+MOD(COLUMN(C$1)-2,8),4)) -> 3 | D32: =INDIRECT.EXT("'..\ladies\[ladies_div4.xls]table calculations'!"&ADDRESS(MOD(ROW($A32)-6,12)+13,64+MOD(COLUMN(D$1)-2,8),4)) -> 2 | E32: =INDIRECT.EXT("'..\ladies\[ladies_div4.xls]table calculations'!"&ADDRESS(MOD(ROW($A32)-6,12)+13,64+MOD(COLUMN(E$1)-2,8),4)) -> 1 | F32: =INDIRECT.EXT("'..\ladies\[ladies_div4.xls]table calculations'!"&ADDRESS(MOD(ROW($A32)-6,12)+13,64+MOD(COLUMN(F$1)-2,8),4)) -> 13 | G32: =INDIRECT.EXT("'..\ladies\[ladies_div4.xls]table calculations'!"&ADDRESS(MOD(ROW($A32)-6,12)+13,64+MOD(COLUMN(G$1)-2,8),4)) -> 14 | H32: =INDIRECT.EXT("'..\ladies\[ladies_div4.xls]table calculations'!"&ADDRESS(MOD(ROW($A32)-6,12)+13,64+MOD(COLUMN(H$1)-2,8)+2,4)) -> 4
B33: =INDIRECT.EXT("'..\ladies\[ladies_div4.xls]table calculations'!"&ADDRESS(MOD(ROW($A33)-6,12)+13,64+MOD(COLUMN(B$1)-2,8),4)) -> Trent Uni Students | C33: =INDIRECT.EXT("'..\ladies\[ladies_div4.xls]table calculations'!"&ADDRESS(MOD(ROW($A33)-6,12)+13,64+MOD(COLUMN(C$1)-2,8),4)) -> 4 | D33: =INDIRECT.EXT("'..\ladies\[ladies_div4.xls]table calculations'!"&ADDRESS(MOD(ROW($A33)-6,12)+13,64+MOD(COLUMN(D$1)-2,8),4)) -> 1 | E33: =INDIRECT.EXT("'..\ladies\[ladies_div4.xls]table calculations'!"&ADDRESS(MOD(ROW($A33)-6,12)+13,64+MOD(COLUMN(E$1)-2,8),4)) -> 3 | F33: =INDIRECT.EXT("'..\ladies\[ladies_div4.xls]table calculations'!"&ADDRESS(MOD(ROW($A33)-6,12)+13,64+MOD(COLUMN(F$1)-2,8),4)) -> 14 | G33: =INDIRECT.EXT("'..\ladies\[ladies_div4.xls]table calculations'!"&ADDRESS(MOD(ROW($A33)-6,12)+13,64+MOD(COLUMN(G$1)-2,8),4)) -> 22 | H33: =INDIRECT.EXT("'..\ladies\[ladies_div4.xls]table calculations'!"&ADDRESS(MOD(ROW($A33)-6,12)+13,64+MOD(COLUMN(H$1)-2,8)+2,4)) -> 2
B34: =INDIRECT.EXT("'..\ladies\[ladies_div4.xls]table calculations'!"&ADDRESS(MOD(ROW($A34)-6,12)+13,64+MOD(COLUMN(B$1)-2,8),4)) -> Beeston Valley 2nd | C34: =INDIRECT.EXT("'..\ladies\[ladies_div4.xls]table calculations'!"&ADDRESS(MOD(ROW($A34)-6,12)+13,64+MOD(COLUMN(C$1)-2,8),4)) -> 3 | D34: =INDIRECT.EXT("'..\ladies\[ladies_div4.xls]table calculations'!"&ADDRESS(MOD(ROW($A34)-6,12)+13,64+MOD(COLUMN(D$1)-2,8),4)) -> 1 | E34: =INDIRECT.EXT("'..\ladies\[ladies_div4.xls]table calculations'!"&ADDRESS(MOD(ROW($A34)-6,12)+13,64+MOD(COLUMN(E$1)-2,8),4)) -> 2 | F34: =INDIRECT.EXT("'..\ladies\[ladies_div4.xls]table calculations'!"&ADDRESS(MOD(ROW($A34)-6,12)+13,64+MOD(COLUMN(F$1)-2,8),4)) -> 8 | G34: =INDIRECT.EXT("'..\ladies\[ladies_div4.xls]table calculations'!"&ADDRESS(MOD(ROW($A34)-6,12)+13,64+MOD(COLUMN(G$1)-2,8),4)) -> 19 | H34: =INDIRECT.EXT("'..\ladies\[ladies_div4.xls]table calculations'!"&ADDRESS(MOD(ROW($A34)-6,12)+13,64+MOD(COLUMN(H$1)-2,8)+2,4)) -> 2
B35: =INDIRECT.EXT("'..\ladies\[ladies_div4.xls]table calculations'!"&ADDRESS(MOD(ROW($A35)-6,12)+13,64+MOD(COLUMN(B$1)-2,8),4)) -> St Giles 2nd | C35: =INDIRECT.EXT("'..\ladies\[ladies_div4.xls]table calculations'!"&ADDRESS(MOD(ROW($A35)-6,12)+13,64+MOD(COLUMN(C$1)-2,8),4)) -> 2 | D35: =INDIRECT.EXT("'..\ladies\[ladies_div4.xls]table calculations'!"&ADDRESS(MOD(ROW($A35)-6,12)+13,64+MOD(COLUMN(D$1)-2,8),4)) -> 0 | E35: =INDIRECT.EXT("'..\ladies\[ladies_div4.xls]table calculations'!"&ADDRESS(MOD(ROW($A35)-6,12)+13,64+MOD(COLUMN(E$1)-2,8),4)) -> 2 | F35: =INDIRECT.EXT("'..\ladies\[ladies_div4.xls]table calculations'!"&ADDRESS(MOD(ROW($A35)-6,12)+13,64+MOD(COLUMN(F$1)-2,8),4)) -> 2 | G35: =INDIRECT.EXT("'..\ladies\[ladies_div4.xls]table calculations'!"&ADDRESS(MOD(ROW($A35)-6,12)+13,64+MOD(COLUMN(G$1)-2,8),4)) -> 16 | H35: =INDIRECT.EXT("'..\ladies\[ladies_div4.xls]table calculations'!"&ADDRESS(MOD(ROW($A35)-6,12)+13,64+MOD(COLUMN(H$1)-2,8)+2,4)) -> 0
B36: =INDIRECT.EXT("'..\ladies\[ladies_div4.xls]table calculations'!"&ADDRESS(MOD(ROW($A36)-6,12)+13,64+MOD(COLUMN(B$1)-2,8),4)) -> _ | C36: =INDIRECT.EXT("'..\ladies\[ladies_div4.xls]table calculations'!"&ADDRESS(MOD(ROW($A36)-6,12)+13,64+MOD(COLUMN(C$1)-2,8),4)) -> _ | D36: =INDIRECT.EXT("'..\ladies\[ladies_div4.xls]table calculations'!"&ADDRESS(MOD(ROW($A36)-6,12)+13,64+MOD(COLUMN(D$1)-2,8),4)) -> _ | E36: =INDIRECT.EXT("'..\ladies\[ladies_div4.xls]table calculations'!"&ADDRESS(MOD(ROW($A36)-6,12)+13,64+MOD(COLUMN(E$1)-2,8),4)) -> _ | F36: =INDIRECT.EXT("'..\ladies\[ladies_div4.xls]table calculations'!"&ADDRESS(MOD(ROW($A36)-6,12)+13,64+MOD(COLUMN(F$1)-2,8),4)) -> _ | G36: =INDIRECT.EXT("'..\ladies\[ladies_div4.xls]table calculations'!"&ADDRESS(MOD(ROW($A36)-6,12)+13,64+MOD(COLUMN(G$1)-2,8),4)) -> _ | H36: =INDIRECT.EXT("'..\ladies\[ladies_div4.xls]table calculations'!"&ADDRESS(MOD(ROW($A36)-6,12)+13,64+MOD(COLUMN(H$1)-2,8)+2,4)) -> _
B37: =INDIRECT.EXT("'..\ladies\[ladies_div4.xls]table calculations'!"&ADDRESS(MOD(ROW($A37)-6,12)+13,64+MOD(COLUMN(B$1)-2,8),4)) -> _ | C37: =INDIRECT.EXT("'..\ladies\[ladies_div4.xls]table calculations'!"&ADDRESS(MOD(ROW($A37)-6,12)+13,64+MOD(COLUMN(C$1)-2,8),4)) -> _ | D37: =INDIRECT.EXT("'..\ladies\[ladies_div4.xls]table calculations'!"&ADDRESS(MOD(ROW($A37)-6,12)+13,64+MOD(COLUMN(D$1)-2,8),4)) -> _ | E37: =INDIRECT.EXT("'..\ladies\[ladies_div4.xls]table calculations'!"&ADDRESS(MOD(ROW($A37)-6,12)+13,64+MOD(COLUMN(E$1)-2,8),4)) -> _ | F37: =INDIRECT.EXT("'..\ladies\[ladies_div4.xls]table calculations'!"&ADDRESS(MOD(ROW($A37)-6,12)+13,64+MOD(COLUMN(F$1)-2,8),4)) -> _ | G37: =INDIRECT.EXT("'..\ladies\[ladies_div4.xls]table calculations'!"&ADDRESS(MOD(ROW($A37)-6,12)+13,64+MOD(COLUMN(G$1)-2,8),4)) -> _ | H37: =INDIRECT.EXT("'..\ladies\[ladies_div4.xls]table calculations'!"&ADDRESS(MOD(ROW($A37)-6,12)+13,64+MOD(COLUMN(H$1)-2,8)+2,4)) -> _